,Created_at,Text,Clean Text,Lang,Favourite_count,Retweet_count,Fecha creacion,Followers,Verificado,Cantidad Fav,País,Coordenadas
791,2022-03-08 23:52:26+00:00,RT @ricardovalp: La diferencia entre Maduro y Bukele son más de 750 mil barriles de petroleo al día. Bukele solo les puede ofrecer deudas y…, la diferencia entre maduro y bukele son m s de 750 mil barriles de petroleo al d a  bukele solo les puede ofrecer deudas y ,es,0,159,2021-07-19 22:23:39+00:00,15,False,4070,,
804,2022-03-08 23:52:16+00:00,RT @BryanAlbarino: Profecía de Trump en 2020: “Si Biden gana van a pagar por la gasolina al menos 7 dólares por galón”. Y se cumplió no más…, profec a de trump en 2020   si biden gana van a pagar por la gasolina al menos 7 d lares por gal n   y se cumpli  no m s ,es,0,360,2017-02-03 17:26:26+00:00,37,False,2547,,
808,2022-03-08 23:52:14+00:00,"RT @NNGG_Es: ¿No puedes pagar la luz?

20 mil millones de euros en políticas feministas.

¿No puedes pagar el gas?

20 mil millones de euro…",  no puedes pagar la luz   20 mil millones de euros en pol ticas feministas    no puedes pagar el gas   20 mil millones de euro ,es,0,274,2016-04-20 23:39:42+00:00,45,False,29186,"Parla, España",
812,2022-03-08 23:52:12+00:00,RT @rescatemostorr: Y la gasolina de $10 ?, y la gasolina de  10  ,es,0,17,2020-11-24 05:10:00+00:00,341,False,65861,"Benito Juárez, Distrito Federa",
814,2022-03-08 23:52:12+00:00,"RT @gladyscorral38: @MartnPeiretti1 @gladyscorral38 RT Excelente Noticion.,se les acabo la gasolina a los bravucones,Grande Putin.",     rt excelente noticion  se les acabo la gasolina a los bravucones grande putin ,es,0,1,2020-08-15 11:56:02+00:00,63,False,4111,,
817,2022-03-08 23:52:11+00:00,"@lordominos @aracelibs @m_ebrard Los tarados no saben que se subsidia la gasolina en México ,verdad Edgar ? 

😅😅😅😂😂😂",      ebrard los tarados no saben que se subsidia la gasolina en m xico  verdad edgar           ,es,0,0,2017-12-07 23:54:10+00:00,367,False,33504,"Puebla, México",
823,2022-03-08 23:52:08+00:00,"@HeMaNe @Oscarlfontan Está cabrón, es por culpa de la gasolina con las que riegan los arbolitos para que crezcan rápido 🤷🏻‍♂️🤣🤣",    est  cabr n  es por culpa de la gasolina con las que riegan los arbolitos para que crezcan r pido        ,es,2,0,2011-03-09 16:47:46+00:00,3679,False,43697,Puerto Rico,
827,2022-03-08 23:52:07+00:00,"A Q40 el galón de gasolina!? 😱

Qué no les extrañe que llegue a Q45 .. 😬",a q40 el gal n de gasolina      qu  no les extra e que llegue a q45     ,es,6,0,2021-02-25 14:16:54+00:00,2021,False,36410,,
830,2022-03-08 23:52:06+00:00,"RT @MDGA12: Pinches derechangos critican a AMLO pero bien que son beneficiados de sus logros, como no subir la gasolina o la luz.🙄
#AMLOSeQ…", pinches derechangos critican a amlo pero bien que son beneficiados de sus logros  como no subir la gasolina o la luz    amloseq ,es,0,23,2020-04-12 17:07:11+00:00,283,False,23088,"Aquí, donde estoy ahorita",
831,2022-03-08 23:52:05+00:00,"El alza histórica que está teniendo el galón de gasolina tiene en aprietos a todos los que se lucran de transportar pasajeros o entregar pedidos, ya que el presupuesto que destinaban para llenar el tanque se ha vuelto insuficiente por los precios actuales. https://t.co/oNiCtf972D",el alza hist rica que est  teniendo el gal n de gasolina tiene en aprietos a todos los que se lucran de transportar pasajeros o entregar pedidos  ya que el presupuesto que destinaban para llenar el tanque se ha vuelto insuficiente por los precios actuales   ,es,0,0,2010-10-06 20:33:00+00:00,28568,True,3620,Houston,
832,2022-03-08 23:52:05+00:00,"@jgnaredo Haber si sabes que la compra de esa refinería fue condicionada el petróleo con el que se produce las gasolina es comprado a shell,te recuerdo que aún con las 2 refinerías mediocres, no dan el total de la gasolina que consume nuestro país te informo 6 de 10 litros son extranjeros",  haber si sabes que la compra de esa refiner a fue condicionada el petr leo con el que se produce las gasolina es comprado a shell te recuerdo que a n con las 2 refiner as mediocres  no dan el total de la gasolina que consume nuestro pa s te informo 6 de 10 litros son extranjeros,es,0,0,2020-06-10 05:49:06+00:00,25,False,1577,,
836,2022-03-08 23:52:04+00:00,RT @Kiko6919: @AlanFCuba @CiberCuba @Ana_Hurtado86 @KattyrenR @AdrianaRojasQba @BrendaGlezA1 @Habane1Guerrera @AlexDelRiocuba @CamilaGzlez3…,       hurtado86             ,es,0,6,2021-10-05 14:00:46+00:00,3213,False,23535,,
838,2022-03-08 23:52:03+00:00,"RT @CarlosAJimnez4: 3.2 € el litro de gasolina en Europa..
4,000 € el megavatio de electricidad.
Precios inaccesibles para la mayoría... Pe…", 3 2   el litro de gasolina en europa   4 000   el megavatio de electricidad  precios inaccesibles para la mayor a    pe ,es,0,163,2021-08-05 03:09:19+00:00,2772,False,151705,Ciudad de México,
842,2022-03-08 23:51:59+00:00,"Como se llamaría este titular, si fuera en Venezuela la cosa, practiquemos: Se prendió Caracas😱 Venezuela se moviliza por subida de la gasolina 😱 el réeegimen contra la pared 😱 Se hacerca la caída del tirano😱 locura mediática 🤣🤣💥 @dcabellor @NicolasMaduro @carvajalinopp https://t.co/4R6MuRAqrZ",como se llamar a este titular  si fuera en venezuela la cosa  practiquemos  se prendi  caracas  venezuela se moviliza por subida de la gasolina   el r eegimen contra la pared   se hacerca la ca da del tirano  locura medi tica            ,es,0,0,2018-11-07 10:33:22+00:00,141,False,23,Venezuela,
844,2022-03-08 23:51:58+00:00,RT @ViejoCascarrab4: A como va el precio de la gasolina tendré que verme en la necesidad de sacar al poderosisimo! https://t.co/QvYktTdTRe, a como va el precio de la gasolina tendr  que verme en la necesidad de sacar al poderosisimo   ,es,0,71,2010-12-26 05:44:04+00:00,1041,False,23992,"Guatemala, Guatemala ",
849,2022-03-08 23:51:57+00:00,Y yo que me quejaba cuando la gasolina estaba a 0.85x L 🤡🤡🤡🤡,y yo que me quejaba cuando la gasolina estaba a 0 85x l     ,es,0,0,2020-06-15 19:47:08+00:00,173,False,7120,Panamá,
850,2022-03-08 23:51:56+00:00,RT @PedroVictor9210: Todo el mundo preocupado por el precio de la gasolina en USA y yo aquí pensando que el aceite está a 500 pesos en #Cub…, todo el mundo preocupado por el precio de la gasolina en usa y yo aqu  pensando que el aceite est  a 500 pesos en  cub ,es,0,31,2016-11-02 21:37:01+00:00,167,False,10113,,
853,2022-03-08 23:51:55+00:00,"RT @gotham_angel: @linda_dimitrov Por muchas de esas razones, peeo principalmente porque el crudo mex no sirve para refinar y producir comb…",   dimitrov por muchas de esas razones  peeo principalmente porque el crudo mex no sirve para refinar y producir comb ,es,0,9,2011-05-07 00:05:50+00:00,238,False,25199,Mexico City,
854,2022-03-08 23:51:55+00:00,"RT @alonsormarca: Quién se puede creer que los sablazos que estamos sufriendo la gente de a pie desde hace meses en la factura de la luz, d…", qui n se puede creer que los sablazos que estamos sufriendo la gente de a pie desde hace meses en la factura de la luz  d ,es,0,73,2014-05-03 12:36:27+00:00,230,False,14400,,
855,2022-03-08 23:51:54+00:00,RT @Amiquemecontais: Al precio que está la gasolina es imposible salir a la calle a quemar contenedores., al precio que est  la gasolina es imposible salir a la calle a quemar contenedores ,es,0,15,2020-11-08 10:35:27+00:00,3,False,11,,
862,2022-03-08 23:51:49+00:00,RT @JosPastr: ¿Estamos dispuestos a pagar 300 € mensuales en la factura de la luz y 3 € por el litro de gasolina para asfixiar a la dictadu…,  estamos dispuestos a pagar 300   mensuales en la factura de la luz y 3   por el litro de gasolina para asfixiar a la dictadu ,es,0,988,2009-05-26 09:48:58+00:00,3942,False,380,Islas Canallas-Españistán,
864,2022-03-08 23:51:47+00:00,"@nuriapiera Desde mañana le digo a la que duerme conmigo que pagué ella, Internet, teléfonos, renta, gasolina, y que valla al supermercado. Si son buenas pagando.",  desde ma ana le digo a la que duerme conmigo que pagu  ella  internet  tel fonos  renta  gasolina  y que valla al supermercado  si son buenas pagando ,es,2,0,2020-03-06 01:10:16+00:00,141,False,9487,"Nueva York, USA",
866,2022-03-08 23:51:46+00:00,"RT @CMonteroOficial: Nunca estuvo tan cara💲 la gasolina ⛽️ en Estados Unidos🇺🇸 :  $4.173 el galón, según promedio nacional de @AAA_Travel", nunca estuvo tan cara  la gasolina    en estados unidos       4 173 el gal n  seg n promedio nacional de   travel,es,0,289,2019-09-03 21:06:26+00:00,219,False,5285,,
869,2022-03-08 23:51:46+00:00,"RT @CARLOSEES: -Hay que defender el #litio
-¿ya hay medicinas? ¿Ya vacunaron a los menores de edad? ¿Ya frenaron la violencia? ¿Ya comproba…",  hay que defender el  litio   ya hay medicinas   ya vacunaron a los menores de edad   ya frenaron la violencia   ya comproba ,es,0,6,2014-07-17 15:38:31+00:00,2909,False,289639,"Coyoacán, Distrito Federal",
872,2022-03-08 23:51:45+00:00,RT @Filimon92692617: @SinLinea_Mx Y YA BAJO LA GASOLINA ???YA BAJO LA GASOLINA?????....O LES FALLO ???????...PREGUNTO YA BAJO LA GASOLINA??…,   mx y ya bajo la gasolina    ya bajo la gasolina         o les fallo           pregunto ya bajo la gasolina   ,es,0,3,2010-05-26 14:13:14+00:00,84642,False,269451,"México, D. F. ",
874,2022-03-08 23:51:44+00:00,"RT @ArturoVilla_: Él trabaja 12h al día por un salario precario. Le quitan la mitad en impuestos. Le han subido la luz, la gasolina y el pa…",  l trabaja 12h al d a por un salario precario  le quitan la mitad en impuestos  le han subido la luz  la gasolina y el pa ,es,0,330,2012-11-02 11:42:01+00:00,2457,False,34437,,
878,2022-03-08 23:51:42+00:00,Que webada quedarse sin gasolina en subida y lo peor tener el brazo mal sin poder empujar 😩,que webada quedarse sin gasolina en subida y lo peor tener el brazo mal sin poder empujar  ,es,0,0,2012-06-28 22:10:00+00:00,33,False,627,,
880,2022-03-08 23:51:42+00:00,RT @jesusmedinae: No es una buena opción emigrar para Europa en estos momentos. El gas natural supera los $2200 por 1000 metros cúbicos un…, no es una buena opci n emigrar para europa en estos momentos  el gas natural supera los  2200 por 1000 metros c bicos un ,es,0,439,2012-10-30 01:13:27+00:00,329,False,16363,"Valencia, Venezuela",
883,2022-03-08 23:51:41+00:00,RT @Maria12051990: @IgualdadGob @IreneMontero ¿Con que se paga otra vez tus diarreas mentales y tus fiestas de 🤡?¿ con los impuestos de la…,      con que se paga otra vez tus diarreas mentales y tus fiestas de     con los impuestos de la ,es,0,66,2021-05-04 20:55:04+00:00,2590,False,42908,Mi casa,
889,2022-03-08 23:51:36+00:00,RT @eddyromeror: Continúa la escasez de gasolina en el estado zulia y cortes de luz de 4 a 5 horas, contin a la escasez de gasolina en el estado zulia y cortes de luz de 4 a 5 horas,es,0,12,2010-09-11 02:37:06+00:00,634,False,5902,Edo.Zulia VEN,
891,2022-03-08 23:51:36+00:00,"""No podemos hacer mucho en este momento"": Biden advierte que los precios de la gasolina subirán en EE.UU. debido a las sanciones contra Rusia https://t.co/k0Erc7A04X", no podemos hacer mucho en este momento   biden advierte que los precios de la gasolina subir n en ee uu  debido a las sanciones contra rusia  ,es,0,0,2011-12-27 19:31:04+00:00,42,False,0,Entre Europa y América.,
892,2022-03-08 23:51:35+00:00,"RT @Begoo64261129: Dice la soplagaitas Chiquita Montera de la Calzada, Menestra de Hacienda, que si te parece que la gasolina está cara, te…", dice la soplagaitas chiquita montera de la calzada  menestra de hacienda  que si te parece que la gasolina est  cara  te ,es,0,15,2021-08-02 21:45:06+00:00,234,False,4716,"Zaragoza, España",
893,2022-03-08 23:51:35+00:00,"Algunos consejos para ahorrar #gasolina en el sur de #Florida  

https://t.co/s0aYG1Fcyp…",algunos consejos para ahorrar  gasolina en el sur de  florida     ,es,0,0,2013-07-02 03:23:13+00:00,174877,False,13,Miami - Madrid - Buenos Aires,
894,2022-03-08 23:51:35+00:00,"Algunos consejos para ahorrar #gasolina en el sur de #Florida  

https://t.co/Ol922cWUgY…",algunos consejos para ahorrar  gasolina en el sur de  florida     ,es,0,0,2013-05-26 02:17:15+00:00,326184,False,14467,Cartagena de Indias,
895,2022-03-08 23:51:35+00:00,"Maduro y sus 40 Ladrones se a metido en la cabeza que somos unos ciudadanos sumisos y que estamos acostumbrados a que ellos hagan lo que les de la gana con el País ahora pretenden eliminar la Gasolina subsidiada. Contra eso utilicemos las redes  Twitter, WhatsApp, YouTube.",maduro y sus 40 ladrones se a metido en la cabeza que somos unos ciudadanos sumisos y que estamos acostumbrados a que ellos hagan lo que les de la gana con el pa s ahora pretenden eliminar la gasolina subsidiada  contra eso utilicemos las redes  twitter  whatsapp  youtube ,es,0,1,2020-10-03 19:44:03+00:00,242,False,1260,,
897,2022-03-08 23:51:33+00:00,"Ahora asignan el cupo de la gasolina por los 2 últimos dígitos de la cédula ! , ...todo es un control ,un peo, un guasipati ,dentro de poco se echara dependiendo del día en que te llegue el agua ! NJoda 😏",ahora asignan el cupo de la gasolina por los 2  ltimos d gitos de la c dula        todo es un control  un peo  un guasipati  dentro de poco se echara dependiendo del d a en que te llegue el agua   njoda  ,es,51,9,2019-01-21 16:47:32+00:00,12634,False,92199,ucrania,
899,2022-03-08 23:51:32+00:00,"RT @achuchones: @IgualdadGob @IreneMontero Se dieron un golpe en la cabeza?
Electricidad, gasolina, fronteras
..
Cuántas mini nucleares se…",     se dieron un golpe en la cabeza  electricidad  gasolina  fronteras    cu ntas mini nucleares se ,es,0,30,2021-05-04 20:55:04+00:00,2590,False,42908,Mi casa,
900,2022-03-08 23:51:31+00:00,"""Bueno, si sube el precio de la gasolina se fomenta el uso del transporte público"":

La guagua de mi barrio pasando cada 3h, haciendo un recorrido de 1h (en coche tardo 10mint) y teniendo la última guagua a las 20.30 🤡🤡🤡🤡", bueno  si sube el precio de la gasolina se fomenta el uso del transporte p blico    la guagua de mi barrio pasando cada 3h  haciendo un recorrido de 1h  en coche tardo 10mint  y teniendo la  ltima guagua a las 20 30     ,es,8,1,2018-07-03 01:30:32+00:00,180,False,3247,,
903,2022-03-08 23:51:30+00:00,"RT @LArturoHerrera: Pésima idea subsidiar el precio de la gasolina en México, en la frontera se van a aprovechar de eso... Vamos a estar fi…", p sima idea subsidiar el precio de la gasolina en m xico  en la frontera se van a aprovechar de eso    vamos a estar fi ,es,0,161,2015-09-20 16:13:55+00:00,537,False,126371,,
904,2022-03-08 23:51:30+00:00,"*NOSOTROS. PROMEDIO NACIONAL POR GALÓN DE GASOLINA SUBE A $4.173, NIVEL MÁS ALTO REGISTRADO

🇺🇸🇺🇸 https://t.co/IOlOhO9meO", nosotros  promedio nacional por gal n de gasolina sube a  4 173  nivel m s alto registrado        ,es,0,0,2021-10-17 14:54:13+00:00,189,False,2164,,
908,2022-03-08 23:51:29+00:00,RUSIA ES TODO.....GAS Y PETROLEO...Y EEUU NO LES VA A GARANTIZAR LA GASOLINA PARA SUS VEHICULOS Y TRANSPORTE PESADO...JAMAS https://t.co/H7Ykz2SydL,rusia es todo     gas y petroleo   y eeuu no les va a garantizar la gasolina para sus vehiculos y transporte pesado   jamas  ,es,2,0,2011-04-01 09:39:08+00:00,31512,False,46018,JUAN.DIAZ561@GMAIL.COM,
909,2022-03-08 23:51:28+00:00,"#ATENCIÓN | En #Ecuador la guerra energética entre las mayores potencias del mundo trae más ingresos petroleros, pero encarecerá la gasolina súper. » https://t.co/7PLlKyLWrX", atenci n   en  ecuador la guerra energ tica entre las mayores potencias del mundo trae m s ingresos petroleros  pero encarecer  la gasolina s per     ,es,6,1,2018-10-15 11:48:09+00:00,1075757,True,244,Quito,
919,2022-03-08 23:51:20+00:00,"@julesme2 Así me siento cuando le pongo gasolina a mi camioneta
Jajaja",  as  me siento cuando le pongo gasolina a mi camioneta jajaja,es,2,1,2021-10-02 02:59:15+00:00,304,False,2358,Estoy donde quieras que esté.,
924,2022-03-08 23:51:14+00:00,RT @carlitoscofr1: Lo de la luz y la gasolina en España es de auténtica coña. Y lo peor esque poco se habla para ls barbaridad que están ha…, lo de la luz y la gasolina en espa a es de aut ntica co a  y lo peor esque poco se habla para ls barbaridad que est n ha ,es,0,5,2013-02-02 14:45:06+00:00,423,False,7366,𝐒𝐞𝐯𝐢𝐥𝐥𝐚 💃,
928,2022-03-08 23:51:10+00:00,"@gigiesssp Epa pero es que así me dijo mi mamá, ahora tendremos que echar gasolina ahí pero en los otros lados subió demasiado, y yo no se nada, yo vengo llegando pues.",  epa pero es que as  me dijo mi mam   ahora tendremos que echar gasolina ah  pero en los otros lados subi  demasiado  y yo no se nada  yo vengo llegando pues ,es,1,0,2009-08-14 10:39:47+00:00,2679,False,12425,,
931,2022-03-08 23:51:10+00:00,"@hugomanchon @elindepcom Y digo yo, qué estarán pensando los votantes del PSOE? O también están subvencionados? Pagan la luz, la gasolina, la comida como yo... o eso creo.",    y digo yo  qu  estar n pensando los votantes del psoe  o tambi n est n subvencionados  pagan la luz  la gasolina  la comida como yo    o eso creo ,es,0,0,2017-06-15 06:09:19+00:00,23,False,2086,España,
934,2022-03-08 23:51:06+00:00,"RT @aurelioorozco2: La gasolina sigue subiendo cada día en California casi 7 dólares por galón.
Es insoportable.", la gasolina sigue subiendo cada d a en california casi 7 d lares por gal n  es insoportable ,es,0,10,2011-01-26 03:49:31+00:00,722,False,62920,"Guadalajara, Jalisco",
935,2022-03-08 23:51:05+00:00,La gasolina cara y un calor del infierno. Vivir= pésimo servicio.,la gasolina cara y un calor del infierno  vivir  p simo servicio ,es,1,0,2019-11-25 15:26:07+00:00,150,False,5864,,
936,2022-03-08 23:51:04+00:00,"RT @cosme_churruca: El precio de la luz y de la gasolina, más altos de la historia, pero la verdadera prioridad del gobierno es gastarse 20…", el precio de la luz y de la gasolina  m s altos de la historia  pero la verdadera prioridad del gobierno es gastarse 20 ,es,0,15,2018-08-03 14:41:20+00:00,10934,False,9636,"Canarias,estas invitad@.",
938,2022-03-08 23:51:04+00:00,"RT @InigomontesRP: Te imaginas tener cojones a soltarme alguna mierda cuando has vivido tus años mozos con la gasolina a menos de 1 euros,…", te imaginas tener cojones a soltarme alguna mierda cuando has vivido tus a os mozos con la gasolina a menos de 1 euros  ,es,0,14,2010-09-07 21:31:11+00:00,745,False,123526,Andalucía,
943,2022-03-08 23:51:00+00:00,RT @Vprimero: Los salarios en bolívares y la gasolina en dólares. Tremendo socialismo. Pa´que más ..., los salarios en bol vares y la gasolina en d lares  tremendo socialismo  pa que m s    ,es,0,73,2013-08-17 00:03:24+00:00,189,False,7000,,
944,2022-03-08 23:50:59+00:00,"@manriquehector Eso es verdad, igual lo que hizo con el pauperrimo aumento y después dolarizar todas las bombas en Mcpio Guanare, y se debe pagar en dólares la gasolina y los que dependemos de Admon publica ganamos en Bolivares",  eso es verdad  igual lo que hizo con el pauperrimo aumento y despu s dolarizar todas las bombas en mcpio guanare  y se debe pagar en d lares la gasolina y los que dependemos de admon publica ganamos en bolivares,es,0,0,2013-11-01 22:05:55+00:00,37,False,2911,Venezuela,
955,2022-03-08 23:50:51+00:00,"El precio de la gasolina en Estados Unidos alcanzó este martes un récord absoluto con un valor medio de 4,173 dólares el galón. https://t.co/cQzmAXDH1g",el precio de la gasolina en estados unidos alcanz  este martes un r cord absoluto con un valor medio de 4 173 d lares el gal n   ,es,18,13,2009-09-13 19:01:54+00:00,62865,True,29509,"Miami, FL",
956,2022-03-08 23:50:50+00:00,"@Dieguitob @leyderlopez83 @historia_bogota @CocaColaCol Al inicio de los años 90 Colmotores ofrece un bus urbano a motor diésel y de emplazamiento trasero, el LT-500, que nunca tuvo la cuota de mercado esperada pero que debía reemplazar la motorización a gasolina en ese segmento.",      bogota   al inicio de los a os 90 colmotores ofrece un bus urbano a motor di sel y de emplazamiento trasero  el lt 500  que nunca tuvo la cuota de mercado esperada pero que deb a reemplazar la motorizaci n a gasolina en ese segmento ,es,0,0,2012-10-30 06:42:20+00:00,361,False,28917,,
958,2022-03-08 23:50:49+00:00,"RT @forlanista_: Dios mío de mi vida. Inflación del 10%, 2€ la gasolina, precio récord de la luz. A la gente le da igual, prefieren hablar…", dios m o de mi vida  inflaci n del 10   2  la gasolina  precio r cord de la luz  a la gente le da igual  prefieren hablar ,es,0,1075,2011-03-27 22:34:19+00:00,687,False,50128,Zaragoza - España,
960,2022-03-08 23:50:49+00:00,"RT @Pepe__Torres: IPC al 7%, gasolina a 2€/l, MWh a 700 pavos y 20 mil millones para la Montero y sus chorradas.
Mira, si ya no salimos a l…", ipc al 7   gasolina a 2  l  mwh a 700 pavos y 20 mil millones para la montero y sus chorradas  mira  si ya no salimos a l ,es,0,521,2021-09-14 15:29:18+00:00,255,False,19486,En lo más profundo del bosque,
964,2022-03-08 23:50:44+00:00,"Vox convoca movilizaciones para el 19 de marzo contra la subida de ""la luz, la gasolina y los suministros básicos"" en medio de la guerra https://t.co/53DpthiXSQ 👍👍👍👍👍bravo!!!! por fin alguien convoca!!!!",vox convoca movilizaciones para el 19 de marzo contra la subida de  la luz  la gasolina y los suministros b sicos  en medio de la guerra        bravo     por fin alguien convoca    ,es,0,0,2020-03-28 19:22:51+00:00,143,False,8751,,
969,2022-03-08 23:50:42+00:00,@Robmart_Esp @JuanShepardo @NoSoyNormalbola Yo creo que es porque la gasolina está cara para ir incendiando edificios,  esp     yo creo que es porque la gasolina est  cara para ir incendiando edificios,es,0,0,2020-12-21 11:26:27+00:00,8,False,1071,,
974,2022-03-08 23:50:39+00:00,Así abunda más la gasolina 😩 https://t.co/ceAHie0OA7,as  abunda m s la gasolina    ,es,9,0,2015-11-26 16:23:46+00:00,3089,False,71704,"San Salvador, El Salvador",
977,2022-03-08 23:50:37+00:00,"RT @Marianomb: De verdad que si, como dijo Lula da Silva ""Es un regalo para México tener a AMLO de Pdte.

El precio de la gasolina en USA 3…", de verdad que si  como dijo lula da silva  es un regalo para m xico tener a amlo de pdte   el precio de la gasolina en usa 3 ,es,0,27,2019-11-14 18:42:34+00:00,736,False,150191,,
978,2022-03-08 23:50:36+00:00,"RT @AntonioGuillenH: ⚠️Millones de españoles en la ruina, 544,98 euros/MWh con tramos en 700€ y con el precio de la gasolina en casi dos eu…",   millones de espa oles en la ruina  544 98 euros mwh con tramos en 700  y con el precio de la gasolina en casi dos eu ,es,0,66,2013-03-26 16:42:55+00:00,585,False,28633,,
980,2022-03-08 23:50:35+00:00,"Todos pendientes de la guerra y no se percatan que pondremos gasolina por número de C.I además la mayoría de las estaciones de servicios sin subsidio.
Primero el covi y ahora la guerra y caemos como pendejos.",todos pendientes de la guerra y no se percatan que pondremos gasolina por n mero de c i adem s la mayor a de las estaciones de servicios sin subsidio  primero el covi y ahora la guerra y caemos como pendejos ,es,1,2,2013-03-18 02:13:37+00:00,580,False,30695,Caracas,
981,2022-03-08 23:50:34+00:00,RT @Don_Patriota1: El precio del petróleo está por las nubes y Gustavo Petro quiere acabarlo para que haya escasez de gasolina en Colombia…, el precio del petr leo est  por las nubes y gustavo petro quiere acabarlo para que haya escasez de gasolina en colombia ,es,0,106,2019-10-02 13:20:42+00:00,498,False,7590,,
984,2022-03-08 23:50:34+00:00,"RT @abrahamdlatorre: Ya llega el felón de @sanchezcastejon, de su viaje . Acaba de pasar el puma!! Son las 22:19 y no hay tráfico en Madrid…", ya llega el fel n de    de su viaje   acaba de pasar el puma   son las 22 19 y no hay tr fico en madrid ,es,0,11,2014-09-08 19:16:11+00:00,575,False,11312,garaje la moncloa,
992,2022-03-08 23:50:28+00:00,"RT @Pajaropolitico: La policía de CDMX está decomisando objetos sospechosos antes de la marcha del #8M, confirmó la @SSC_CDMX.

A una perso…", la polic a de cdmx est  decomisando objetos sospechosos antes de la marcha del  8m  confirm  la   cdmx   a una perso ,es,0,21,2011-04-29 03:21:49+00:00,1896,False,27827,Durango,
995,2022-03-08 23:50:25+00:00,RT @MejoresTwits: La semana que viene en todas las gasolineras #gasolina https://t.co/72ViwG87aV, la semana que viene en todas las gasolineras  gasolina  ,es,0,229,2013-08-11 16:46:14+00:00,231,False,53157,"Sevilla, España",
1003,2022-03-08 23:50:22+00:00,"RT @Tercio_t71: Ayudas para bajar el precio la luz?
No
Para bajar el precio del gas?
No
Para bajar el precio de la gasolina?
No
Para constr…", ayudas para bajar el precio la luz  no para bajar el precio del gas  no para bajar el precio de la gasolina  no para constr ,es,0,42,2012-02-12 00:23:55+00:00,23,False,3795,W1J 5BQ,
1012,2022-03-08 23:50:18+00:00,"@juncalssolano Subsidiamos la gasolina no importando que el estado se quede en la quiebra ,para que el señor no caiga en sus encuestas. 

Así no ANLO ......",  subsidiamos la gasolina no importando que el estado se quede en la quiebra  para que el se or no caiga en sus encuestas    as  no anlo       ,es,3,0,2017-12-07 23:54:10+00:00,367,False,33504,"Puebla, México",
1013,2022-03-08 23:50:18+00:00,"RT @Ronald1969HT: Presidente de EE.UU. Joe Biden, admitió este martes que los precios de la gasolina subirán para el estadounidense común d…", presidente de ee uu  joe biden  admiti  este martes que los precios de la gasolina subir n para el estadounidense com n d ,es,0,18,2020-05-30 21:14:22+00:00,577,False,9189,,
