,Created_at,Text,Clean Text,Lang,Favourite_count,Retweet_count,Fecha creacion,Followers,Verificado,Cantidad Fav,País,Coordenadas
3439,2022-03-08 23:29:09+00:00,"@IngAlejandroR1 @MsMary__ @satyagraha_yo Mentiras las d una oposición falsa,hipócrita,desmemoriada y q cuentan cuentos d manzanitas..Yo no invento como estarás acostumbrado..te paso esta captura d la pag d Shell..Si necesitas q lo traduzca me dices.
Y me quedé esperando sobre datos precisos d costos d  gasolina..SERVIDO https://t.co/P9QNBx6E5s",        yo mentiras las d una oposici n falsa hip crita desmemoriada y q cuentan cuentos d manzanitas  yo no invento como estar s acostumbrado  te paso esta captura d la pag d shell  si necesitas q lo traduzca me dices  y me qued  esperando sobre datos precisos d costos d  gasolina  servido  ,es,0,0,2013-01-25 03:23:18+00:00,663,False,10283,,
3443,2022-03-08 23:29:09+00:00,"¿Os acordáis de Abundio? 
Aquel hombre que vendió su coche para comprar gasolina. 
Pues al final va a resultar que no era tonto, sino un visionario.", os acord is de abundio   aquel hombre que vendi  su coche para comprar gasolina   pues al final va a resultar que no era tonto  sino un visionario ,es,13,2,2020-11-17 21:48:59+00:00,160,False,5884,España,
3450,2022-03-08 23:29:06+00:00,"""No podemos hacer mucho en este momento"": Biden advierte que los precios de la gasolina subirán en EE.UU. debido a las sanciones contra Rusia - RT https://t.co/zxa0qHzZil", no podemos hacer mucho en este momento   biden advierte que los precios de la gasolina subir n en ee uu  debido a las sanciones contra rusia   rt  ,es,0,0,2011-03-25 22:01:50+00:00,641,False,89,El Salvador,
3451,2022-03-08 23:29:06+00:00,"@erickussalas @perezricart Además la gasolina que se importa también sube de precio, ¿Qué tan buena noticia puede ser esta subida en términos generales? Lo dudo...",    adem s la gasolina que se importa tambi n sube de precio   qu  tan buena noticia puede ser esta subida en t rminos generales  lo dudo   ,es,0,0,2009-10-18 19:46:16+00:00,541,False,5291,"Monterrey, Nuevo León",
3454,2022-03-08 23:29:05+00:00,@RodriCalpe Luego se quejarán porque la gasolina está a 2€/L (52% impuestos) o la luz a 700€/Mwh (45% impuestos). ¿¿De dónde se piensan que van a salir los 20KM€??,  luego se quejar n porque la gasolina est  a 2  l  52  impuestos  o la luz a 700  mwh  45  impuestos     de d nde se piensan que van a salir los 20km   ,es,2,0,2011-12-18 19:59:44+00:00,82,False,1750,"Madrid, Spain",
3471,2022-03-08 23:28:57+00:00,"RT @GxlDeFekir: 20 mil millones en ""políticas feministas"". Mientras tanto la gasolina a 2e/litro y la luz a 500e/MWh. Esto es para tirarse…", 20 mil millones en  pol ticas feministas   mientras tanto la gasolina a 2e litro y la luz a 500e mwh  esto es para tirarse ,es,0,17,2014-10-19 18:47:44+00:00,995,False,38125,,
3482,2022-03-08 23:28:49+00:00,Congresistas piden no comprar petróleo a Venezuela ¿Estás de acuerdo con esta medida? https://t.co/vFR828oOlc,congresistas piden no comprar petr leo a venezuela  est s de acuerdo con esta medida   ,es,0,0,2010-09-02 00:26:41+00:00,10602,True,2019,"San Antonio, Texas",
3486,2022-03-08 23:28:48+00:00,"hey siri, cómo hacer gasolina casera",hey siri  c mo hacer gasolina casera,es,2,1,2011-01-26 22:10:30+00:00,1376,False,15570,"Orlando, FL",
3490,2022-03-08 23:28:44+00:00,"Hace una semana exactamente, eche gasolina a 1.699 y hoy he mirado los precios en la misma gasolinera y esta a 1.839. 14 putos centimos ha subido el litro. ESTOY -",hace una semana exactamente  eche gasolina a 1 699 y hoy he mirado los precios en la misma gasolinera y esta a 1 839  14 putos centimos ha subido el litro  estoy  ,es,0,0,2020-03-13 10:33:50+00:00,17,False,442,Rivas-Vaciamadrid,
3492,2022-03-08 23:28:41+00:00,"Se llegó a pensar que,por los importantes cargos que ha tenido Marcelo Ebrard, tenía una pizca de inteligencia...Hoy al comparar en pesos la gasolina de México con la de E.U. sin pensar en la diferencia salarial,demuestra que es un soberano pendejo.....",se lleg  a pensar que por los importantes cargos que ha tenido marcelo ebrard  ten a una pizca de inteligencia   hoy al comparar en pesos la gasolina de m xico con la de e u  sin pensar en la diferencia salarial demuestra que es un soberano pendejo     ,es,1,0,2012-01-24 02:52:37+00:00,485,False,27437,"Houston, Tx",
3493,2022-03-08 23:28:41+00:00,"@rubherdez101205 @aracelibs @m_ebrard Pues si tienes contactos en facebook de USA lee los comentarios estan hechando pestes por el aumento de la gasolina, no comenten nomas porque si",      ebrard pues si tienes contactos en facebook de usa lee los comentarios estan hechando pestes por el aumento de la gasolina  no comenten nomas porque si,es,0,0,2021-11-20 17:52:36+00:00,32,False,350,,
3506,2022-03-08 23:28:37+00:00,"RT @Adriana50844362: De aquí en adelante vamos a trabajar solo para pagar luz, gasolina y comida. Son los nuevos caprichos que nos vamos a…", de aqu  en adelante vamos a trabajar solo para pagar luz  gasolina y comida  son los nuevos caprichos que nos vamos a ,es,0,118,2012-02-25 16:01:48+00:00,612,False,22037,,
3510,2022-03-08 23:28:35+00:00,"RT @yisustarre: Gasolina, comida, servicios; vuelan alto, hasta el infinito y más allá.", gasolina  comida  servicios  vuelan alto  hasta el infinito y m s all  ,es,0,13,2017-08-15 13:41:04+00:00,204,False,17738,Venezuela,
3513,2022-03-08 23:28:34+00:00,"RT @Miguelsoleerr: Tocatelos, la gente muriéndose en Ucrania y esta imbécil gastando dinero en gilipolleces que vuelva al Mercadona de dnd…", tocatelos  la gente muri ndose en ucrania y esta imb cil gastando dinero en gilipolleces que vuelva al mercadona de dnd ,es,0,1,2021-10-27 10:44:09+00:00,66,False,214,,
3516,2022-03-08 23:28:31+00:00,En Zulia se acabó el subsidio: 19 bombas pasaron a vender gasolina dolarizada (DETALLES) https://t.co/vFZgxjw2AI,en zulia se acab  el subsidio  19 bombas pasaron a vender gasolina dolarizada  detalles   ,es,0,0,2015-08-30 15:50:11+00:00,8282,False,592,,
3524,2022-03-08 23:28:26+00:00,RT @ElAguijon_: El precio de la luz y la gasolina en máximos históricos… ¡y el Gobierno anuncia un plan de más de 20.300 millones para femi…, el precio de la luz y la gasolina en m ximos hist ricos   y el gobierno anuncia un plan de m s de 20 300 millones para femi ,es,0,16,2013-09-08 19:05:27+00:00,292,False,98642,,
3525,2022-03-08 23:28:26+00:00,"RT @gustavovecino: Sexagenario muere cuando hacía cola por gasolina en Maracaibo.
Fuente: Es con Usted https://t.co/cby970X3AK vía @esconus…", sexagenario muere cuando hac a cola por gasolina en maracaibo  fuente  es con usted   v a   ,es,0,3,2010-12-03 14:55:12+00:00,4397,False,5520,,
3527,2022-03-08 23:28:26+00:00,"RT @OctavioRuelas9: @mario_dico50 @m_ebrard Que manera de pendeja de justificar esta foto, con el priand la gasolina estuviera a 37 pesos c…",   dico50   ebrard que manera de pendeja de justificar esta foto  con el priand la gasolina estuviera a 37 pesos c ,es,0,1,2010-03-23 19:11:28+00:00,225,False,24842,  mex.,
3528,2022-03-08 23:28:25+00:00,"RT @mranonymouspain: Ya ha llegado la gasolina 98 a 2€/Litro, muchas gracias @PSOE, cada día somos más pobres y el coche ya es un lujo. htt…", ya ha llegado la gasolina 98 a 2  litro  muchas gracias    cada d a somos m s pobres y el coche ya es un lujo  htt ,es,0,2389,2010-10-03 15:06:41+00:00,2260,False,169849,Madrid y Donosti,
3531,2022-03-08 23:28:23+00:00,"RT @Damacansada: @OLMB14 Eso mismo expresé el otro día en un tuit. No creo que el precio de la luz, los alimentos y la gasolina sea soporta…",   eso mismo expres  el otro d a en un tuit  no creo que el precio de la luz  los alimentos y la gasolina sea soporta ,es,0,1,2022-01-11 23:15:53+00:00,539,False,3152,,
3534,2022-03-08 23:28:21+00:00,RT @EmisarioJ: Señores @nayibbukele tocó fondo. Pero ni el periódico Granma de Cuba ni los periódicos de Daniel Ortega ni los periódicos af…, se ores   toc  fondo  pero ni el peri dico granma de cuba ni los peri dicos de daniel ortega ni los peri dicos af ,es,0,27,2013-08-31 20:31:22+00:00,206,False,57738,El Salvador,
3536,2022-03-08 23:28:19+00:00,"¿Cómo será la distribución de gasolina subsidiada? 3 datos para entenderlo

https://t.co/77YcHV0URc", c mo ser  la distribuci n de gasolina subsidiada  3 datos para entenderlo   ,es,1,3,2009-07-09 16:31:24+00:00,164225,True,390,Venezuela,
3546,2022-03-08 23:28:12+00:00,"@andreea_mrtiinz @JorgeRaez1 Si bueno, que sea 4 veces más que el destinado al sistema educativo no tiene nada que ver.
Sin mencionar la gasolina a 2€ y la luz a 500€kwh, es mejor no bajar los impuestos y no destinar dinero aquí, que la gente no pueda llegar a fin de mes.
Estamos salvados entonces. https://t.co/BixrFYIiu3",  mrtiinz   si bueno  que sea 4 veces m s que el destinado al sistema educativo no tiene nada que ver  sin mencionar la gasolina a 2  y la luz a 500 kwh  es mejor no bajar los impuestos y no destinar dinero aqu   que la gente no pueda llegar a fin de mes  estamos salvados entonces   ,es,3,0,2019-05-25 13:59:58+00:00,160,False,6306,,
3547,2022-03-08 23:28:12+00:00,"El MWh puede que se vaya a algo más de 1000 €..

El gas va a subir al doble y la gasolina se pondrá en este mes por encima de 2'50 €/L
.",el mwh puede que se vaya a algo m s de 1000      el gas va a subir al doble y la gasolina se pondr  en este mes por encima de 2 50   l  ,es,2,0,2011-04-09 13:28:38+00:00,4585,False,25282,Sevilla,
3552,2022-03-08 23:28:11+00:00,Yo mañana teniendo que echar gasolina 😭 https://t.co/CcMeS0LngC,yo ma ana teniendo que echar gasolina    ,es,5,0,2011-05-16 18:16:59+00:00,2103,False,6032,"Sevilla, España",
3554,2022-03-08 23:28:10+00:00,RT @colben: Tal y como está la gasolina pueden elegir:  Moët &amp; Chandon o Don Perignon. Y que nos cuente le gobierno que es por la Guerra de…, tal y como est  la gasolina pueden elegir   mo t  amp  chandon o don perignon  y que nos cuente le gobierno que es por la guerra de ,es,0,29,2017-08-12 21:19:16+00:00,3036,False,220192,España,
3556,2022-03-08 23:28:09+00:00,"@Yolanda_Diaz_ Como nos vais a proteger? Con la gasolina a 2 € con la luz a 550, con la inflación disparada? O solo diciendo tonterías que es lo mejor  que hacéis mientras nos robais a dos manos.",  diaz  como nos vais a proteger  con la gasolina a 2   con la luz a 550  con la inflaci n disparada  o solo diciendo tonter as que es lo mejor  que hac is mientras nos robais a dos manos ,es,0,0,2019-02-10 13:31:00+00:00,121,False,4504,España,
3560,2022-03-08 23:28:07+00:00,"RT @LaLupaJudicial: Hay una Guerra en Europa. Más de 2 millones de refugiados y nuestras preocupaciones de hoy son el Día de la mujer, el p…", hay una guerra en europa  m s de 2 millones de refugiados y nuestras preocupaciones de hoy son el d a de la mujer  el p ,es,0,40,2013-02-04 11:40:34+00:00,2397,False,177633,"Granada, España",
3563,2022-03-08 23:28:05+00:00,el ballenoil subiéndome el precio cuando es la gasolina más barata que encuentro https://t.co/xrAkz6KybF,el ballenoil subi ndome el precio cuando es la gasolina m s barata que encuentro  ,es,1,2,2019-10-21 13:37:08+00:00,104,False,12676,,
3566,2022-03-08 23:28:05+00:00,la gasolina o fire y el mecanico se tira bebo 4 pad de freno nuevos urgente,la gasolina o fire y el mecanico se tira bebo 4 pad de freno nuevos urgente,es,0,0,2016-05-27 22:02:04+00:00,2066,False,2712,Puerto Rico 🇵🇷,
3568,2022-03-08 23:28:04+00:00,"@BlondHose @NicolasMaduro @dcabellor El parque automotor venezolano representa un aproximado de 3 millones de vehículos, si tomas en consideración que existen personas con más de un vehículo serían aproximadamente 2 millones de  beneficiado del subsidio de 33 millones de habitantes. https://t.co/Fdh5h66JcT",      el parque automotor venezolano representa un aproximado de 3 millones de veh culos  si tomas en consideraci n que existen personas con m s de un veh culo ser an aproximadamente 2 millones de  beneficiado del subsidio de 33 millones de habitantes   ,es,0,0,2010-05-10 19:47:57+00:00,317,False,2121,Venezuela.,
3569,2022-03-08 23:28:04+00:00,"RT @REESE_JOHN_: Debido a lo caro de la gasolina, ahora la policía anda en burros https://t.co/UJXibSekqA", debido a lo caro de la gasolina  ahora la polic a anda en burros  ,es,0,1,2021-07-18 21:38:40+00:00,2273,False,42133,EN EL PAÍS DE NUNCA JAMÁS,
3581,2022-03-08 23:27:58+00:00,Tal y como se está poniendo la gasolina es más valioso atracar la gasolinera que un banco,tal y como se est  poniendo la gasolina es m s valioso atracar la gasolinera que un banco,es,3,0,2014-10-13 18:03:08+00:00,164,False,6123,El Puerto de Santa María,
3589,2022-03-08 23:27:52+00:00,RT @ObservadBinario: #BIN El mundo en guerra.- #URGENTE #AHORA El precio de la gasolina ha alcanzado este martes #08Marzo un precio alto hi…,  bin el mundo en guerra    urgente  ahora el precio de la gasolina ha alcanzado este martes  08marzo un precio alto hi ,es,0,26,2012-10-12 00:50:04+00:00,1070,False,66061,,
3592,2022-03-08 23:27:51+00:00,"Vale que el precio de la gasolina sea anormal y te quejes, pero pagar todos los fin de semana 80/100€ por una simple botella tampoco es que sea muy normal y no veo quejas",vale que el precio de la gasolina sea anormal y te quejes  pero pagar todos los fin de semana 80 100  por una simple botella tampoco es que sea muy normal y no veo quejas,es,11750,1737,2013-11-04 14:13:40+00:00,6505,False,82824,Las Palmas de Gran Canaria,
3595,2022-03-08 23:27:49+00:00,"RT @cubero_alberto: El Gobierno insta a la moderación salarial con el IPC en el 7%, la gasolina y la luz por las nubes y las empresas con b…", el gobierno insta a la moderaci n salarial con el ipc en el 7   la gasolina y la luz por las nubes y las empresas con b ,es,0,34,2020-05-27 11:46:49+00:00,979,False,67391,CLM,
3600,2022-03-08 23:27:44+00:00,"RT @PetroDivisa: El presidente Joe Biden, ha anunciado este martes la prohibición de importaciones de petróleo y gas rusos. Tiro al piso qu…", el presidente joe biden  ha anunciado este martes la prohibici n de importaciones de petr leo y gas rusos  tiro al piso qu ,es,0,55,2022-02-17 14:25:18+00:00,23,False,13,,
3612,2022-03-08 23:27:40+00:00,"RT @ainhoarv9: no tenéis más días para quejaros porque nadie se manifiesta por el precio de la luz, de la gasolina, etc??? qué casualidad q…", no ten is m s d as para quejaros porque nadie se manifiesta por el precio de la luz  de la gasolina  etc    qu  casualidad q ,es,0,3,2010-05-11 17:43:34+00:00,408,False,7149,Vila-real (Castellón),
3613,2022-03-08 23:27:39+00:00,¿Cómo será la distribución de gasolina subsidiada? 3 datos para entenderlo https://t.co/t6QviHwcVl, c mo ser  la distribuci n de gasolina subsidiada  3 datos para entenderlo  ,es,1,3,2021-09-17 20:06:27+00:00,3486,True,47,Venezuela,
3616,2022-03-08 23:27:37+00:00,"RT @nauzet1998: Te sube la luz, la gasolina, el gobierno por tanto recauda más de todas estas partidas, y en vez de actuar en consecuencia…", te sube la luz  la gasolina  el gobierno por tanto recauda m s de todas estas partidas  y en vez de actuar en consecuencia ,es,0,5,2011-09-05 12:04:08+00:00,311,False,1202,"Las Palmas, Islas Canarias",
3620,2022-03-08 23:27:35+00:00,RT @jonxzr__: Si es que todo pasa por algo si no tengo coche es porque se venía lo de la subida de precios de la gasolina y no tenía que te…, si es que todo pasa por algo si no tengo coche es porque se ven a lo de la subida de precios de la gasolina y no ten a que te ,es,0,1,2021-01-13 21:51:34+00:00,4,False,119,,
3622,2022-03-08 23:27:35+00:00,"RT @LeonKrauze: Todo indica que Biden anunciará que EEUU dejará de importar hidrocarburos rusos.
Es una medida casi simbólica: el petróleo…", todo indica que biden anunciar  que eeuu dejar  de importar hidrocarburos rusos  es una medida casi simb lica  el petr leo ,es,0,85,2010-04-10 05:58:08+00:00,28,False,8327,Mexico,
3630,2022-03-08 23:27:30+00:00,"RT @mariofdez98: La persona que ha subido eso ha ido a cero unidades de manifestaciones por el precio de la gasolina o la luz, no tengo pru…", la persona que ha subido eso ha ido a cero unidades de manifestaciones por el precio de la gasolina o la luz  no tengo pru ,es,0,2,2016-01-22 16:25:58+00:00,318,False,69187,,
3631,2022-03-08 23:27:29+00:00,"@m_ebrard Uy! Gracias por el dato, dejaré de ir desde Aguascalientes hasta Los Angeles a cargar gasolina 🙄 con razón me salía tan cara 🤦🏼‍♀️ https://t.co/p1qVdSjguu",  ebrard uy  gracias por el dato  dejar  de ir desde aguascalientes hasta los angeles a cargar gasolina   con raz n me sal a tan cara        ,es,1,0,2011-03-24 03:52:42+00:00,1289,False,35564,,
3634,2022-03-08 23:27:27+00:00,"@brailovsky07 @DamianAIcazar No te vayas a quedar pobre, con eso de tus impuestos sirven para sostener al sistema de salud, la gasolina, los viajes de obrador, la obra social, los proyectos e infraestructura que se están llevado a cabo...",    no te vayas a quedar pobre  con eso de tus impuestos sirven para sostener al sistema de salud  la gasolina  los viajes de obrador  la obra social  los proyectos e infraestructura que se est n llevado a cabo   ,es,2,0,2012-01-18 17:48:12+00:00,17,False,418,,
3637,2022-03-08 23:27:26+00:00,"RT @AgenteSpasic: ¿Qué creéis que habría que hacer con esto?

a) entrar y dar un abrazo al primer jvdío que veas.

b) echar un curriculum p…",  qu  cre is que habr a que hacer con esto   a  entrar y dar un abrazo al primer jvd o que veas   b  echar un curriculum p ,es,0,17,2021-02-16 16:12:21+00:00,48,False,10018,,
3638,2022-03-08 23:27:26+00:00,"@jpedrerol La gasolina a bajado a 1,05€ el litro",  la gasolina a bajado a 1 05  el litro,es,0,0,2015-01-27 00:34:05+00:00,37,False,109,Jamaica Nigga MTFK,
3647,2022-03-08 23:27:19+00:00,@_mariavba Te ahorraste la gasolina bebe. Good job,  mariavba te ahorraste la gasolina bebe  good job,es,1,0,2011-05-14 20:26:44+00:00,402,False,380,,
3648,2022-03-08 23:27:19+00:00,RT @montilacobarde: Los que tanto se han quejado de que en las manifestaciones del 8M no se protestara por el precio de la luz o la gasolin…, los que tanto se han quejado de que en las manifestaciones del 8m no se protestara por el precio de la luz o la gasolin ,es,0,30,2012-09-30 17:50:32+00:00,414,False,2653,Teruel,
3649,2022-03-08 23:27:19+00:00,"RT @blythe_club: 20.000 millones de euros a la Irene, subida del 22,44%  los sindicatos...

Y mientras nosotros cada vez más empobrecidos s…", 20 000 millones de euros a la irene  subida del 22 44   los sindicatos     y mientras nosotros cada vez m s empobrecidos s ,es,0,28,2010-07-17 14:08:30+00:00,279,False,70383,Miña Terra Nai,
3653,2022-03-08 23:27:16+00:00,RT @vegamarietka: la gasolina y el dólar se dan duro., la gasolina y el d lar se dan duro ,es,0,2,2015-09-04 16:55:19+00:00,518,False,45079,,
3654,2022-03-08 23:27:15+00:00,"RT @Jos45683720: @jgnaredo La gente ignorante y fanática es muy manipulable.
El señor debería estar molesto con su presidente por tomar las…",   la gente ignorante y fan tica es muy manipulable  el se or deber a estar molesto con su presidente por tomar las ,es,0,5,2014-03-18 22:03:32+00:00,220,False,59182,,
3658,2022-03-08 23:27:14+00:00,"RT @Salvado72333192: @Alexhp11mx @DamianAIcazar Pues aunque lo dudes papá,  el precio actual es gracias a el,  mejor se agradecido y deja d…",     pues aunque lo dudes pap    el precio actual es gracias a el   mejor se agradecido y deja d ,es,0,1,2021-07-04 01:14:36+00:00,77,False,6400,"Monterrey, Nuevo León",
3660,2022-03-08 23:27:14+00:00,"RT @gemaruizg: 20.319.000.000€

Con la luz prevista a alcanzar 700€/MWh hoy. Con la gasolina a 2€/L. Con una tasa de variación del Índice d…", 20 319 000 000   con la luz prevista a alcanzar 700  mwh hoy  con la gasolina a 2  l  con una tasa de variaci n del  ndice d ,es,0,25,2013-07-17 14:30:56+00:00,445,False,8729,Málaga - Riogordo📍,
3662,2022-03-08 23:27:13+00:00,prefiero picarme una teta que pagar $1.15 por gasolina,prefiero picarme una teta que pagar  1 15 por gasolina,es,61,11,2015-09-09 20:32:29+00:00,1385,False,62266,Oovoo Javer,
3663,2022-03-08 23:27:13+00:00,GASOLINA A LA LUNA! PROHÍBEN IMPORTACIÓN DE PETRÓLEO RUSO. GASOLINA A LA... https://t.co/r0Y5L8134X vía @YouTube,gasolina a la luna  proh ben importaci n de petr leo ruso  gasolina a la      v a  ,es,0,0,2019-12-02 00:37:15+00:00,1081,False,22600,,
3667,2022-03-08 23:27:11+00:00,@carlesenric Falso. Pagamos IVA e impuesto de hidrocarburos (IH). Pagas €0.473/litro gasolina y 0.379/litro diésel. Entiendes ahora pq pagas el mismo (IH) cuando llenas el depósito de tu coche valga el barril de petróleo $20 q ahora q vale $130?,  falso  pagamos iva e impuesto de hidrocarburos  ih   pagas  0 473 litro gasolina y 0 379 litro di sel  entiendes ahora pq pagas el mismo  ih  cuando llenas el dep sito de tu coche valga el barril de petr leo  20 q ahora q vale  130 ,es,1,0,2021-04-30 15:54:14+00:00,187,False,5686,,
3672,2022-03-08 23:27:07+00:00,"RT @AntonioUriz: • ELECTRICIDAD +46%
• DIÉSEL +25%
• FRUTA +8,8%
• CARNE (OVINO-CAPRINO) +12,6%
• CARNE (AVE) + 6,6%
• CARNE (VACUNO) +6%
•…",   electricidad  46    di sel  25    fruta  8 8    carne  ovino caprino   12 6    carne  ave    6 6    carne  vacuno   6    ,es,0,129,2013-03-21 05:13:38+00:00,3421,False,24423,En el Albero.,
3676,2022-03-08 23:27:06+00:00,RT @gridpablo: @vodkaazulbarato o bajar la puta luz o la puta gasolina a das q cojones haces poniendo 20300 millones eso no va a arreglar n…,   o bajar la puta luz o la puta gasolina a das q cojones haces poniendo 20300 millones eso no va a arreglar n ,es,0,1,2020-10-20 12:38:37+00:00,167,False,2479,"Valencia, España",
3678,2022-03-08 23:27:05+00:00,@relicheandres @LassoGuillermo Yaaaaa y que dice de la gasolina??!!!,    yaaaaa y que dice de la gasolina     ,es,1,0,2013-05-15 00:52:15+00:00,154,False,32170,Guayaquil,
3679,2022-03-08 23:27:05+00:00,"@AcencionPined @econokafka Tirar dinero en planes mal hechos no es difícil. 

Difícil para los millones que en peor crisis sanitaria/económica relegó (record mundial en muertes en exceso/100k habitantes, doceavo en vacunación en América Latina (!) y último en gasto contraciclico).

""Que coman gasolina!"" https://t.co/EPOz4FjW6f",    tirar dinero en planes mal hechos no es dif cil    dif cil para los millones que en peor crisis sanitaria econ mica releg   record mundial en muertes en exceso 100k habitantes  doceavo en vacunaci n en am rica latina     y  ltimo en gasto contraciclico     que coman gasolina    ,es,0,0,2012-05-27 03:58:44+00:00,229,False,5731,,
3680,2022-03-08 23:27:04+00:00,"No podemos hacer mucho en este momento: Biden advierte que los precios de la gasolina subirán en EE.UU. debido a las sanciones contra Rusia
https://t.co/UOk8J69rs9",no podemos hacer mucho en este momento  biden advierte que los precios de la gasolina subir n en ee uu  debido a las sanciones contra rusia  ,es,0,0,2011-01-24 17:50:12+00:00,53,False,369,México,
3684,2022-03-08 23:27:02+00:00,"@IgualdadGob @IreneMontero Mientras tanto la luz a 700€ el kilovatio, la gasolina a casi 2€. Pero siempre todes unides!!!",    mientras tanto la luz a 700  el kilovatio  la gasolina a casi 2   pero siempre todes unides   ,es,1,0,2019-05-31 19:18:33+00:00,44,False,2818,"Principado de Asturias, España",
3692,2022-03-08 23:26:57+00:00,"Sube la gasolina, sube la luz, a ver cuando suben los sueldos",sube la gasolina  sube la luz  a ver cuando suben los sueldos,es,5,1,2019-04-15 15:00:56+00:00,89,False,1289,,
3693,2022-03-08 23:26:57+00:00,"RT @CaraotaDigital: #Venezuela | ""El impacto puede ser fuerte"": Las consecuencias de eliminar la gasolina subsidiada  🔻 https://t.co/A8Qhsk…",  venezuela    el impacto puede ser fuerte   las consecuencias de eliminar la gasolina subsidiada     ,es,0,3,2020-07-07 13:35:53+00:00,39,False,12006,,
3700,2022-03-08 23:26:54+00:00,RT @claugommez_: manifestarse por unas cosas no significa que otras no te importen la gente que pone justo hoy lo del precio de la luz y la…, manifestarse por unas cosas no significa que otras no te importen la gente que pone justo hoy lo del precio de la luz y la ,es,0,1,2020-08-04 14:13:09+00:00,96,False,20156,"Torrijos, España",
3703,2022-03-08 23:26:52+00:00,"@EdnaJaramillotv buenas tardes edna, ahora todo está subiendo pr la gasolina y diésel, el gobierno no dice nada, ni reglamenta esto aunque sea temporalmente, la gasolina sube y la comida, pero cuando esto pase, nafemie caja nada y se queda como esta, es responsabilidad del GOB",  buenas tardes edna  ahora todo est  subiendo pr la gasolina y di sel  el gobierno no dice nada  ni reglamenta esto aunque sea temporalmente  la gasolina sube y la comida  pero cuando esto pase  nafemie caja nada y se queda como esta  es responsabilidad del gob,es,0,0,2020-10-07 00:16:04+00:00,9,False,463,,
3706,2022-03-08 23:26:51+00:00,"Los chulitos de VOX ave si se enteran que el precio de la gasolina y de la luz no dependen de nosotros, que bajando los impuestos no se sube el nivel de vida y que tanta familia arruinada y después estais en contra de las ayudas y a favor de privatizarlo todo. Cuanta hipocresía.",los chulitos de vox ave si se enteran que el precio de la gasolina y de la luz no dependen de nosotros  que bajando los impuestos no se sube el nivel de vida y que tanta familia arruinada y despu s estais en contra de las ayudas y a favor de privatizarlo todo  cuanta hipocres a ,es,7,0,2020-04-23 17:57:32+00:00,99,False,2070,"Sevilla, España",
