,Created_at,Text,Clean Text,Lang,Favourite_count,Retweet_count,Fecha creacion,Followers,Verificado,Cantidad Fav,País,Coordenadas
2132,2022-03-20 23:13:46+00:00,"literalmente mi padre me ha criado escuchando gasolina, lovumba, lo que pasó, pasó… menudo jefe esq le debo la vida",literalmente mi padre me ha criado escuchando gasolina  lovumba  lo que pas   pas   menudo jefe esq le debo la vida,es,1,0,2019-11-24 11:43:12+00:00,142,False,4734,madrid / 🇵🇪,
2134,2022-03-20 23:13:44+00:00,"RT @Delnacarrero: CUANTO ME DIGAN y pq tu usas Twitter si es imperialista, ahora les dire: Y Pq tu usas petróleo y gas si lo tenemos los Co…", cuanto me digan y pq tu usas twitter si es imperialista  ahora les dire  y pq tu usas petr leo y gas si lo tenemos los co ,es,0,279,2011-09-14 02:25:07+00:00,869,False,95858,San Antonio Miranda Venezuela,
2138,2022-03-20 23:13:35+00:00,RT @lobochavista: Todos los caminos de EEUU y de países de derecha en Latinoamérica conducen a comprar petróleo Venezolano... Escualos a un…, todos los caminos de eeuu y de pa ses de derecha en latinoam rica conducen a comprar petr leo venezolano    escualos a un ,es,0,3,2010-06-07 15:35:37+00:00,5894,False,24674,,
2143,2022-03-20 23:13:27+00:00,@pabloolivera87 @elmonetta Tu cuñado el de Canadá te dio el precio del combustible en Argentina y Brasil? Buenas fuentes manejas,    tu cu ado el de canad  te dio el precio del combustible en argentina y brasil  buenas fuentes manejas,es,0,0,2009-07-31 20:37:20+00:00,1528,False,1091,Uruguay,
2147,2022-03-20 23:13:23+00:00,El motivo por el cual Daddy Yankee se retira del mundo artístico es porque a nadie ya le gusta la gasolina. https://t.co/LPug3Ig2rN,el motivo por el cual daddy yankee se retira del mundo art stico es porque a nadie ya le gusta la gasolina   ,es,38,6,2010-08-05 01:07:36+00:00,727,False,6535,Puerto plata,
2155,2022-03-20 23:13:09+00:00,@dansebalb Esta demanda se inicia por la torpeza de un gobierno que decidió no permitir la defensa de esos sapos ahora todos jodidos cómo pasó con los juicios con las petroleras o el regalo del petróleo a China,  esta demanda se inicia por la torpeza de un gobierno que decidi  no permitir la defensa de esos sapos ahora todos jodidos c mo pas  con los juicios con las petroleras o el regalo del petr leo a china,es,7,2,2011-03-06 16:04:15+00:00,212,False,31881,Quito,
2156,2022-03-20 23:13:09+00:00,"Hoy no nos preocupa ya ni la guerra , ni el gas, ni la gasolina , ni nada de nada.
Que pena….",hoy no nos preocupa ya ni la guerra   ni el gas  ni la gasolina   ni nada de nada  que pena  ,es,0,0,2011-05-29 17:37:10+00:00,6,False,59,"Zaragoza, España",
2157,2022-03-20 23:13:06+00:00,La Gasolina ⛽️ Subió tanto que Daddy Yankee se retiró,la gasolina    subi  tanto que daddy yankee se retir ,es,1,0,2017-12-09 02:09:43+00:00,7168,False,992,,
2166,2022-03-20 23:12:56+00:00,"RT @FilemonEsteban: La argelina Sonatrach anuncia el descubrimiento de un yacimiento de petróleo y gas en la cuenca de Berkine, sur de Arge…", la argelina sonatrach anuncia el descubrimiento de un yacimiento de petr leo y gas en la cuenca de berkine  sur de arge ,es,0,1,2021-06-18 07:42:53+00:00,1898,False,45812,,
2171,2022-03-20 23:12:48+00:00,"RT @VillaFernando_: Por primera vez en más de una década @EPPETROECUADOR confirmó que el país perdió $3,60 por barril de petróleo entregado…", por primera vez en m s de una d cada   confirm  que el pa s perdi   3 60 por barril de petr leo entregado ,es,0,656,2019-06-18 14:47:24+00:00,25,False,7086,,
2173,2022-03-20 23:12:46+00:00,otro efecto de la subida de la gasolina 😢 https://t.co/SBikFEDrWi,otro efecto de la subida de la gasolina    ,es,408,53,2012-11-19 22:30:15+00:00,144517,False,54152,,
2181,2022-03-20 23:12:36+00:00,Cómo le encanta la gasolina https://t.co/46ZtKVSx7G,c mo le encanta la gasolina  ,es,33,7,2020-09-05 03:34:23+00:00,206,False,7159,,
2182,2022-03-20 23:12:33+00:00,Las cifras récord de la gasolina en Estados Unidos causadas por la guerra https://t.co/GkRdrqZlR2 #GENERAL #JoeBiden,las cifras r cord de la gasolina en estados unidos causadas por la guerra    general  joebiden,es,0,4,2020-07-29 17:22:07+00:00,2474,False,1348,Madrid,
2183,2022-03-20 23:12:32+00:00,"RT @FeccaAgustina: Como siga el escudo social protegiéndonos tanto, me veo robando gasolina como en Mad Max.", como siga el escudo social protegi ndonos tanto  me veo robando gasolina como en mad max ,es,0,20,2017-04-17 12:12:27+00:00,964,False,210289,Galicia 🇪🇸🇪🇸  VOX,
2185,2022-03-20 23:12:30+00:00,RT @Daniel_Sanz_C: Con Pedro Sánchez es más barato 2 picos de coca que 1 depósito lleno de gasolina..., con pedro s nchez es m s barato 2 picos de coca que 1 dep sito lleno de gasolina   ,es,0,6,2012-06-02 10:55:31+00:00,217,False,27952,,
2187,2022-03-20 23:12:29+00:00,"RT @Pelis2021: @ed_diaz1 @MalthusGamba @LeonKrauze @lopezobrador_ Cuéntanos, en lo que va del gobierno, en qué has sufrido o padecido? Paga…",   diaz1        cu ntanos  en lo que va del gobierno  en qu  has sufrido o padecido  paga ,es,0,1,2015-08-27 17:05:53+00:00,697,False,122541,Las Vegas USA Queretaro MX,
2189,2022-03-20 23:12:26+00:00,"Mi papá cada vez que le digo que me lleve algún lugar me dice ""tu crees que el carro en vez de gasolina gasta agua?"" Obvio no, ni que fuera tan bobita",mi pap  cada vez que le digo que me lleve alg n lugar me dice  tu crees que el carro en vez de gasolina gasta agua   obvio no  ni que fuera tan bobita,es,2,0,2021-04-08 14:19:06+00:00,24,False,190,,
2191,2022-03-20 23:12:24+00:00,"RT @ava1959: @yvarargotti Más sencillo todavía;
Alguien ha visto a un político haciendo mercado, cola en la gasolinera o manejando un carro…",   m s sencillo todav a  alguien ha visto a un pol tico haciendo mercado  cola en la gasolinera o manejando un carro ,es,0,1,2014-03-07 23:37:09+00:00,1236,False,389,,
2192,2022-03-20 23:12:21+00:00,"@jdcorreau @DeLaCalleHum No comprendo como no ven eso tan simple, que pequeñez de parte de quienes deberían ser lo adultos, echándole gasolina ⛽️ al incendio.",    no comprendo como no ven eso tan simple  que peque ez de parte de quienes deber an ser lo adultos  ech ndole gasolina    al incendio ,es,1,0,2019-06-11 04:02:42+00:00,710,False,28859,"Bogotá, D.C., Colombia",
2196,2022-03-20 23:12:19+00:00,"RT @_pacojones: Si quieren ahorrar en gasolina usen una app tipo esta, yo uso Gasall. Le configuras el combustible, las gasolineras que qui…", si quieren ahorrar en gasolina usen una app tipo esta  yo uso gasall  le configuras el combustible  las gasolineras que qui ,es,0,18,2016-08-21 21:48:39+00:00,429,False,182362,Madrid/Tenerife,
2197,2022-03-20 23:12:17+00:00,RT @Uribista87: Datos Que Los Petristas Y El Mismo Hampon No Saben Si Se Deja De Producir Petróleo https://t.co/BdLLNd4Qwx, datos que los petristas y el mismo hampon no saben si se deja de producir petr leo  ,es,0,34,2009-09-16 22:14:09+00:00,2141,False,22940,,
2198,2022-03-20 23:12:16+00:00,"PROPUESTAS FICO :
Icrementar la explotación de pozos PETROLEROS para mantener el actual ABASTECIMIENTO nacional y no dejar las motos, las lanchas y los automotores SIN GASOLINA, A la vez INCENTIVANDO las energías ALTERNATIVAS  : hidrógeno, eléctrica, eólica, solar, etc.",propuestas fico   icrementar la explotaci n de pozos petroleros para mantener el actual abastecimiento nacional y no dejar las motos  las lanchas y los automotores sin gasolina  a la vez incentivando las energ as alternativas    hidr geno  el ctrica  e lica  solar  etc ,es,1,0,2021-06-04 12:35:54+00:00,116,False,21150,,
2201,2022-03-20 23:12:15+00:00,@MartinaVelardeG La injusticia q nos está haciendo @sanchezcastejon a las familias no te indigna? La gasolina a niveles exorbitantes la luz y el gas y @sanchezcastejon callado Os ponéis todos y todas la bandera de la izquierda y la derecha y después sois todos igual de hipócritas la verdad,  la injusticia q nos est  haciendo   a las familias no te indigna  la gasolina a niveles exorbitantes la luz y el gas y   callado os pon is todos y todas la bandera de la izquierda y la derecha y despu s sois todos igual de hip critas la verdad,es,0,0,2020-10-19 18:37:45+00:00,1039,False,7054,,
2202,2022-03-20 23:12:13+00:00,"@petrogustavo @ZelenskyyUa @KremlinRussia @JoeBiden @WhiteHouse ...aunque, 
si el interés es dar una oportunidad de vida a la sobrepoblación respetando y velando por sus derechos de alimentación salud vivienda educación
hay q dejar d depender del petróleo por el bien magnético dl planeta ya saturado por contaminación mas x el uso del abus●",             aunque   si el inter s es dar una oportunidad de vida a la sobrepoblaci n respetando y velando por sus derechos de alimentaci n salud vivienda educaci n hay q dejar d depender del petr leo por el bien magn tico dl planeta ya saturado por contaminaci n mas x el uso del abus ,es,0,0,2010-05-20 20:11:10+00:00,100,False,3874,Bogotá,
2206,2022-03-20 23:12:11+00:00,"RT @TiempoYMemoria: Ellos fueron tan, pero tan “diplomáticos”, que terminaron entregando todo: el agua, el gas, el petróleo, las minas y to…", ellos fueron tan  pero tan  diplom ticos   que terminaron entregando todo  el agua  el gas  el petr leo  las minas y to ,es,0,10,2022-01-17 04:59:22+00:00,366,False,1094,"Benito Juárez, Distrito Federal",
2210,2022-03-20 23:12:10+00:00,"Maiq pensaba que la gasolina era de Don Omar, un fav y lo echo de casa",maiq pensaba que la gasolina era de don omar  un fav y lo echo de casa,es,10,0,2012-09-25 21:14:40+00:00,455,False,1500,The cake is a lie,
2212,2022-03-20 23:12:04+00:00,RT @anluma99: @ElenaHerndez2 No se deje usted manipular por la masiva propaganda OTAN: la responsabilidad de esta Guerra se reparte por igu…,   no se deje usted manipular por la masiva propaganda otan  la responsabilidad de esta guerra se reparte por igu ,es,0,28,2018-08-16 15:02:08+00:00,158,False,16285,,
2213,2022-03-20 23:12:02+00:00,RT @averqostiadices: Elxokas? Wiligref? Nose qien son lo siento estoy bastante ocupado luchando en ukrania y bajando el precio de la gasoli…, elxokas  wiligref  nose qien son lo siento estoy bastante ocupado luchando en ukrania y bajando el precio de la gasoli ,es,0,14,2019-10-26 15:25:32+00:00,324,False,19485,"Malaga, Spain",
2214,2022-03-20 23:12:02+00:00,@b_garciaVI Y unos 5 litros de gasolina…,  garciavi y unos 5 litros de gasolina ,es,2,1,2010-06-24 02:23:10+00:00,3410,False,102383,"Sonora, México",
2221,2022-03-20 23:11:56+00:00,"@Twinwpc @ARC_EnergiaEc @EPPETROECUADOR 1._ Peor cuando salta el gatillo de carga y te marca $ 23,50 y el despachador te dice de una vez le pongo los $ 25 y sigue cargando sin que apruebes, el repostar por encima del aviso no significa a mas combustible más autonomía, sino daño del canister o filtro de carbón activado",    energiaec   1   peor cuando salta el gatillo de carga y te marca   23 50 y el despachador te dice de una vez le pongo los   25 y sigue cargando sin que apruebes  el repostar por encima del aviso no significa a mas combustible m s autonom a  sino da o del canister o filtro de carb n activado,es,0,0,2011-02-16 02:22:12+00:00,134,False,6179,Nyc,
2225,2022-03-20 23:11:51+00:00,"RT @georgina_vox: Muchos buenos momentos en la gran manifestación del #20MRural
En la pancarta de jóvenes: “Queremos ser ganaderos… si nos…", muchos buenos momentos en la gran manifestaci n del  20mrural en la pancarta de j venes   queremos ser ganaderos  si nos ,es,0,21,2011-12-06 18:55:57+00:00,637,False,201,,
2229,2022-03-20 23:11:46+00:00,RT @lyon69juanjose: @YPFoficial HDRMP DEJEN DE AUMENTAR EL COMBUSTIBLE MANGA DE USUREROS...,   hdrmp dejen de aumentar el combustible manga de usureros   ,es,0,1,2013-02-05 01:49:43+00:00,1788,False,107388,,
2231,2022-03-20 23:11:46+00:00,Iván Duque: “Venezuela no produce 700.000 b/d de petróleo”  https://t.co/aXeb3xSB5R,iv n duque   venezuela no produce 700 000 b d de petr leo    ,es,2,0,2009-11-08 23:26:19+00:00,218650,False,583,"Washington, DC",
2234,2022-03-20 23:11:44+00:00,"RT @soygdelpetroleo: @MujicaVladimiro @marypescao Estimado Vladimiro, en nombre de todos nuestros agremiados de Gente del Petróleo te expre…",     estimado vladimiro  en nombre de todos nuestros agremiados de gente del petr leo te expre ,es,0,12,2012-12-06 01:16:46+00:00,2224,False,18456,"Venezuela, Estado Miranda",
2235,2022-03-20 23:11:41+00:00,@EfectoCocuyo Parecen caidos de la mata algo les ocurrio en la visita de EEUU a su estilo patean la mesa hubo promesas de lado y lado ven que ya no mencionan lo de la compra de petroleo por los gringos una probadita de su propia formula,  parecen caidos de la mata algo les ocurrio en la visita de eeuu a su estilo patean la mesa hubo promesas de lado y lado ven que ya no mencionan lo de la compra de petroleo por los gringos una probadita de su propia formula,es,0,0,2021-11-02 11:42:07+00:00,0,False,5,,
2237,2022-03-20 23:11:39+00:00,"@Alexandraros01 Acuérdense que el pescado, camarones y langostas están escaso. La gasolina esta muy cara.",  acu rdense que el pescado  camarones y langostas est n escaso  la gasolina esta muy cara ,es,1,0,2020-07-13 01:57:15+00:00,43,False,343,San Pedro de Macoris.,
2241,2022-03-20 23:11:31+00:00,@Yo92777937 @glitteredari @ProAMLO4T_ Lo de la canasta básica no tienes fundamentos para eso porque Obrador bajo el precio ahora bien Peña Nieto dejo privatizado el maíz la gasolina en muchas cosas más como en Estados Unidos por eso es que la gasolina no puede bajar allá una cosa es algo privatizado y otra estatal,       lo de la canasta b sica no tienes fundamentos para eso porque obrador bajo el precio ahora bien pe a nieto dejo privatizado el ma z la gasolina en muchas cosas m s como en estados unidos por eso es que la gasolina no puede bajar all  una cosa es algo privatizado y otra estatal,es,0,0,2021-05-25 16:02:58+00:00,40,False,13156,,
2242,2022-03-20 23:11:30+00:00,"@VivaAerobus #Vivaaerobus #VB1212
-3 hrs de retraso
-Derrame de combustible 

¿Tienen algo que decir aparte de “les reembolsáremos” y “seguimos aprendiendo” ?

Aquí no se viene a aprender🙄",   vivaaerobus  vb1212  3 hrs de retraso  derrame de combustible    tienen algo que decir aparte de  les reembols remos  y  seguimos aprendiendo     aqu  no se viene a aprender ,es,1,0,2022-02-18 15:40:39+00:00,1,False,0,,
2246,2022-03-20 23:11:23+00:00,RT @Virginiaperez11: El Presidente de la Cooperativa Las Marismas en la Comarca del Bajo Guadalquivir de #Sevilla lo expresa con mucha clar…, el presidente de la cooperativa las marismas en la comarca del bajo guadalquivir de  sevilla lo expresa con mucha clar ,es,0,118,2015-11-22 20:01:48+00:00,593,False,36780,Nervion. ,
2247,2022-03-20 23:11:23+00:00,"RT @bechoch: No importa que la luz se haya multiplicado por 5 y el gasóleo por 3, o que cientos de miles de currantes se hayan manifestado…", no importa que la luz se haya multiplicado por 5 y el gas leo por 3  o que cientos de miles de currantes se hayan manifestado ,es,0,10,2014-04-03 11:51:31+00:00,1671,False,44077,,
2253,2022-03-20 23:11:16+00:00,"RT @JuanyGar63: El PSOE vende al pueblo saharaui a cambio de petróleo. 
Como en los tiempos de la esclavitud negra
La insoportable miseria…", el psoe vende al pueblo saharaui a cambio de petr leo   como en los tiempos de la esclavitud negra la insoportable miseria ,es,0,97,2013-09-12 17:20:49+00:00,1487,False,51875,,
2256,2022-03-20 23:11:14+00:00,"@ElTanqueSilva69 Fan de coccagol (??)... más abajo, petróleo",  fan de coccagol         m s abajo  petr leo,es,0,0,2020-01-01 08:44:14+00:00,0,False,238,,
2268,2022-03-20 23:10:55+00:00,"@danoakacumbiote También la economía de combustible

Por alguna razón mi Viper tiene gasolina para solo 5 vueltas???",  tambi n la econom a de combustible  por alguna raz n mi viper tiene gasolina para solo 5 vueltas   ,es,0,0,2017-10-04 15:04:04+00:00,425,False,13725,Prefectura de Gunma,
2270,2022-03-20 23:10:50+00:00,"RT @antena3com: ⛽ Estos son los trucos para ahorrar en gasolina, tanto en el precio por litro como en el gasto de combustible.

Vía @A3Noti…",   estos son los trucos para ahorrar en gasolina  tanto en el precio por litro como en el gasto de combustible   v a   ,es,0,2,2011-03-15 13:41:32+00:00,1901,False,137,Sant Andreu de la Barca,
2272,2022-03-20 23:10:49+00:00,"RT @Caricias_alAlma: Mi amor por tí hace eco, resuena fuerte, no conoce de fronteras, es música, vida y más vida, es una vela encendida que…", mi amor por t  hace eco  resuena fuerte  no conoce de fronteras  es m sica  vida y m s vida  es una vela encendida que ,es,0,49,2017-06-14 17:26:56+00:00,3200,False,99097,Canarias,
2280,2022-03-20 23:10:39+00:00,@hugoesc31475407 O sea que las cucarachas sirven para combustible verde? 🤔 También sirven para espantar de noche cuando vuelan,  o sea que las cucarachas sirven para combustible verde    tambi n sirven para espantar de noche cuando vuelan,es,1,0,2010-05-17 13:44:57+00:00,1797,False,14247,En el centro de mi corazón,
2284,2022-03-20 23:10:30+00:00,@Kroosinha El único desquiciado que se le ocurre ir de negro cuando tiene la piel color petróleo 😂😂,  el  nico desquiciado que se le ocurre ir de negro cuando tiene la piel color petr leo   ,es,0,0,2020-11-22 23:40:02+00:00,62,False,15398,,
2285,2022-03-20 23:10:30+00:00,Se le acabó la gasolina https://t.co/Ocp0V8Uhtj,se le acab  la gasolina  ,es,0,0,2012-12-20 19:10:15+00:00,822,False,2500,Las Lajitas - Salta,
2288,2022-03-20 23:10:25+00:00,@Yo92777937 @glitteredari @ProAMLO4T_ Infracción de gobierno de Peña Nieto Peña Nieto aumenta más de $10 de litro de gasolina los datos buscados ahí están ahí están las pruebas no digas que Obrador incremento los pobres cuando hay una crisis mundial y hay otros países que se están muriendo de hambre y endeudados,       infracci n de gobierno de pe a nieto pe a nieto aumenta m s de  10 de litro de gasolina los datos buscados ah  est n ah  est n las pruebas no digas que obrador incremento los pobres cuando hay una crisis mundial y hay otros pa ses que se est n muriendo de hambre y endeudados,es,0,0,2021-05-25 16:02:58+00:00,40,False,13156,,
2290,2022-03-20 23:10:24+00:00,"- Buen día.
* Qué tiene de bueno.

- Seguimos informando sobre los precios de la gasolina en la Ciudad.
* No te contrataron para eso madre.

- No te dejes engañar.
* Yo me dejo engañar por quien se me de mi chingada gana.

Besos mi amor. https://t.co/QbcfR72LwC",  buen d a    qu  tiene de bueno     seguimos informando sobre los precios de la gasolina en la ciudad    no te contrataron para eso madre     no te dejes enga ar    yo me dejo enga ar por quien se me de mi chingada gana   besos mi amor   ,es,0,0,2009-09-15 18:14:06+00:00,116,False,528,Nacotitlán Yues,
2291,2022-03-20 23:10:23+00:00,RT @amnistia: El abogado de #ddhh Steven Donziger cumple una condena de seis meses en arresto domiciliario por exigir que @Chevron explique…, el abogado de  ddhh steven donziger cumple una condena de seis meses en arresto domiciliario por exigir que   explique ,es,0,11,2015-12-15 15:20:58+00:00,47,False,7760,,
2292,2022-03-20 23:10:22+00:00,no puedo creer la peor noticia retiraron a daddy yankee de tanto que subio la gasolina https://t.co/7ZImspE4BD,no puedo creer la peor noticia retiraron a daddy yankee de tanto que subio la gasolina  ,es,1517,108,2010-07-15 00:45:06+00:00,12052,False,83286,URY,
2298,2022-03-20 23:10:16+00:00,"Argentina es el campo. Si no entendemos éso, vamos mal.
No importa si no tenés campo o si tu trabajo no tiene una dependencia directa. Es como negar que Venezuela es el petróleo o Chile el cobre. #20MRural https://t.co/eatGiJBB1V",argentina es el campo  si no entendemos  so  vamos mal  no importa si no ten s campo o si tu trabajo no tiene una dependencia directa  es como negar que venezuela es el petr leo o chile el cobre   20mrural  ,es,0,0,2010-11-01 12:50:49+00:00,347,False,87507,Chetoslovaquia,
2301,2022-03-20 23:10:10+00:00,"RT @CristianGeo7: Los altos precios del petróleo dispararon en 2021 los beneficios de la petrolera estatal saudí, Aramco, hasta los u$s110.…", los altos precios del petr leo dispararon en 2021 los beneficios de la petrolera estatal saud   aramco  hasta los u s110  ,es,0,6,2015-06-17 11:47:48+00:00,1293,False,15333,Comodoro Rivadavia - Chubut - Argentina,
2302,2022-03-20 23:10:10+00:00,DAME MÁS GASOLINA,dame m s gasolina,es,1,0,2012-10-12 20:35:11+00:00,1449,False,100694,HOUSTON & PARIS,
2303,2022-03-20 23:10:09+00:00,RT @Jonatha68423556: Así de destruído tienes tu subconsciente de tantas mentiras y odio! Esa imágen qué colocaste pertenece al Rolling Acre…, as  de destru do tienes tu subconsciente de tantas mentiras y odio  esa im gen qu  colocaste pertenece al rolling acre ,es,0,58,2012-07-21 21:41:11+00:00,248,False,19023,,
2306,2022-03-20 23:10:02+00:00,🔴Nuestro Diputado  @frank_sauerbaum conversó con @CNNChile sobre la propuesta de rebaja al impuesto de los combustibles: “Calculamos que por lo menos $450 podríamos rebajar el precio del combustible” https://t.co/4KysWJtx0z https://t.co/JSMOPMDBSy, nuestro diputado    sauerbaum convers  con   sobre la propuesta de rebaja al impuesto de los combustibles   calculamos que por lo menos  450 podr amos rebajar el precio del combustible     ,es,1,0,2010-07-08 21:19:49+00:00,32780,False,19540,Chile,
2309,2022-03-20 23:10:00+00:00,"Se puede culpar a la alta especulación en el mercado por el escenario que se desarrolla, aunque la perspectiva general sigue siendo alcista https://t.co/gDvHrd0gLl",se puede culpar a la alta especulaci n en el mercado por el escenario que se desarrolla  aunque la perspectiva general sigue siendo alcista  ,es,3,1,2009-01-23 01:46:22+00:00,253285,False,759,"Miami, FL, USA",
2310,2022-03-20 23:09:56+00:00,quiero un sanduche de la gasolinera😣,quiero un sanduche de la gasolinera ,es,0,0,2016-02-23 20:42:11+00:00,124,False,9834,"Guayaquil, Ecuador",
2313,2022-03-20 23:09:53+00:00,@ivanaszerman No le da mas la gasolina,  no le da mas la gasolina,es,3,0,2010-01-24 23:30:21+00:00,150,False,19347,Argentina,
2315,2022-03-20 23:09:50+00:00,"La pelirroja huía de una horda de esos malditos zombies que la habían perseguido desde la gasolinera en la que intentó esconderse... Llevaba tres días sobreviviendo ella sola, algo que inexplicablemente estaba haciendo correctamente. 

Aunque ni ella misma sabía como. &gt;",la pelirroja hu a de una horda de esos malditos zombies que la hab an perseguido desde la gasolinera en la que intent  esconderse    llevaba tres d as sobreviviendo ella sola  algo que inexplicablemente estaba haciendo correctamente    aunque ni ella misma sab a como   gt ,es,0,0,2022-03-14 02:54:18+00:00,1,False,3,,
2317,2022-03-20 23:09:48+00:00,"@Elin1Em 🎺 Desempleo cada vez peor, los precios subiendo, la comida, combustible y pasajes... esto no lo aguanta nadie. Hay que sacarlo de ahí. Es tiempo de Francisco @DominguezBrito  #FranciscoPresidente  #PuertoPlataConFrancisco. https://t.co/xoHIdalKiv",    desempleo cada vez peor  los precios subiendo  la comida  combustible y pasajes    esto no lo aguanta nadie  hay que sacarlo de ah   es tiempo de francisco     franciscopresidente   puertoplataconfrancisco   ,es,0,0,2021-06-13 23:02:59+00:00,157,False,195,,
2318,2022-03-20 23:09:48+00:00,"@ezambranoh @Rosmarbr Todos felices del metro gratis pero sucio, todos felices de esperar 40 min por un vagón del metro, felices de seguir contando con bolsa clap y shows gobierneros y que van a quitar las sanciones por petróleo. No hay salida. Solo nuestras familias, nuestro trabajo y esfuerzo.",    todos felices del metro gratis pero sucio  todos felices de esperar 40 min por un vag n del metro  felices de seguir contando con bolsa clap y shows gobierneros y que van a quitar las sanciones por petr leo  no hay salida  solo nuestras familias  nuestro trabajo y esfuerzo ,es,0,0,2010-11-29 06:11:57+00:00,851,False,122150,Tierra de Nadie,
2320,2022-03-20 23:09:47+00:00,"@javasroc90 @Electograph @s_logica @eldiarioes Lo ves como eres un borrego. Anda y vete a trabajar al campo o a echar gasolina. Récord de deuda histórica, la luz ni te cuento. Borrego. Cuando lo hacen mal lo normal es no votarles.",      logica   lo ves como eres un borrego  anda y vete a trabajar al campo o a echar gasolina  r cord de deuda hist rica  la luz ni te cuento  borrego  cuando lo hacen mal lo normal es no votarles ,es,3,0,2011-04-01 13:14:54+00:00,366,False,46051,,
2325,2022-03-20 23:09:42+00:00,"RT @CdeNoticiasPy: USANDO EL COMBUSTIBLE QUE LE PAGA EL PUEBLO PARA POLÍTICA 
El secretario de Kattya González, Juan Galeano Grassi, fue fo…", usando el combustible que le paga el pueblo para pol tica  el secretario de kattya gonz lez  juan galeano grassi  fue fo ,es,0,318,2018-09-25 02:56:53+00:00,2280,False,26952,"Central, Paraguay",
2326,2022-03-20 23:09:42+00:00,"@Cris_Porta Estoy llorando desde que la ""niña"" y el ""niño"" dejaron la relación.
Los ""niños"" me han roto el corazón al romper
Ya no voy ni al trabajo, por q mi vida va en torno a ellos..

A ver si tengo suerte y me pagan los gastos de la gasolina y el aceite de Girasol. #CrisLu21M",  porta estoy llorando desde que la  ni a  y el  ni o  dejaron la relaci n  los  ni os  me han roto el coraz n al romper ya no voy ni al trabajo  por q mi vida va en torno a ellos    a ver si tengo suerte y me pagan los gastos de la gasolina y el aceite de girasol   crislu21m,es,8,1,2021-10-23 14:04:07+00:00,301,False,7691,,
2335,2022-03-20 23:09:33+00:00,"Daddy Yankee se retira y nunca fui a ninguno de sus conciertos 

Mi sueño de escucharlo cantar La Gasolina en vivo ha sido destruído en este instante",daddy yankee se retira y nunca fui a ninguno de sus conciertos   mi sue o de escucharlo cantar la gasolina en vivo ha sido destru do en este instante,es,2,0,2012-04-21 23:48:06+00:00,583,False,4742,Venezuela - Caracas,
