,Created_at,Text,Clean Text,Lang,Favourite_count,Retweet_count,Fecha creacion,Followers,Verificado,Cantidad Fav,País,Coordenadas
3614,2022-03-20 22:42:31+00:00,"@DrGiammattei De Aque pisados sirve repasar tanto proyecto si lo que importa ni le ponen atencion, DESNUTRICION, DELINCUENCIA, PRECIOS ALTOS DE GASOLINA CUANDO EL BARRIL ESTA BARATO, LAS ESCUELAS SIN SUMINISTROS NI APOYO, POLICIAS CORRUPTOS EN TODO EL PAIS, seguiria todo el dia.",  de aque pisados sirve repasar tanto proyecto si lo que importa ni le ponen atencion  desnutricion  delincuencia  precios altos de gasolina cuando el barril esta barato  las escuelas sin suministros ni apoyo  policias corruptos en todo el pais  seguiria todo el dia ,es,0,0,2012-11-15 16:03:46+00:00,81,False,297,"Guatemala, Guatemama.",
3621,2022-03-20 22:42:20+00:00,"@hasta_vaka Estamos agarrando gasolina apenas, no te desesperes por tu papi morena😎",  vaka estamos agarrando gasolina apenas  no te desesperes por tu papi morena ,es,0,0,2019-03-27 15:44:17+00:00,639,False,84638,perdón en tu corazón,
3622,2022-03-20 22:42:20+00:00,"@MelondeH2O Claro, la dosis hace el veneno pero el azúcar no lo es ojo. Es el combustible celular. La q venden es casi toda es fake.
Un abrazo amigo 😊🤗",  claro  la dosis hace el veneno pero el az car no lo es ojo  es el combustible celular  la q venden es casi toda es fake  un abrazo amigo   ,es,4,0,2020-09-04 09:22:06+00:00,14627,False,72278,,
3624,2022-03-20 22:42:17+00:00,"RT @fatimareallopez: Subvenciones a sindicatos con @sanchezcastejon:
2020: 8,8 M€
2021: 13,8 M€ (+56%)
2022: 17 M€ (+18,3%)
No es que estén…", subvenciones a sindicatos con    2020  8 8 m  2021  13 8 m    56   2022  17 m    18 3   no es que est n ,es,0,14,2011-10-04 14:42:42+00:00,715,False,2950,Sepúlveda/San Pedro de Gaillos,
3626,2022-03-20 22:42:13+00:00,"Tienen tan poca vergüenza que según el señor sanchez todo a subido por la gerra de Rusia y Ucrania , y sube el combustible , la luz , la alimentación , que tiene que ver la gerra con las subidas que han hecho? .",tienen tan poca verg enza que seg n el se or sanchez todo a subido por la gerra de rusia y ucrania   y sube el combustible   la luz   la alimentaci n   que tiene que ver la gerra con las subidas que han hecho   ,es,0,0,2022-02-10 15:30:11+00:00,6,False,181,,
3628,2022-03-20 22:42:10+00:00,"Antes el dinero no alcanzaba. No había transparencia. 

AMLO: Un orgullo que gasolina en México sea de las más baratas del mundo https://t.co/d1FE2Vi9al",antes el dinero no alcanzaba  no hab a transparencia    amlo  un orgullo que gasolina en m xico sea de las m s baratas del mundo  ,es,2,0,2019-09-16 14:19:31+00:00,6654,False,35229,"Atizapán de Zaragoza, México",
3629,2022-03-20 22:42:10+00:00,"#Preguntaseria Si a nosotros los consumidores nos han subido el precio de todo por el gasto de energía y materia prima en la producción y la gasolina del transporte y esa subida no está llegando ni a productores, ni a transportistas…quien se está quedando con ese dinero?", preguntaseria si a nosotros los consumidores nos han subido el precio de todo por el gasto de energ a y materia prima en la producci n y la gasolina del transporte y esa subida no est  llegando ni a productores  ni a transportistas quien se est  quedando con ese dinero ,es,2,0,2012-03-12 12:26:49+00:00,235,False,33376,SVQ-BCN,
3630,2022-03-20 22:42:08+00:00,"¿Locura? 🤔⛽ | Cámara Petrolera propone aumentar el litro de gasolina premium a 0,75 centavos de dólar en Venezuela https://t.co/OVX1FbsE50", locura       c mara petrolera propone aumentar el litro de gasolina premium a 0 75 centavos de d lar en venezuela  ,es,0,1,2012-02-06 23:23:13+00:00,4466853,False,1832,Venezuela,
3631,2022-03-20 22:42:04+00:00,RT @ElRafeta697: @cris1993tina @ArturBalaguer La explosión se produce por el aumento de presión de los gases en el interior del monumento y…,     la explosi n se produce por el aumento de presi n de los gases en el interior del monumento y ,es,0,2,2011-01-18 15:36:18+00:00,2890,False,113529,Vila-real (Castellón),
3633,2022-03-20 22:42:03+00:00,"@alegnax_ @Nagore_Robles Que parte de lo que dijo te has perdido?
Dijo que le hace gracia Miriam pero no ese comentario.
Vuelve a ponertelo.
Cuando se tragiversa o manipula por qué alguien te cae mal se pierde credibilidad.Las guerras comienzan así,con el Ego de tener razón y echar gasolina.#Secret20M",     robles que parte de lo que dijo te has perdido  dijo que le hace gracia miriam pero no ese comentario  vuelve a ponertelo  cuando se tragiversa o manipula por qu  alguien te cae mal se pierde credibilidad las guerras comienzan as  con el ego de tener raz n y echar gasolina  secret20m,es,0,0,2019-01-26 14:25:11+00:00,185,False,3185,En La Luna City🌕🌖🌓🌒🌑,
3636,2022-03-20 22:41:58+00:00,"Hay tanto imbecil que esta a favor de devolverles a los Isaías sus “cositas”, que creen que está en contra de estos; también rateros igual que los revolucionarios, es ser “correista”!! Debe ser los que se quejan de la gasolina súper. Pauperrimos!",hay tanto imbecil que esta a favor de devolverles a los isa as sus  cositas   que creen que est  en contra de estos  tambi n rateros igual que los revolucionarios  es ser  correista    debe ser los que se quejan de la gasolina s per  pauperrimos ,es,0,0,2017-10-05 19:54:30+00:00,104,False,14152,"Quito, Ecuador",
3638,2022-03-20 22:41:55+00:00,"@coachlab0753 @AsambleaVE Apreciado Jesús: muchas gracias. Nuestra Gente del Petróleo, desde todas partes del mundo,continúa aportando por el retorno de la democracia, la justicia,libertades y una economía que beneficie a todos los venezolanos con una mejor calidad de vida. Saludos cordiales, GdelP *",    apreciado jes s  muchas gracias  nuestra gente del petr leo  desde todas partes del mundo contin a aportando por el retorno de la democracia  la justicia libertades y una econom a que beneficie a todos los venezolanos con una mejor calidad de vida  saludos cordiales  gdelp  ,es,2,0,2018-07-27 01:56:53+00:00,3791,False,11549,"Caracas, Venezuela",
3639,2022-03-20 22:41:54+00:00,RT @mlucascir: RT @marcoanhache De cómo Biden presionó en 2016 para que despidieran al Fiscal General de Ucrania que investigaba el escánda…, rt   de c mo biden presion  en 2016 para que despidieran al fiscal general de ucrania que investigaba el esc nda ,es,0,24,2011-02-23 04:41:59+00:00,1458,False,121762,,
3640,2022-03-20 22:41:53+00:00,"RT @Tomy_Rohde: El producto cuyo precio no deja de crecer y puede ahogar al campo no es la gasolina

El otro día me llamaron y bueno, les d…", el producto cuyo precio no deja de crecer y puede ahogar al campo no es la gasolina  el otro d a me llamaron y bueno  les d ,es,0,77,2011-07-31 09:44:32+00:00,474,False,48508,El Poder del Silencio,
3642,2022-03-20 22:41:50+00:00,"@jla1810 @Roberto_Montesa Juan II de Austeia tiene un video donde habla de todas las actualizaciones disponibles AHORA para nuestro Leo2E.
Grupo motopropulsor, A/A, UPA, combustible adicional, lanzafumígenos, sensores adicionales, actualización de opticas, sistema activo de defensa... un largo etc.",    montesa juan ii de austeia tiene un video donde habla de todas las actualizaciones disponibles ahora para nuestro leo2e  grupo motopropulsor  a a  upa  combustible adicional  lanzafum genos  sensores adicionales  actualizaci n de opticas  sistema activo de defensa    un largo etc ,es,1,0,2020-08-11 13:19:24+00:00,22,False,4345,,
3643,2022-03-20 22:41:47+00:00,"@dlacalle No hombre, algunos fueron a caballo porque la gasolina está muy cara 🖕🖕🖕🖕🖕",  no hombre  algunos fueron a caballo porque la gasolina est  muy cara      ,es,0,0,2020-04-09 11:50:03+00:00,7,False,173,,
3644,2022-03-20 22:41:45+00:00,"RT @jaimeberenguer: El paso de Pedro Sánchez y el comunismo por el Gobierno ha dejado a España sin agricultores, sin ganaderos, sin pescado…", el paso de pedro s nchez y el comunismo por el gobierno ha dejado a espa a sin agricultores  sin ganaderos  sin pescado ,es,0,1095,2013-01-28 11:45:24+00:00,499,False,53297,"España, una Grande y Libre",
3646,2022-03-20 22:41:40+00:00,Espero que en el nuevo disco haya mínimo una canción del estilo de la Gasolina para hacerle honor al reggaeton puro que lo hizo pegar allá por 2004,espero que en el nuevo disco haya m nimo una canci n del estilo de la gasolina para hacerle honor al reggaeton puro que lo hizo pegar all  por 2004,es,1,0,2016-12-22 01:39:31+00:00,196,False,30767,sv,
3647,2022-03-20 22:41:40+00:00,"RT @Fanat1cos: Tras ocupar el 2° y 4° puesto en carrera, tanto Max Verstappen como Sergio Pérez se quedaron sin sumar en Sakhir por un prob…", tras ocupar el 2  y 4  puesto en carrera  tanto max verstappen como sergio p rez se quedaron sin sumar en sakhir por un prob ,es,0,1,2017-12-12 12:28:54+00:00,1510,False,20627,"Mar del Plata, Argentina 🇦🇷",
3651,2022-03-20 22:41:35+00:00,"Esper que EE.UU. tenga muchas reservas de petróleo, gas, etc para que sus ejércitos funcionen por que se va a quedar solo con Europa de amiguita https://t.co/at2tZWffBn",esper que ee uu  tenga muchas reservas de petr leo  gas  etc para que sus ej rcitos funcionen por que se va a quedar solo con europa de amiguita  ,es,0,0,2012-01-23 00:26:30+00:00,227,False,6443,,
3654,2022-03-20 22:41:31+00:00,RT @NoticiasdelaCol: Cronograma de distribución de gasolina del 21 al 26 de marzo https://t.co/DOTvKJUL59, cronograma de distribuci n de gasolina del 21 al 26 de marzo  ,es,0,1,2011-05-29 17:09:01+00:00,848,False,101728,Venezuela.,
3656,2022-03-20 22:41:29+00:00,AYER ALAN HIZO UN REMIX DE GASOLINA SOY PURO LLANTO https://t.co/ynXz2FY3MT,ayer alan hizo un remix de gasolina soy puro llanto  ,es,1,0,2018-04-10 17:48:36+00:00,89,False,12559,rosario city,
3658,2022-03-20 22:41:28+00:00,"RT @xevtfm: #ÚltimoMinuto 🏁🏎️ ""Hoy perdimos el podio por una falla en el sistema de combustible"", escribe el piloto mexicano  🇲🇽 @SChecoPer…",   ltimominuto      hoy perdimos el podio por una falla en el sistema de combustible   escribe el piloto mexicano       ,es,0,1,2020-04-30 19:28:31+00:00,448,False,1658,México,
3661,2022-03-20 22:41:26+00:00,"Daddy Yankee anuncia su retiro y más le vale que la gira de despedida se llame ""Ya No Me Alcanza Pa' La Gasolina Tour""",daddy yankee anuncia su retiro y m s le vale que la gira de despedida se llame  ya no me alcanza pa  la gasolina tour ,es,1,0,2011-05-08 02:42:00+00:00,595,False,154424,"Santa Ana, Costa Rica",
3663,2022-03-20 22:41:25+00:00,"Yo sé que para los del Partido Bicicletero 🚲 y @g_quadri, los profesionistas deberíamos pagar el litro de gasolina a $30L. Eso, o irnos en bici a dejar a los niños a la escuela y luego a trabajar.

Para los demás: Red Energy, en Tintoreto, BJ en la CDMX. La verde a $21.29L. https://t.co/rmle4boSAd",yo s  que para los del partido bicicletero   y   quadri  los profesionistas deber amos pagar el litro de gasolina a  30l  eso  o irnos en bici a dejar a los ni os a la escuela y luego a trabajar   para los dem s  red energy  en tintoreto  bj en la cdmx  la verde a  21 29l   ,es,1,0,2009-11-22 21:17:24+00:00,2732,False,4687,"Mexico City, Mexico 🇲🇽",
3664,2022-03-20 22:41:22+00:00,@linda_dimitrov Jajajaaj el petroleo no sirve mandale un twet a tu dios biden y dile q para q negocio petroleo con venezuela si ya no sirve q no sea wuey,  dimitrov jajajaaj el petroleo no sirve mandale un twet a tu dios biden y dile q para q negocio petroleo con venezuela si ya no sirve q no sea wuey,es,0,0,2018-06-09 16:27:22+00:00,17,False,1389,,
3668,2022-03-20 22:41:12+00:00,Entonces ya no va a gasolina? https://t.co/yFboo5O2zQ,entonces ya no va a gasolina   ,es,1,0,2015-06-01 15:56:04+00:00,228,False,16269,,
3672,2022-03-20 22:41:07+00:00,"@ailulen_ 1900 a 1999: 00s 90s
2000 a 2999: '00 '90

No creo que el mundo como lo conocemos sobreviva para ver el siglo XXII, cuando se acabe el petroleo y nos matemos entre todos con bombas atómicas nos va a chupar un huevo todo eso de como identificar las décadas de los siglos.",   1900 a 1999  00s 90s 2000 a 2999   00  90  no creo que el mundo como lo conocemos sobreviva para ver el siglo xxii  cuando se acabe el petroleo y nos matemos entre todos con bombas at micas nos va a chupar un huevo todo eso de como identificar las d cadas de los siglos ,es,0,0,2021-11-08 22:13:24+00:00,349,False,22835,Preferred pronouns re/tard,
3673,2022-03-20 22:41:06+00:00,Daddy Yankee se retira de la música por la difícil situación con los precios de la gasolina 😔,daddy yankee se retira de la m sica por la dif cil situaci n con los precios de la gasolina  ,es,1,0,2021-02-22 22:39:16+00:00,165,False,19615,,
3679,2022-03-20 22:41:01+00:00,"@LuBrignoni Si, como dos veces. Una en el 2015 en el Velódromo y otra en el 2017 por ahí, no sé por qué no viene ahora. La gasolina marcó la infancia de todos, merecemos despedirnos 🥲",  si  como dos veces  una en el 2015 en el vel dromo y otra en el 2017 por ah   no s  por qu  no viene ahora  la gasolina marc  la infancia de todos  merecemos despedirnos  ,es,1,0,2018-09-02 16:50:40+00:00,60,False,2201,"Montevideo, Uruguay",
3680,2022-03-20 22:40:59+00:00,"Lo único que nos ha librado de hacer una temporada como la del Barcelona han sido Benzema, Modric y Vinicius pero la gasolina se les ha acabado y los recambios son Mariano, Valverde y Vazquez",lo  nico que nos ha librado de hacer una temporada como la del barcelona han sido benzema  modric y vinicius pero la gasolina se les ha acabado y los recambios son mariano  valverde y vazquez,es,1,0,2021-03-14 22:11:16+00:00,45,False,4687,"Alicante, España",
3683,2022-03-20 22:40:56+00:00,"@EugeniodOrs_ @liusivaya Estamos pagando 2€/L la gasolina, gas en máximos, IPC disparado…

Pero ni nos va ni nos viene.

Mientras hay 3 millones de refugiados ucranianos en Europa porque el EJÉRCITO RUSO está bombardeando sus casas.

Pero tres tíos dice que arriba rusa asi q supongo que están igualados",     estamos pagando 2  l la gasolina  gas en m ximos  ipc disparado   pero ni nos va ni nos viene   mientras hay 3 millones de refugiados ucranianos en europa porque el ej rcito ruso est  bombardeando sus casas   pero tres t os dice que arriba rusa asi q supongo que est n igualados,es,0,0,2021-07-26 17:14:48+00:00,15,False,5182,,
3684,2022-03-20 22:40:54+00:00,RT @akerdiegtel: La destrucción de Europa es inminente gracias a los neocons que presionan para que solo se compre gas y petróleo anglosajó…, la destrucci n de europa es inminente gracias a los neocons que presionan para que solo se compre gas y petr leo anglosaj  ,es,0,2,2021-10-25 17:04:40+00:00,5318,False,6471,,
3686,2022-03-20 22:40:51+00:00,"Odias a los rusos por q por culpa d ellos pagas mas caro la gasolina y como antes odiaba a los chinos por q te dijeron q ellos inventaron el supuesto virus. Ahora ¿d donde Obteniste toda esa  información? D Facebook d Instagram, d noticieros, de yuotuber, del estado https://t.co/BvkoysPdQv",odias a los rusos por q por culpa d ellos pagas mas caro la gasolina y como antes odiaba a los chinos por q te dijeron q ellos inventaron el supuesto virus  ahora  d donde obteniste toda esa  informaci n  d facebook d instagram  d noticieros  de yuotuber  del estado  ,es,0,0,2022-03-15 00:50:19+00:00,17,False,437,,
3688,2022-03-20 22:40:50+00:00,"RT @JPolitologos: India es el único miembro que no ha condenado la invasión de Rusia a Ucrania y que sigue importando productos rusos, entr…", india es el  nico miembro que no ha condenado la invasi n de rusia a ucrania y que sigue importando productos rusos  entr ,es,0,1,2019-05-14 02:45:29+00:00,574,False,18515,,
3689,2022-03-20 22:40:47+00:00,RT @Guerri1978: Aún así puso a la orden su experiencia y estructura comercial para salvarnos del genocidio que EEUU estaba planificando con…, a n as  puso a la orden su experiencia y estructura comercial para salvarnos del genocidio que eeuu estaba planificando con ,es,0,13,2022-03-01 21:12:24+00:00,116,False,89,,
3693,2022-03-20 22:40:43+00:00,"RT @Carbazas_: ... también de va de rositas, como lo hará el Rey Juan Carlos, comisionista de petroleo árabe (comprado más caro y pagado du…",     tambi n de va de rositas  como lo har  el rey juan carlos  comisionista de petroleo  rabe  comprado m s caro y pagado du ,es,0,2,2017-09-21 01:06:59+00:00,1087,False,54012,,
3697,2022-03-20 22:40:39+00:00,"@lilianaf523 Así de destruído tienes tu subconsciente de tantas mentiras y odio! 
Esa imágen qué colocaste pertenece al Rolling Acress Mall de Akron, Ohio.

Siiiii Tu lindo Estados Unidos dónde el galón de gasolina está a 7$ 🤣😂🤣😂

Investigar NO HACE DAÑO",  as  de destru do tienes tu subconsciente de tantas mentiras y odio   esa im gen qu  colocaste pertenece al rolling acress mall de akron  ohio   siiiii tu lindo estados unidos d nde el gal n de gasolina est  a 7        investigar no hace da o,es,3,0,2013-04-23 13:08:56+00:00,736,False,3249,Aragua,
3700,2022-03-20 22:40:38+00:00,"@ClaudioMan_ @Andrea78152778 @gbianchi404 Desalojo express, gobernantes colonos que se favorecen, incentiva el lavado de activos, desprotege a los niños en el proceso de adopción, aumenta el combustible cada un mes.... sólo algunos! Votá bien #votasi",       desalojo express  gobernantes colonos que se favorecen  incentiva el lavado de activos  desprotege a los ni os en el proceso de adopci n  aumenta el combustible cada un mes     s lo algunos  vot  bien  votasi,es,3,0,2018-01-26 20:23:08+00:00,71,False,3106,Montevideo - Uruguay ,
3705,2022-03-20 22:40:27+00:00,@anluma99 Tu si que eres desestabilizador con las chorradas que dices. Tenemos que estar todos callados y muy contentos a pesar de que cada día somos más pobres y tenemos que elegir si poner gasolina o comer. Ya está bien de calificar de ultra a todo el que protesta y con razón,  tu si que eres desestabilizador con las chorradas que dices  tenemos que estar todos callados y muy contentos a pesar de que cada d a somos m s pobres y tenemos que elegir si poner gasolina o comer  ya est  bien de calificar de ultra a todo el que protesta y con raz n,es,0,0,2017-11-21 22:44:04+00:00,168,False,6729,España,
3706,2022-03-20 22:40:27+00:00,"@Alberto16616851 @AndreaChavezTre Mira amigo antes las personas subía la gasolina saqueaban centros comerciales ,hoy sube la gas y es culpa de Calderón",    mira amigo antes las personas sub a la gasolina saqueaban centros comerciales  hoy sube la gas y es culpa de calder n,es,0,0,2021-04-28 14:44:19+00:00,66,False,1680,"Coacalco de Berriozábal, Méxic",
3708,2022-03-20 22:40:25+00:00,"-Ya me cansé de hablar de petróleo 
Ahora seré experto en desayunos https://t.co/hc89iqAhgw", ya me cans  de hablar de petr leo  ahora ser  experto en desayunos  ,es,4,0,2021-06-14 21:52:15+00:00,535,False,11736,"Guayaquil, Ecuador",
3719,2022-03-20 22:40:09+00:00,RT @tableroglobal: Toda Europa está tomando medidas para acelerar una transición energética que la libere de la dependencia al gas y el pet…, toda europa est  tomando medidas para acelerar una transici n energ tica que la libere de la dependencia al gas y el pet ,es,0,48,2016-09-27 10:33:12+00:00,177,False,2025,,
3724,2022-03-20 22:40:01+00:00,"Tras ocupar el 2° y 4° puesto en carrera, tanto Max Verstappen como Sergio Pérez se quedaron sin sumar en Sakhir por un problema que, sospecha el equipo, fue de la bomba de combustible. 

 https://t.co/uk3kzG2bdj",tras ocupar el 2  y 4  puesto en carrera  tanto max verstappen como sergio p rez se quedaron sin sumar en sakhir por un problema que  sospecha el equipo  fue de la bomba de combustible      ,es,2,1,2012-09-10 17:20:15+00:00,3153,False,11780,"Mar del Plata, Argentina",
3728,2022-03-20 22:39:54+00:00,A daddy yankee se le acabo la gasolina😔,a daddy yankee se le acabo la gasolina ,es,1,0,2017-05-18 06:43:05+00:00,1377,False,18475,"Concepción, Chile",
3729,2022-03-20 22:39:53+00:00,RT @MarCostaDB: Pues para estar protestando por el precio de la gasolina se están gastando una buena pasta paseando por la carretera con la…, pues para estar protestando por el precio de la gasolina se est n gastando una buena pasta paseando por la carretera con la ,es,0,34,2015-06-11 13:16:55+00:00,77,False,3573,,
3730,2022-03-20 22:39:51+00:00,@SaguierCalixto @edu_nakayama Hidrogeno verde para combustible y para fertilizantes,    nakayama hidrogeno verde para combustible y para fertilizantes,es,0,0,2019-08-12 05:03:53+00:00,22,False,556,,
3731,2022-03-20 22:39:50+00:00,"Lastimosamente, si regala no, igual vamos a pagar, ustedes saben Bachi Nuñez Jorge Brite, Aliana,  Nano galaverna  que hacen  con sus cupos de combustible? https://t.co/136Ac4Gn6W",lastimosamente  si regala no  igual vamos a pagar  ustedes saben bachi nu ez jorge brite  aliana   nano galaverna  que hacen  con sus cupos de combustible   ,es,1,0,2021-02-01 17:32:06+00:00,192,False,14249,Ciudad Presidente Stroessner.,
3732,2022-03-20 22:39:47+00:00,🔵 El hidrógeno: el combustible clave del futuro energético https://t.co/dUtiLXaBmb,  el hidr geno  el combustible clave del futuro energ tico  ,es,0,0,2015-12-22 19:47:06+00:00,40634,False,267,World Wide Web,
3733,2022-03-20 22:39:47+00:00,"18 de octubre, el cumple de mi padre y a él le gustaba La Gasolina ASI QUE PROCEDEEE https://t.co/yFu4KhPfBN",18 de octubre  el cumple de mi padre y a  l le gustaba la gasolina asi que procedeee  ,es,4,0,2012-08-26 01:49:51+00:00,964,False,54789,,
3744,2022-03-20 22:39:35+00:00,"X las noches la policía sigue mis sueños,con fuego y con gasolina me mantengo despierto, y quiero volver a mis cabales, no t pediré de vuelta las llaves
Un elixir a mis heridas.
El conticidio",x las noches la polic a sigue mis sue os con fuego y con gasolina me mantengo despierto  y quiero volver a mis cabales  no t pedir  de vuelta las llaves un elixir a mis heridas  el conticidio,es,0,0,2022-01-11 18:34:00+00:00,21,False,710,,
3746,2022-03-20 22:39:31+00:00,y encima no venir a españa..... eso no te lo perdono. eso no. YO me dejo la garganta cantando la gasolina y el culo perreándola para que ahora vengas y hagas esto,y encima no venir a espa a      eso no te lo perdono  eso no  yo me dejo la garganta cantando la gasolina y el culo perre ndola para que ahora vengas y hagas esto,es,1,0,2013-12-23 23:13:32+00:00,664,False,128445,💌,
3748,2022-03-20 22:39:28+00:00,"Como la gasolina está cara, pues híbrida https://t.co/HTpF0eIzrg",como la gasolina est  cara  pues h brida  ,es,0,0,2019-10-01 20:49:50+00:00,117,False,30266,"Santiago de Compostela, España",
3749,2022-03-20 22:39:28+00:00,Fast and Furious 10 va a tener el presupuesto más alto de la historia solo por la gasolina.,fast and furious 10 va a tener el presupuesto m s alto de la historia solo por la gasolina ,es,1,0,2019-02-10 00:29:23+00:00,36,False,32855,,
3752,2022-03-20 22:39:24+00:00,"@riveraguillermo @FicoGutierrez Este NO es el cambio que el pais necesita, es apagar un incendio con gasolina, la cura es muchisimo peor que la enfermedad. @petrogustavo y los cabecillas que lo rodean representan lo mas bajo, corrupto, miserable e inhumano de nuestra sociedad #ELNConPetro https://t.co/nfSXziH07N",    este no es el cambio que el pais necesita  es apagar un incendio con gasolina  la cura es muchisimo peor que la enfermedad    y los cabecillas que lo rodean representan lo mas bajo  corrupto  miserable e inhumano de nuestra sociedad  elnconpetro  ,es,0,0,2016-08-15 16:40:21+00:00,629,False,55002,"Medellín, Colombia",
3753,2022-03-20 22:39:22+00:00,"@profeMartta Ya sé que te referías a la guerra, la pandemia, la huelga del transporte de mercancías, la subida del petróleo, gas, electricidad, etc etc, la cosa está fatal 🤦‍♂",  ya s  que te refer as a la guerra  la pandemia  la huelga del transporte de mercanc as  la subida del petr leo  gas  electricidad  etc etc  la cosa est  fatal    ,es,1,0,2018-12-21 11:35:08+00:00,6083,False,319227,"Córdoba, España. ",
3754,2022-03-20 22:39:19+00:00,"En nuestra última consulta, la gasolinera más barata es ESPECIAL O en #Valladolid. Nuestro usuario va a ahorrarse 2.20€ en este repostaje (un 2.5%). La gasolinera está en: https://t.co/Nl9qraOcyU",en nuestra  ltima consulta  la gasolinera m s barata es especial o en  valladolid  nuestro usuario va a ahorrarse 2 20  en este repostaje  un 2 5    la gasolinera est  en   ,es,0,0,2020-11-22 21:37:23+00:00,109,False,13,Spain (EU),
3755,2022-03-20 22:39:19+00:00,"porque su detención está causando una grave crisis de combustible.  Muchos coches hacen largas colas durante varios días para conseguir algunos litros de combustible.
 Agregó que “muchos pacientes renales no pueden hacerse diálisis por la falta de derivados del petróleo y no hay",porque su detenci n est  causando una grave crisis de combustible   muchos coches hacen largas colas durante varios d as para conseguir algunos litros de combustible   agreg  que  muchos pacientes renales no pueden hacerse di lisis por la falta de derivados del petr leo y no hay,es,11,0,2019-11-20 20:16:54+00:00,3378,False,20966,Chile ,
3761,2022-03-20 22:39:11+00:00,"RT @AfpFactual: 🇻🇪 ¿CNN informó que EEUU levantó sanciones a Venezuela y que importará petróleo de ese país?
 
❌La cadena de noticias no hi…",     cnn inform  que eeuu levant  sanciones a venezuela y que importar  petr leo de ese pa s     la cadena de noticias no hi ,es,0,25,2019-05-10 15:26:03+00:00,1439,False,3419,Venezuela,
3762,2022-03-20 22:39:11+00:00,"¿Activos para la última vuelta World Tour de @daddy_yankee?

Activo✊ así como vi llegar La Gasolina debo ver como se va. 
(Y si, ya estoy viejo).", activos para la  ltima vuelta world tour de   yankee   activo  as  como vi llegar la gasolina debo ver como se va    y si  ya estoy viejo  ,es,0,0,2009-12-08 03:26:49+00:00,1546,False,2112,"Bogotá, D.C., Colombia",
