,Created_at,Text,Clean Text,Lang,Favourite_count,Retweet_count,Fecha creacion,Followers,Verificado,Cantidad Fav,País,Coordenadas
950,2022-03-20 23:38:24+00:00,"RT @BauzaOficial: #pozarica Me pregunto... ¿Cuánto nos habrán costado, del recurso público, las ""Fiestas"" del petroleo en Poza Rica?

Dudo…",  pozarica me pregunto     cu nto nos habr n costado  del recurso p blico  las  fiestas  del petroleo en poza rica   dudo ,es,0,3,2009-11-05 07:25:57+00:00,3006,False,12119,"Poza Rica, Veracruz, México",
954,2022-03-20 23:38:15+00:00,"RT @OR_ROMA_: @CarlosLoret @latinus_us AMLO Nunca dijo que la gasolina bajaría a $10.00.
En el año y en el contexto general dijo, ""sí hoy f…",     us amlo nunca dijo que la gasolina bajar a a  10 00  en el a o y en el contexto general dijo   s  hoy f ,es,0,14,2012-10-07 15:51:46+00:00,2613,False,90628,,
959,2022-03-20 23:38:11+00:00,"@servimatoficial Más gasolina y medios de transporte caros, los ricos se mueven en helicóptero...",  m s gasolina y medios de transporte caros  los ricos se mueven en helic ptero   ,es,0,0,2014-12-05 01:05:30+00:00,49,False,16657,México,
960,2022-03-20 23:38:09+00:00,RT @EdgarBaezP: #Estreno 🔴 | Nayib Bukele: ¿Por qué EEUU acude a Venezuela para negociar petróleo? https://t.co/8W0ZFBvYZx,  estreno     nayib bukele   por qu  eeuu acude a venezuela para negociar petr leo   ,es,0,25,2020-08-03 15:54:48+00:00,188,False,63,El Salvador,
964,2022-03-20 23:38:03+00:00,"#pozarica Me pregunto... ¿Cuánto nos habrán costado, del recurso público, las ""Fiestas"" del petroleo en Poza Rica?

Dudo mucho hayan traído algún beneficio a la ciudad, a algunos pocos sí, ni hablar, porque derroche de dinero sí hubo, pero ¿Beneficio a Poza Rica? No lo creo.
👇 https://t.co/sVF8D2P0iT", pozarica me pregunto     cu nto nos habr n costado  del recurso p blico  las  fiestas  del petroleo en poza rica   dudo mucho hayan tra do alg n beneficio a la ciudad  a algunos pocos s   ni hablar  porque derroche de dinero s  hubo  pero  beneficio a poza rica  no lo creo     ,es,5,3,2019-11-13 17:12:07+00:00,750,False,11058,"Poza Rica de Hidalgo, Veracruz",
967,2022-03-20 23:37:56+00:00,"RT @rgcq_cl: Presidente de Ucrania @ZelenskyyUa
""No tenemos un territorio enorme, de océano a océano, no tenemos armas nucleares, no llenam…", presidente de ucrania    no tenemos un territorio enorme  de oc ano a oc ano  no tenemos armas nucleares  no llenam ,es,0,2,2009-03-25 16:02:27+00:00,1189,False,8278,España,
972,2022-03-20 23:37:47+00:00,"Hay una confabulación del rosadaje multifruta para seguir con el Plan Atlanta, fundir Ancap y privatizar la educasion. No sacan el petroleo y suben la nasta. Por eso hay que botar nos. https://t.co/p4nSrIYA9I",hay una confabulaci n del rosadaje multifruta para seguir con el plan atlanta  fundir ancap y privatizar la educasion  no sacan el petroleo y suben la nasta  por eso hay que botar nos   ,es,3,0,2022-02-09 23:50:26+00:00,363,False,328,,
973,2022-03-20 23:37:45+00:00,@DickVarela @carolina_rocha_ 😂😂😂😂😂😂😂😂 estás seguro !! Pregunta a qué hora llegan las pipas con combustible desde la CDMX 😂😂😂😂😂😂😂😂😂😂😂😂😂😂😂😂 pregunta cuánto haces atravesando el campo de polvorín (20 min ) 😂😂😂😂😂😂😂😂😂,    rocha           est s seguro    pregunta a qu  hora llegan las pipas con combustible desde la cdmx                  pregunta cu nto haces atravesando el campo de polvor n  20 min            ,es,0,0,2011-06-12 22:25:06+00:00,146,False,10177,,
980,2022-03-20 23:37:37+00:00,"No estoy lista ❤💔 , encontre un gusto por el genero urbano gracias a él,clasicos como"" llamado de emergencia ,pose, la gasolina lo que paso""   viviran en mi .gracias daddy yankee 😭👏 https://t.co/hl88QRU4jo",no estoy lista      encontre un gusto por el genero urbano gracias a  l clasicos como  llamado de emergencia  pose  la gasolina lo que paso    viviran en mi  gracias daddy yankee     ,es,0,0,2014-11-06 22:47:28+00:00,202,False,12693, ,
984,2022-03-20 23:37:32+00:00,RT @swiftxrobbins: subir los precios de la gasolina tiene consecuencias, subir los precios de la gasolina tiene consecuencias,es,0,2,2021-11-30 23:05:39+00:00,131,False,166,"Andalucía, España",
986,2022-03-20 23:37:30+00:00,"@MexicanBBQ Si voto y no vote por la mierda de anaya o de meade me pregunto que hubieran hecho ellos en la pandemia, cuando estara el salario mínimo, la gasolina, las vacunas que hubiera pasado jauajajaja",  si voto y no vote por la mierda de anaya o de meade me pregunto que hubieran hecho ellos en la pandemia  cuando estara el salario m nimo  la gasolina  las vacunas que hubiera pasado jauajajaja,es,0,0,2022-02-03 05:47:27+00:00,0,False,16,,
988,2022-03-20 23:37:27+00:00,"RT @higadodejuanita: @canalN_ Vamos todos a la marcha! El precio del pan 🍞 gasolina ⛽️ comestibles, y demás se han disparado al doble de cu…",    vamos todos a la marcha  el precio del pan   gasolina    comestibles  y dem s se han disparado al doble de cu ,es,0,4,2009-06-27 17:08:39+00:00,364,False,23932,Lima,
993,2022-03-20 23:37:22+00:00,RT @Carmenmillang: Más de 300 #camiones recorren las calles de #Lebrija. Familias muy perjudicadas por el precio del combustible. Los vecin…, m s de 300  camiones recorren las calles de  lebrija  familias muy perjudicadas por el precio del combustible  los vecin ,es,0,45,2019-09-01 21:36:13+00:00,30,False,1835,Lebrija,
994,2022-03-20 23:37:16+00:00,Yo cuando logré comprar 5 litros de gasolina https://t.co/5dxMy71bci,yo cuando logr  comprar 5 litros de gasolina  ,es,2,0,2020-05-21 00:23:11+00:00,92,False,16471,"Hidalgo, México",
995,2022-03-20 23:37:15+00:00,"@mezelaw @german_stereo @Ferimbro1 @elguisodebagre Si... de Rusia se conoce lo militar y económico, sus planes poco y nada ya que depende de la venta fe gas y petróleo, y a eso se dedica, tiene una economia frágil, tanto como china, pero la diferencia es que China históricamente fue hermética",    stereo     si    de rusia se conoce lo militar y econ mico  sus planes poco y nada ya que depende de la venta fe gas y petr leo  y a eso se dedica  tiene una economia fr gil  tanto como china  pero la diferencia es que china hist ricamente fue herm tica,es,0,0,2011-03-23 13:23:12+00:00,128,False,2289,Ciudad Autónoma de Buenos Aire,
997,2022-03-20 23:37:13+00:00,RT @SachaPelaiz: ¿Cómo puede ser posible q los regímenes de Irán y Venezuela fueran tan malos en el pasado y ahora se pretenda comprar su p…,  c mo puede ser posible q los reg menes de ir n y venezuela fueran tan malos en el pasado y ahora se pretenda comprar su p ,es,0,60,2010-05-09 21:03:20+00:00,584,False,6990,venezuela,
998,2022-03-20 23:37:13+00:00,"RT @Carbazas_: #MadridBarca PUTAESPAÑA y sus oligarcas militares, del combustible y energias. Mafiosos que además de sangrar a los catalane…",  madridbarca putaespa a y sus oligarcas militares  del combustible y energias  mafiosos que adem s de sangrar a los catalane ,es,0,11,2013-09-15 17:38:08+00:00,8283,False,740083,"Barcelona, CATALUNYA",
1000,2022-03-20 23:37:09+00:00,"RT @ejdecena: Hospitales vueltos mierda, servicio eléctrico en el suelo, agua potable inexistente, gasolina desaparecida, gas no hay, y el…", hospitales vueltos mierda  servicio el ctrico en el suelo  agua potable inexistente  gasolina desaparecida  gas no hay  y el ,es,0,94,2010-07-06 03:04:10+00:00,3587,False,11290,Venezuela,
1001,2022-03-20 23:37:08+00:00,RT @asoc_vpla: Tienes alguna camita usada para perritos que puedas donarle a nuestros animalitos? Acércate el Domingo 27/03 a la  #Jornadad…, tienes alguna camita usada para perritos que puedas donarle a nuestros animalitos  ac rcate el domingo 27 03 a la   jornadad ,es,0,30,2013-11-19 22:03:20+00:00,1807,False,59980,,
1002,2022-03-20 23:37:06+00:00,no le gusta la gasolina https://t.co/jBYCVl9N9t,no le gusta la gasolina  ,es,1,0,2021-03-23 19:32:30+00:00,51,False,1510,alex they ,
1004,2022-03-20 23:37:02+00:00,"RT @LaurensLorenz: Cómo pretende darnos un soporte @gabrielboric ?
La inflación al 7.8% en los ult 12 meses; el BC subió de 4% a 5.5% la ta…", c mo pretende darnos un soporte     la inflaci n al 7 8  en los ult 12 meses  el bc subi  de 4  a 5 5  la ta ,es,0,6,2015-06-13 02:09:04+00:00,210,False,13414,,
1014,2022-03-20 23:36:50+00:00,"@Cooperativa 🎵🎤 A ella le gusta la gasolina
Dame mas gasolina
Còmo le encanta la gasolina...😁",     a ella le gusta la gasolina dame mas gasolina c mo le encanta la gasolina    ,es,1,0,2013-05-30 22:50:36+00:00,1688,False,43340,I'm from Chile,
1017,2022-03-20 23:36:47+00:00,"@Mblackmen14 @ELabelenda @Marihw77 @ConejoMara @mamen_woman @IvalleValle @vigobulldog Anda lee majo, que pone ahí de bajar impuestos, que estamos pagando a 2 euros litro de diesel. Ahora sigue jugando con tus otras cuentas https://t.co/AMrI49LxW7",          woman     anda lee majo  que pone ah  de bajar impuestos  que estamos pagando a 2 euros litro de diesel  ahora sigue jugando con tus otras cuentas  ,es,0,0,2020-10-09 11:59:17+00:00,1216,False,44823,,
1021,2022-03-20 23:36:42+00:00,"@_VicenteSerrano @hdemauleon Que te pasó de mauleon?

Pero, podrías pasarnos las coordenadas del Aeropuerto Internacional Felipe Calderón ¿O como tu lo encontraste, ""Aeropuerto Internacional Carnicero de Michoacan"" en google?

Es que sólo hay una barda que dicen hace una excelente gasolina imaginaria.",  vicenteserrano   que te pas  de mauleon   pero  podr as pasarnos las coordenadas del aeropuerto internacional felipe calder n  o como tu lo encontraste   aeropuerto internacional carnicero de michoacan  en google   es que s lo hay una barda que dicen hace una excelente gasolina imaginaria ,es,15,3,2012-10-27 06:29:55+00:00,149,False,24854,,
1027,2022-03-20 23:36:35+00:00,"Presidente de Ucrania @ZelenskyyUa
""No tenemos un territorio enorme, de océano a océano, no tenemos armas nucleares, no llenamos el mercado mundial con petróleo y gas. Pero tenemos nuestra gente y nuestra tierra. Para nosotros es oro"". https://t.co/xflRD2xFqm",presidente de ucrania    no tenemos un territorio enorme  de oc ano a oc ano  no tenemos armas nucleares  no llenamos el mercado mundial con petr leo y gas  pero tenemos nuestra gente y nuestra tierra  para nosotros es oro    ,es,0,2,2010-03-11 01:18:34+00:00,3578,False,86,Region de Coquimbo,
1031,2022-03-20 23:36:31+00:00,@PopBase selena carried gasolina,  selena carried gasolina,es,0,0,2021-03-26 15:45:36+00:00,153,False,3298,é𝚕/é𝚕 19y,
1034,2022-03-20 23:36:28+00:00,"RT @ManuelaSicero: ""No solamente hicieron caer la producción hasta 700 MBD de petróleo, sino que dejaron perder los bienes de PDVSA y los c…",  no solamente hicieron caer la producci n hasta 700 mbd de petr leo  sino que dejaron perder los bienes de pdvsa y los c ,es,0,3,2020-03-27 11:30:58+00:00,18140,False,46837,,
1035,2022-03-20 23:36:28+00:00,"RT @ManoloOrtegano: ""No solamente hicieron caer la producción hasta 700 MBD de petróleo, sino que dejaron perder los bienes de PDVSA y los…",  no solamente hicieron caer la producci n hasta 700 mbd de petr leo  sino que dejaron perder los bienes de pdvsa y los ,es,0,4,2020-03-27 11:30:58+00:00,18140,False,46837,,
1038,2022-03-20 23:36:22+00:00,"RT @AlertaNews24: 🌏 | AHORA: Los precios del petróleo caen un 3,6% en las primeras operaciones este lunes.",     ahora  los precios del petr leo caen un 3 6  en las primeras operaciones este lunes ,es,0,1066,2009-10-14 03:29:12+00:00,163,False,28603,"Valencia, Venezuela",
1039,2022-03-20 23:36:20+00:00,Agenda electoral de Lula incluye precios del combustible https://t.co/2sQ1hDJdiD,agenda electoral de lula incluye precios del combustible  ,es,11,4,2009-09-24 12:48:51+00:00,4421496,True,1709,"Caracas, Venezuela",
1040,2022-03-20 23:36:20+00:00,RT @NoticiasCaracol: Situación económica mundial: la guerra iniciada por la invasión de Rusia a Ucrania deja un difícil panorama que no sol…, situaci n econ mica mundial  la guerra iniciada por la invasi n de rusia a ucrania deja un dif cil panorama que no sol ,es,0,41,2021-11-27 10:04:09+00:00,1,False,5,,
1044,2022-03-20 23:36:17+00:00,"@carolina_rocha_ Cómo que van a entregar la obre si aún está en obra negra !! Por cierto, a qué hora llegan las pipas de combustible desde CDMX!!!???😂😂😂😂😂😂😂😂 esto es real !!!! Tan un no quedo que van a mandar pipas 😂😂😂😂😂😂😂😂😂😂😂😂😂🤣🤣",  rocha  c mo que van a entregar la obre si a n est  en obra negra    por cierto  a qu  hora llegan las pipas de combustible desde cdmx               esto es real      tan un no quedo que van a mandar pipas                ,es,0,0,2011-06-12 22:25:06+00:00,146,False,10177,,
1048,2022-03-20 23:36:14+00:00,"Este señor de la secretaria de energia es un bufon , señor el barril de petreleo se cotiza a precio brent , y sigue bajando y bajando y eso que es el mas caro , ya deberia haber bajado el precio del combustible , y la espectativa es a la baja ...",este se or de la secretaria de energia es un bufon   se or el barril de petreleo se cotiza a precio brent   y sigue bajando y bajando y eso que es el mas caro   ya deberia haber bajado el precio del combustible   y la espectativa es a la baja    ,es,6,5,2012-02-10 17:25:44+00:00,2884,False,802,ciudad de Panamá,
1050,2022-03-20 23:36:11+00:00,"India , tercer mayor importador de petróleo del mundo, está a punto de firmar un megacontrato para comprar petróleo a Rusia con un gran descuento y utilizando un mecanismo rublo-rupia.",india   tercer mayor importador de petr leo del mundo  est  a punto de firmar un megacontrato para comprar petr leo a rusia con un gran descuento y utilizando un mecanismo rublo rupia ,es,2,0,2020-11-19 22:56:35+00:00,214,False,1452,,
1051,2022-03-20 23:36:10+00:00,RT @MR_LIBERTAD_: @carreragonzalo @izkia @izkia se burla d millones mujeres chilenas q se sacan la cresta y aperran solitas y q NO tienen E…,       se burla d millones mujeres chilenas q se sacan la cresta y aperran solitas y q no tienen e ,es,0,31,2010-01-23 17:17:44+00:00,2594,False,83922,,
1053,2022-03-20 23:36:05+00:00,RT @MarMT12: Con lo que cuesta la gasolina el “yo voy a recogerte” va a convertirse en la más auténtica y genuina declaración de amor. Yo a…, con lo que cuesta la gasolina el  yo voy a recogerte  va a convertirse en la m s aut ntica y genuina declaraci n de amor  yo a ,es,0,3352,2013-01-26 08:56:14+00:00,147,False,1566,Tenerife.,
1055,2022-03-20 23:36:03+00:00,Gracias muchacho que me puso gasolina por subirme el autoestima tqm ✨✨✨✨✨,gracias muchacho que me puso gasolina por subirme el autoestima tqm      ,es,0,0,2018-03-23 02:20:09+00:00,35,False,2704,"Ahome, Sinaloa",
1056,2022-03-20 23:36:01+00:00,@m_ebrard Un filtro más y conviertes el petróleo en agua.,  ebrard un filtro m s y conviertes el petr leo en agua ,es,0,0,2012-03-20 20:19:01+00:00,6,False,2581,"Naucalpan de Juárez, México",
1057,2022-03-20 23:36:00+00:00,"@updatechartuc amo uc, Gasolina hit atemporal. Sempre será gigante",  amo uc  gasolina hit atemporal  sempre ser  gigante,es,0,0,2016-11-11 22:53:37+00:00,1968,False,49162,heaven & hell,
1059,2022-03-20 23:35:56+00:00,"RT @Riverplatense: @porquetendencia @daddy_yankee Falleció el reggaetón
Feneció el perreo
Pereció la gasolina",     yankee falleci  el reggaet n feneci  el perreo pereci  la gasolina,es,0,12,2014-12-04 19:16:19+00:00,588,False,140331,Carlos Pellegrini / Rafaela,
1063,2022-03-20 23:35:50+00:00,"RT @PameKatrala: @rodrigosepu @Julievillal @gabrielboric @PamJiles . Así como la gasolina, la harina el kilo está 1.400. quien regula los p…",           as  como la gasolina  la harina el kilo est  1 400  quien regula los p ,es,0,25,2021-12-27 20:43:10+00:00,1012,False,74,,
1064,2022-03-20 23:35:49+00:00,"@VmRocky @pacormzjmz @ChumelTorres Pobre, no le han subido los impuestos, ni la gasolina, le aumentaron al doble el salario mínimo, tiene la moneda mejor apreciada ante el dólar, México entro en el topten de países de mayor IED y con todo eso el gato dice que la economía va mal.

JAJAJAJAJAJAJAJA",      pobre  no le han subido los impuestos  ni la gasolina  le aumentaron al doble el salario m nimo  tiene la moneda mejor apreciada ante el d lar  m xico entro en el topten de pa ses de mayor ied y con todo eso el gato dice que la econom a va mal   jajajajajajajaja,es,0,0,2014-01-09 17:04:33+00:00,402,False,16154,,
1065,2022-03-20 23:35:48+00:00,@alcaldia_ss @CAMSanSalvador Construccion ilegal de gasolinera en prolongación juan pablo II costado norte antes de llegar a 75 av norte viniendo de oriente a poniente. Art 81,  ss   construccion ilegal de gasolinera en prolongaci n juan pablo ii costado norte antes de llegar a 75 av norte viniendo de oriente a poniente  art 81,es,0,0,2014-09-15 19:01:00+00:00,135,False,5802,,
1066,2022-03-20 23:35:48+00:00,RT @Alberto11386778: #ZuLia #Maracaibo exige a @NicolasMaduro acabar con. Las #MafiasMilitaresDeLaGasolina enEl Zulia Maracaibo . Mantienen…,  zulia  maracaibo exige a   acabar con  las  mafiasmilitaresdelagasolina enel zulia maracaibo   mantienen ,es,0,2,2019-12-06 01:58:55+00:00,508,False,463,Estados Unidos,
1067,2022-03-20 23:35:47+00:00,"RT @cocando: Los métodos menos visibles para comprar el crudo ruso podrían incluir esquemas de crédito abiertos, pagos anticipados y negoci…", los m todos menos visibles para comprar el crudo ruso podr an incluir esquemas de cr dito abiertos  pagos anticipados y negoci ,es,0,3,2010-03-25 11:45:26+00:00,657,False,30921,,
1068,2022-03-20 23:35:46+00:00,"@mariwell_42 @JC_C_A Han reclamado:
No vender a pérdida
Cambiar asignaciones del fondo PAC
Cambiar las leyes de caza cinegética fuente de ingreso del campo
Reducir precio de fertilizantes, diésel y plásticos 
Hacer cumplir los períodos de importación 
No acabar con toro de lidia
Pagos por lobos etc.",  42   c a han reclamado  no vender a p rdida cambiar asignaciones del fondo pac cambiar las leyes de caza cineg tica fuente de ingreso del campo reducir precio de fertilizantes  di sel y pl sticos  hacer cumplir los per odos de importaci n  no acabar con toro de lidia pagos por lobos etc ,es,0,0,2010-05-22 18:23:32+00:00,253,False,36101,Barcelona Spain,
1072,2022-03-20 23:35:45+00:00,@Mariet23_ Será por la crisis energética se quedó sin gasolina..,   ser  por la crisis energ tica se qued  sin gasolina  ,es,3,0,2009-06-30 00:40:41+00:00,67541,False,109822,In the World,
1073,2022-03-20 23:35:43+00:00,"@VLADIMIR_CERRON Que va a refinar Talara, si la producción y exploración de Petróleo en el país está deprimida por decir lo menos. Mientras esto no mejore, nuestros precios dependerán directamente del precio del crudo que importemos. Talara solo sirvió para que nos roben una vez más.",  cerron que va a refinar talara  si la producci n y exploraci n de petr leo en el pa s est  deprimida por decir lo menos  mientras esto no mejore  nuestros precios depender n directamente del precio del crudo que importemos  talara solo sirvi  para que nos roben una vez m s ,es,6,2,2020-12-03 20:45:50+00:00,657,False,126894,,
1074,2022-03-20 23:35:42+00:00,"En nuestra última consulta, la gasolinera más barata es BONAREA en #SantCugatSesgarrigues. Nuestro usuario va a ahorrarse 8.40€ en este repostaje (un 9.3%). La gasolinera está en: https://t.co/SmbNJyViRj",en nuestra  ltima consulta  la gasolinera m s barata es bonarea en  santcugatsesgarrigues  nuestro usuario va a ahorrarse 8 40  en este repostaje  un 9 3    la gasolinera est  en   ,es,0,0,2020-11-22 21:37:23+00:00,109,False,13,Spain (EU),
1075,2022-03-20 23:35:41+00:00,"@epigmenioibarra @FelipeCalderon No se olviden de los millones de petróleo y gasolina que importó a precios exorbitantes, allá por el 2008. Donde quedó ese dinero?",    no se olviden de los millones de petr leo y gasolina que import  a precios exorbitantes  all  por el 2008  donde qued  ese dinero ,es,0,0,2014-01-09 15:11:49+00:00,122,False,13324,,
1076,2022-03-20 23:35:40+00:00,#ZuLia #Maracaibo exige a @NicolasMaduro acabar con. Las #MafiasMilitaresDeLaGasolina enEl Zulia Maracaibo . Mantienen una situación de falta de gasolina Inducida para generar Corruptos, zulia  maracaibo exige a   acabar con  las  mafiasmilitaresdelagasolina enel zulia maracaibo   mantienen una situaci n de falta de gasolina inducida para generar corruptos,es,3,2,2019-12-06 01:58:55+00:00,508,False,463,Estados Unidos,
1081,2022-03-20 23:35:35+00:00,"@VaushV anti-imperialistas, pero esto le va a causar un corto circuito a la base de niños rata que siguen y masturban a este pinche güero. Ojalá un día los latinos, negros e indígenas tomemos EEUU para mandar basura gringa liberaloide deportada para Alaska a sacar petróleo con sus manos.",  anti imperialistas  pero esto le va a causar un corto circuito a la base de ni os rata que siguen y masturban a este pinche g ero  ojal  un d a los latinos  negros e ind genas tomemos eeuu para mandar basura gringa liberaloide deportada para alaska a sacar petr leo con sus manos ,es,0,0,2021-11-19 19:07:24+00:00,204,False,4143,🚩 Federación Caribeña 🏝️,
1082,2022-03-20 23:35:35+00:00,Se retira Daddy Yankee.... Seguro que todo es por culpa de los precios de la gasolina 😭😭😭😭,se retira daddy yankee     seguro que todo es por culpa de los precios de la gasolina     ,es,2,0,2015-09-19 08:30:32+00:00,179,False,38075,Estadio Vicente Calderón,
1085,2022-03-20 23:35:32+00:00,subir los precios de la gasolina tiene consecuencias https://t.co/hl9NjfGBug,subir los precios de la gasolina tiene consecuencias  ,es,1,2,2020-04-23 09:45:33+00:00,2337,False,147252,seven shades of heartbreak,
1089,2022-03-20 23:35:24+00:00,la gasolina sube y el se va @daddy_yankee #daddyyankee #gasolina,la gasolina sube y el se va   yankee  daddyyankee  gasolina,es,0,0,2014-08-11 23:56:49+00:00,27,False,886,"Provo,UT",
1092,2022-03-20 23:35:21+00:00,"@newsonzer @updatechartuc despacito, con calma, gasolina...",    despacito  con calma  gasolina   ,es,0,0,2019-12-06 23:58:16+00:00,224,False,6046,"Recife, Brasil",
1095,2022-03-20 23:35:20+00:00,"RT @apoyocanino: En Mérida quemaron con gasolina a este perrito comunitario como ""cura"" a la sarna. Ahora Tiene quemaduras de 3 grado. Nece…", en m rida quemaron con gasolina a este perrito comunitario como  cura  a la sarna  ahora tiene quemaduras de 3 grado  nece ,es,0,1261,2021-09-16 01:42:37+00:00,380,False,26840,,
1098,2022-03-20 23:35:18+00:00,"@GLlamazares Que te ocupen tu casa, que tus hijos no tengan para comer, que no puedas encender la luz ni poner la calefacción, no puedas usar el coche por el precio de la gasolina, que el gobierno te asfixie a impuestos mientras ellos derrochan miles miles de millones en chorradas",  que te ocupen tu casa  que tus hijos no tengan para comer  que no puedas encender la luz ni poner la calefacci n  no puedas usar el coche por el precio de la gasolina  que el gobierno te asfixie a impuestos mientras ellos derrochan miles miles de millones en chorradas,es,0,0,2011-07-03 22:04:56+00:00,1703,False,68405,"Madrid, Comunidad de Madrid",
1099,2022-03-20 23:35:17+00:00,"RT @Ver_y_too: Los zurdos defendiendo a San Villalta por usar la gasolina de la AL sin tener vehículo.
De verdad son como una secta 😂", los zurdos defendiendo a san villalta por usar la gasolina de la al sin tener veh culo  de verdad son como una secta  ,es,0,5,2017-11-07 19:25:02+00:00,136,False,34570,,
1102,2022-03-20 23:35:15+00:00,"RT @IvanDuque: Colombia puede ser, en los próximos años, uno de los más importantes abastecedores de este combustible del siglo XXI, el Hid…", colombia puede ser  en los pr ximos a os  uno de los m s importantes abastecedores de este combustible del siglo xxi  el hid ,es,0,93,2010-10-31 15:26:54+00:00,590,False,55945,,
1104,2022-03-20 23:35:14+00:00,"RT @JoseyyyJose: Las tensiones entre Estados Unidos y Arabia Saudita complican el impulso de más petróleo
https://t.co/3ovx0n5gBB", las tensiones entre estados unidos y arabia saudita complican el impulso de m s petr leo  ,es,0,3,2015-05-23 16:40:43+00:00,2673,False,144189,CDMX,
1112,2022-03-20 23:35:05+00:00,"Las centrales nucleares producen el MWh a un precio de 14,4€, desglosándose este valor en 7,0€ / MWh de inversión, 3,0€ / MWh de operación y mantenimiento anual, 2,0€ / MWh de combustible y 2,0€ / MWh de inversiones anuales para la mejora de las instalaciones. https://t.co/jNR4IuJZ1p",las centrales nucleares producen el mwh a un precio de 14 4   desglos ndose este valor en 7 0    mwh de inversi n  3 0    mwh de operaci n y mantenimiento anual  2 0    mwh de combustible y 2 0    mwh de inversiones anuales para la mejora de las instalaciones   ,es,1,1,2021-02-08 19:11:12+00:00,501,False,26,"El Ferrol,(La Coruña)",
1114,2022-03-20 23:35:00+00:00,@requiem_soul IPC y deflactor del PIB miden cosas muy distintas: bienes de consumo adquiridos internamente (incluyendo importaciones) versus bienes totales producidos internamente. Un factor pueden ser las importaciones de petróleo,  soul ipc y deflactor del pib miden cosas muy distintas  bienes de consumo adquiridos internamente  incluyendo importaciones  versus bienes totales producidos internamente  un factor pueden ser las importaciones de petr leo,es,1,0,2010-02-09 18:54:44+00:00,346768,True,833,"Madrid, Comunidad de Madrid",
1116,2022-03-20 23:34:57+00:00,"@pelegrinc Don Pelegrin, este gobierno no se atreve a tocar intereses de importadores de derivados petróleo y otros",  don pelegrin  este gobierno no se atreve a tocar intereses de importadores de derivados petr leo y otros,es,0,0,2021-09-21 17:30:15+00:00,20,False,865,,
1119,2022-03-20 23:34:55+00:00,"@Chris_Montz No le quite lo pegajoso de la canción...dale dale , gasolina!",  montz no le quite lo pegajoso de la canci n   dale dale   gasolina ,es,0,0,2010-05-05 17:14:03+00:00,184,False,15349,,
