,Created_at,Text,Clean Text,Lang,Favourite_count,Retweet_count,Fecha creacion,Followers,Verificado,Cantidad Fav,País,Coordenadas
974,2022-03-25 23:39:49+00:00,"RT @alvarado181071: ¿Porqué celebrarán tanto ""el bajo precio"" de la gasolina? eso solo beneficia a los que tienen auto, y además son subsid…",  porqu  celebrar n tanto  el bajo precio  de la gasolina  eso solo beneficia a los que tienen auto  y adem s son subsid ,es,0,1,2010-04-15 22:37:15+00:00,2007,False,25454,Ciudad de México,
975,2022-03-25 23:39:48+00:00,RT @fer170211: ya me importa más traer gasolina que traer dinero pa’ gastar, ya me importa m s traer gasolina que traer dinero pa  gastar,es,0,3,2016-09-04 01:14:26+00:00,261,False,5037,"Nogales, Sonora",
977,2022-03-25 23:39:45+00:00,RT @D3N1S: ❗️#ÚLTIMAHORA | Gobierno de #Nicaragua asumirá el 100% del incremento del precio del Gas Licuado y el 70% de las Gasolinas y Dié…,     ltimahora   gobierno de  nicaragua asumir  el 100  del incremento del precio del gas licuado y el 70  de las gasolinas y di  ,es,0,12,2021-05-28 04:15:35+00:00,729,False,847,Nicaragua,
979,2022-03-25 23:39:42+00:00,RT @CTipitapa: Comandante Daniel Ortega Presidente de #Nicaragua orienta al INE y Ministerio de Energía y Minas informar a las familias Nic…, comandante daniel ortega presidente de  nicaragua orienta al ine y ministerio de energ a y minas informar a las familias nic ,es,0,9,2017-02-23 20:49:17+00:00,1120,False,95577,"Valle De La Pascua, Venezuela",
980,2022-03-25 23:39:41+00:00,RT @rosira_rosi: @NoaGresiva Queda claro que a este grupo de transportistas le importan un bledo las reivindicaciones y solo quieren tumbar…,   queda claro que a este grupo de transportistas le importan un bledo las reivindicaciones y solo quieren tumbar ,es,0,21,2020-01-22 21:52:48+00:00,104,False,12323,,
981,2022-03-25 23:39:40+00:00,"RT @abc_es: Canarias devolverá el 99,9% del impuesto de combustible a los profesionales https://t.co/RrHYP0ihHK", canarias devolver  el 99 9  del impuesto de combustible a los profesionales  ,es,0,18,2020-03-23 22:10:51+00:00,78,False,1458,"Jerez de la Frontera, España",
982,2022-03-25 23:39:37+00:00,"Hoy ha vuelto a subir el combustible 🔥🔥😡😡😡
https://t.co/nXyberSHBX",hoy ha vuelto a subir el combustible        ,es,0,0,2020-06-06 10:15:53+00:00,1052,False,19145,Vigo,
987,2022-03-25 23:39:27+00:00,"El litro de gasolina en madrid por arriba del $40, que ganas de ser guachicolero por acá",el litro de gasolina en madrid por arriba del  40  que ganas de ser guachicolero por ac ,es,0,0,2021-12-28 00:12:22+00:00,14,False,6,,
990,2022-03-25 23:39:24+00:00,"RT @napocornejo: Ustedes apriétense en cincho porque la buena comida es para los estafa... ¡perdón!, bitcoiners internacionales.

Por ciert…", ustedes apri tense en cincho porque la buena comida es para los estafa     perd n   bitcoiners internacionales   por ciert ,es,0,114,2010-07-15 20:01:27+00:00,886,False,14844,El Salvador.,
991,2022-03-25 23:39:24+00:00,@Willidaheat @sfcaponte @Corujo22 Graciad por defender los intereses de los ricos Petroleo y armas.. https://t.co/vA9xbcqC3Y,      graciad por defender los intereses de los ricos petroleo y armas    ,es,0,0,2008-07-08 03:24:35+00:00,160,False,164,,
992,2022-03-25 23:39:24+00:00,Mascarillas y petróleo https://t.co/uaEckRsFrn vía @TheObjective_es,mascarillas y petr leo   v a   es,es,0,0,2011-05-18 23:23:53+00:00,998,False,49293,Donde Me Lleva La 🧠💪☝️👍🆓♟️,
993,2022-03-25 23:39:22+00:00,"RT @laishawilkins: ¡Ya vimos como si el gremio artístico se une y alza la voz se le escucha!

Les dejo temas a continuación…

-Niños y niña…",  ya vimos como si el gremio art stico se une y alza la voz se le escucha   les dejo temas a continuaci n    ni os y ni a ,es,0,52,2010-03-31 19:44:16+00:00,259,False,10035,mexico city,
994,2022-03-25 23:39:21+00:00,Gloria Serra diciendo en la sexta equipo de investigación q la gasolina sube por la guerra de Ucrania. Mintiendo como si estuviera en posesión de la verdad. La gasolina lleva subiendo meses atrás. Lavado de cerebro a periodistas.,gloria serra diciendo en la sexta equipo de investigaci n q la gasolina sube por la guerra de ucrania  mintiendo como si estuviera en posesi n de la verdad  la gasolina lleva subiendo meses atr s  lavado de cerebro a periodistas ,es,1,0,2016-01-10 13:43:36+00:00,10047,False,12977,"Regne de Valencia, España",
998,2022-03-25 23:39:16+00:00,"RT @AntoninoHerrer6: @sanchezcastejon gran acuerdo
España y Portugal podremos
poner en marcha 
medidas temporales
y excepcionales
para redu…",   gran acuerdo espa a y portugal podremos poner en marcha  medidas temporales y excepcionales para redu ,es,0,6,2020-11-07 22:40:08+00:00,2674,False,84869,CALLE DIGNIDAD PARA ESPAÑA YA!,
1001,2022-03-25 23:39:07+00:00,La curva del precio del crudo se revirtió rápidamente cuando los rebeldes hutíes yemeníes se atribuyeron la responsabilidad de los ataques. https://t.co/xp5VuFloZK,la curva del precio del crudo se revirti  r pidamente cuando los rebeldes hut es yemen es se atribuyeron la responsabilidad de los ataques   ,es,0,1,2009-04-15 17:18:57+00:00,780938,True,1885,"Montevideo, Uruguay",
1004,2022-03-25 23:39:04+00:00,"RT @GaloLaraY: Les Robaron a quienes los eligieron, en carreteras, en petróleo, en hidroeléctricas, en terremotos, en seguros  y publicidad…", les robaron a quienes los eligieron  en carreteras  en petr leo  en hidroel ctricas  en terremotos  en seguros  y publicidad ,es,0,137,2022-01-03 19:27:13+00:00,44,False,163,,
1006,2022-03-25 23:39:01+00:00,"RT @PregoneroL: @GerardoMorales YPF tenía 51.000 ""trabajadores"" antes de su privatización, quedaron 5.690 en 1995.  Era la única petrolera…",   ypf ten a 51 000  trabajadores  antes de su privatizaci n  quedaron 5 690 en 1995   era la  nica petrolera ,es,0,59,2012-04-17 17:11:46+00:00,28,False,5221,Buenos Aires,
1008,2022-03-25 23:38:58+00:00,Aumento del combustible impacta en la distribución de mercancía en Merca Panamá. #NoticiasTVN https://t.co/mfLB9hHKLG,aumento del combustible impacta en la distribuci n de mercanc a en merca panam    noticiastvn  ,es,1,0,2011-05-16 14:51:19+00:00,974839,True,20399,Panamá,
1009,2022-03-25 23:38:51+00:00,"@Rjmd94 @samboquin Jajajaaja ok, la verdad también quede analizando de que manera echa combustible para llenarlo con eso 😅",    jajajaaja ok  la verdad tambi n quede analizando de que manera echa combustible para llenarlo con eso  ,es,0,0,2011-11-22 04:50:18+00:00,2075,False,41644,,
1010,2022-03-25 23:38:49+00:00,"RT @jmpuentec: Producción de Petroleo por países. 1965-2021.    

https://t.co/BNzitGiuDI", producci n de petroleo por pa ses  1965 2021        ,es,0,44,2009-08-11 03:54:49+00:00,889,False,3876,Maracaibo,
1011,2022-03-25 23:38:49+00:00,"Colombia 1998:
- Salario Mínimo $203.825
- Sueldo del presidente A. Pastrana $10.400.000
- Sueldo del presidente de Telecom $4.400.000
- Precio del dólar $1.426
- Precio del galón de gasolina $1.608

$1000 de 1998 equivalen a $3.300 de 2022. . Imagen de una orejera, cultura Sinú. https://t.co/EMT7BsPfsN",colombia 1998    salario m nimo  203 825   sueldo del presidente a  pastrana  10 400 000   sueldo del presidente de telecom  4 400 000   precio del d lar  1 426   precio del gal n de gasolina  1 608   1000 de 1998 equivalen a  3 300 de 2022    imagen de una orejera  cultura sin    ,es,335,95,2011-03-27 02:02:51+00:00,95123,False,16506,"Bogotá, D.C., Colombia",
1012,2022-03-25 23:38:49+00:00,RT @pedrohoyosss: me encanta gastar gasolina a lo pendejo, me encanta gastar gasolina a lo pendejo,es,0,1,2020-03-04 05:45:25+00:00,67,False,2663,Puebla,
1014,2022-03-25 23:38:43+00:00,"@oscarvago171276 @EdySmol Mi empresa de transporte fue violentada me la robaron, la delincuencia organizada y me quedé sin nada, la última vez que compre diésel lo compre a $21  y además con deuda me esta costando un huevo levantarme y no estoy de llorón, todo esto fue en el sexenio de mi lord EPN.",    mi empresa de transporte fue violentada me la robaron  la delincuencia organizada y me qued  sin nada  la  ltima vez que compre di sel lo compre a  21  y adem s con deuda me esta costando un huevo levantarme y no estoy de llor n  todo esto fue en el sexenio de mi lord epn ,es,0,0,2012-06-23 00:42:51+00:00,5,False,139,,
1016,2022-03-25 23:38:41+00:00,"@sano_es La cabeza tractora de un camión funcionando a marcha lenta apenas consume combustible. Otra cosa es que tenga que arrastrar un remolque de 40 toneladas. No sé si te has dado cuenta que en las manifestaciones solo llevan las cabezas, no los remolques.",  es la cabeza tractora de un cami n funcionando a marcha lenta apenas consume combustible  otra cosa es que tenga que arrastrar un remolque de 40 toneladas  no s  si te has dado cuenta que en las manifestaciones solo llevan las cabezas  no los remolques ,es,0,0,2020-04-03 10:54:39+00:00,255,False,16390,,
1018,2022-03-25 23:38:37+00:00,"RT @LopezCesar2504: BUENA NOTICIA
Gobierno de Nicaragua absorberá el 70% dl incremento de gasolinas y diesel
#UnidosEnVictorias
@db_nicarag…", buena noticia gobierno de nicaragua absorber  el 70  dl incremento de gasolinas y diesel  unidosenvictorias   nicarag ,es,0,4,2012-04-23 05:36:27+00:00,15738,False,104885,Nicaragua,
1021,2022-03-25 23:38:33+00:00,"si las sanciones se liberan, Chevron estaría mejor posicionada como intermediario para tomar petróleo de los campos petroleros en Venezuela y trasladarlo a las refinerías de EEUU muy probablemente controladas por Chevron o de Citgo, la subsidiaria de refinación de Pdvsa en EEUU",si las sanciones se liberan  chevron estar a mejor posicionada como intermediario para tomar petr leo de los campos petroleros en venezuela y trasladarlo a las refiner as de eeuu muy probablemente controladas por chevron o de citgo  la subsidiaria de refinaci n de pdvsa en eeuu,es,0,2,2022-02-10 21:27:50+00:00,91,False,316,"Distrito Capital, Venezuela",
1022,2022-03-25 23:38:32+00:00,"RT @crovanos: Y ahora que los gringos otra vez comenzarán a hacer negocios con Venezuela (compra de petróleo), al facherío chileno se le ac…", y ahora que los gringos otra vez comenzar n a hacer negocios con venezuela  compra de petr leo   al facher o chileno se le ac ,es,0,50,2016-04-30 16:01:48+00:00,758,False,46304,"Calama, Chile",
1024,2022-03-25 23:38:29+00:00,"@fer_cassius @Claudiashein Él nunca dijo que bajaría la gasolina, se hizo una consulta para enjuiciar a los presidentes y el pueblo votó por que no se enjuiciaran, no se puede crecer con una pandemia que afecta a nivel global, el avión presidencial no se ha podido vender por que no hay compradores",  cassius    l nunca dijo que bajar a la gasolina  se hizo una consulta para enjuiciar a los presidentes y el pueblo vot  por que no se enjuiciaran  no se puede crecer con una pandemia que afecta a nivel global  el avi n presidencial no se ha podido vender por que no hay compradores,es,2,0,2022-03-05 09:05:02+00:00,4,False,717,,
1026,2022-03-25 23:38:28+00:00,"El gas, la gasolina y la luz suben cada día que pasa pero Sánchez no tiene prisa por bajar los impuestos a la energía. La situación es crítica, no podemos esperar ni un segundo más, firma y exige que los baje YA https://t.co/taVXmEAWet);",el gas  la gasolina y la luz suben cada d a que pasa pero s nchez no tiene prisa por bajar los impuestos a la energ a  la situaci n es cr tica  no podemos esperar ni un segundo m s  firma y exige que los baje ya  ,es,0,0,2011-10-31 13:08:39+00:00,477,False,151840,,
1030,2022-03-25 23:38:20+00:00,"RT @lcsuzzarini: Hoy cuando estamos sin agua, electricidad, gas, gasolina, gasoil, hospitales, etc. Recuerdo a los millones de Venezolanos…", hoy cuando estamos sin agua  electricidad  gas  gasolina  gasoil  hospitales  etc  recuerdo a los millones de venezolanos ,es,0,1024,2010-02-17 21:07:09+00:00,3500,False,22259,A la Izquierda del Mundo!! ,
1032,2022-03-25 23:38:18+00:00,"RT @uksergio: @sanchezcastejon Pero Antonio, que los transportistas siguen la huelga, algo no cuadra. Además, ¿qué pasa con el resto de mor…",   pero antonio  que los transportistas siguen la huelga  algo no cuadra  adem s   qu  pasa con el resto de mor ,es,0,10,2021-05-22 14:59:03+00:00,87,False,2741,,
1034,2022-03-25 23:38:17+00:00,"Entonces va a regalar el gas y el petróleo a Europa, no? https://t.co/vJ4qBWdBYc",entonces va a regalar el gas y el petr leo a europa  no   ,es,0,0,2019-11-24 17:46:22+00:00,1293,False,75990,"São Paulo, Brésil",
1035,2022-03-25 23:38:13+00:00,@Phameland Hasta cuando queman la gasolina huele rico 👏,  hasta cuando queman la gasolina huele rico  ,es,1,0,2009-06-30 04:54:51+00:00,724,False,39167,221b Baker Street,
1036,2022-03-25 23:38:13+00:00,"RT @jluna32_: @MaxKaiser75 Va, si ustedes usan solamente gasolina para sus carros de la refinería bicentenario que ""construyó"" el comandant…",   va  si ustedes usan solamente gasolina para sus carros de la refiner a bicentenario que  construy   el comandant ,es,0,83,2014-06-03 13:34:59+00:00,84,False,6755,México,
1038,2022-03-25 23:38:10+00:00,amigad trague nafta y ahora erupto con olor a gasolina ESTIY LLORQNDO,amigad trague nafta y ahora erupto con olor a gasolina estiy llorqndo,es,0,0,2021-07-05 09:16:11+00:00,290,False,7766,jungkook taehyung i jennie,
1039,2022-03-25 23:38:09+00:00,"RT @clarcklaurens1: Chevron nos roba el petróleo en el Esequibo y apoya a Guayana en el despojo, y ahora nos robará aquí con licencia Madur…", chevron nos roba el petr leo en el esequibo y apoya a guayana en el despojo  y ahora nos robar  aqu  con licencia madur ,es,0,95,2018-01-29 09:42:16+00:00,246,False,5411,,
1040,2022-03-25 23:38:04+00:00,"Si se correrá y se va a confirmar lo q ya se sabía, el alto a la guerra y la no discriminación que pregonan se acaba con los intereses de occidente y del petróleo… Se correrá seguramente con pilotos q no estaba de acuerdo",si se correr  y se va a confirmar lo q ya se sab a  el alto a la guerra y la no discriminaci n que pregonan se acaba con los intereses de occidente y del petr leo  se correr  seguramente con pilotos q no estaba de acuerdo,es,0,0,2011-07-31 16:33:59+00:00,134,False,536,,
1043,2022-03-25 23:37:56+00:00,Toy en un coche con olor a diesel fumbdi,toy en un coche con olor a diesel fumbdi,es,1,0,2018-09-14 08:39:10+00:00,129,False,9745,"Madrid, España",
1046,2022-03-25 23:37:52+00:00,"RT @ANDVOX1: La Unión Europea acordó con Estado Unidos de aumentar envío de gas licuado para no depender del gas ruso, pero Europa necesita…", la uni n europea acord  con estado unidos de aumentar env o de gas licuado para no depender del gas ruso  pero europa necesita ,es,0,21,2021-09-10 08:28:22+00:00,285,False,3153,España,
1047,2022-03-25 23:37:51+00:00,"RT @mariaeloinac: @ejdecena Para él, todo es fácil y se soluciona con dar órdenes sin supervisar y menos garantizar que las instituciones e…",   para  l  todo es f cil y se soluciona con dar  rdenes sin supervisar y menos garantizar que las instituciones e ,es,0,2,2019-04-19 12:04:31+00:00,434,False,55122,Venezuela,
1049,2022-03-25 23:37:49+00:00,"@judicialesnet Que ocurrencia más trivial,esa Sala Constitucional  donde la injusticia y la mora judicial gobierna e impera donde el dr Diésel acumula por años esperando q plantean una INCONSTITUCIONALIDAD.que gana compañero de perder tiempo.Tienen 7.000 exp a resolver  con una sola secretaria",  que ocurrencia m s trivial esa sala constitucional  donde la injusticia y la mora judicial gobierna e impera donde el dr di sel acumula por a os esperando q plantean una inconstitucionalidad que gana compa ero de perder tiempo tienen 7 000 exp a resolver  con una sola secretaria,es,0,0,2021-10-22 21:53:29+00:00,36,False,978,"Asuncion, Paraguay",
1051,2022-03-25 23:37:48+00:00,"@LenouveauBobced @INDIURBANEJA @nelsonbocaranda si las sanciones se liberan, Chevron estaría mejor posicionada como intermediario para tomar petróleo de los campos petroleros en Venezuela y trasladarlo a las refinerías de EEUU muy probablemente controladas por Chevron o de Citgo, la subsidiaria de refinación de Pdvsa en EEUU",      si las sanciones se liberan  chevron estar a mejor posicionada como intermediario para tomar petr leo de los campos petroleros en venezuela y trasladarlo a las refiner as de eeuu muy probablemente controladas por chevron o de citgo  la subsidiaria de refinaci n de pdvsa en eeuu,es,0,0,2022-02-10 21:27:50+00:00,91,False,316,"Distrito Capital, Venezuela",
1053,2022-03-25 23:37:48+00:00,RT @britishtradermx: Ya salió su jalada de noticia. Ataque de deposito de petróleo en Arabia Saudita. 😂😭😂 Ya qué inventen otra 😂🤣😂., ya sali  su jalada de noticia  ataque de deposito de petr leo en arabia saudita      ya qu  inventen otra     ,es,0,3,2012-06-27 00:39:57+00:00,259,False,32289,,
1055,2022-03-25 23:37:47+00:00,"Estallan disturbios masivos en Paraguay por el aumento de los precios del combustible

  Los paraguayos descontentos aplastan y rompen todo lo que les llama la atención.  Además, los residentes locales prendieron fuego al edificio de la policía. https://t.co/OKNTU4680x",estallan disturbios masivos en paraguay por el aumento de los precios del combustible    los paraguayos descontentos aplastan y rompen todo lo que les llama la atenci n   adem s  los residentes locales prendieron fuego al edificio de la polic a   ,es,0,0,2016-08-03 22:21:36+00:00,1787,False,208708,"Lomas del Mirador, Argentina",
1058,2022-03-25 23:37:45+00:00,"RT @economiaoil: ¡LOS COMBUSTIBLES HAN SUBIDO!
Incremento primera semana de enero a 13 de Marzo en centavos de pesos:

Gasolina Regular 50…",  los combustibles han subido  incremento primera semana de enero a 13 de marzo en centavos de pesos   gasolina regular 50 ,es,0,4,2011-03-28 22:41:21+00:00,34,False,0,,
1061,2022-03-25 23:37:40+00:00,@PazPinter Era amo de la bella genio. Para que quieres petroleo,  era amo de la bella genio  para que quieres petroleo,es,1,0,2012-03-17 15:25:12+00:00,91,False,10523,,
1062,2022-03-25 23:37:39+00:00,"#Sucesos | Gevonny Rodríguez, de 72 años, murió presuntamente de un infarto la madrugada del jueves mientras hacía la cola en una estación de gasolina en San Francisco, #Zulia. #25Mar - Vía Jhorman Cruz https://t.co/ZhpIWfECR6", sucesos   gevonny rodr guez  de 72 a os  muri  presuntamente de un infarto la madrugada del jueves mientras hac a la cola en una estaci n de gasolina en san francisco   zulia   25mar   v a jhorman cruz  ,es,4,9,2014-03-12 13:33:59+00:00,26043,False,4008,"Portuguesa, Venezuela",
1063,2022-03-25 23:37:38+00:00,"RT @economiaoil: El diésel 4.71 pesos más caro comparado con Mexico. Inflación incrementara en EUA, debido a que ellos consumen más de 3 Mi…", el di sel 4 71 pesos m s caro comparado con mexico  inflaci n incrementara en eua  debido a que ellos consumen m s de 3 mi ,es,0,4,2011-03-28 22:41:21+00:00,34,False,0,,
1067,2022-03-25 23:37:33+00:00,"En nuestra última consulta, la gasolinera más barata es BONAREA en #Odena. Nuestro usuario va a ahorrarse 6.05€ en este repostaje (un 6.7%). La gasolinera está en: https://t.co/gOT79maeKB",en nuestra  ltima consulta  la gasolinera m s barata es bonarea en  odena  nuestro usuario va a ahorrarse 6 05  en este repostaje  un 6 7    la gasolinera est  en   ,es,0,0,2020-11-22 21:37:23+00:00,115,False,13,Spain (EU),
1069,2022-03-25 23:37:32+00:00,"RT @funesbeto: El Estado gastó el año pasado para llevar y traer a Cristina Kirchner al Calafate y Río Gallegos, $16.590.000 solo en combus…", el estado gast  el a o pasado para llevar y traer a cristina kirchner al calafate y r o gallegos   16 590 000 solo en combus ,es,0,75,2016-08-19 03:01:50+00:00,1241,False,160563,,
1070,2022-03-25 23:37:31+00:00,RT @OaxacaVialsi: Ciudadano denuncia a través de redes sociales que en la gasolinera camino a #Guelatao #Oaxaca no dan litros exactos de #g…, ciudadano denuncia a trav s de redes sociales que en la gasolinera camino a  guelatao  oaxaca no dan litros exactos de  g ,es,0,15,2010-07-09 17:45:15+00:00,4116,False,960,"Oaxaca, México. ",
1072,2022-03-25 23:37:30+00:00,"RT @Calandracas5: @tomascasascm Ahora si que no,sería darles gasolina. En esta semana mueren por inanición.  Soy asalariado y estoy en la c…",   ahora si que no ser a darles gasolina  en esta semana mueren por inanici n   soy asalariado y estoy en la c ,es,0,8,2015-02-11 18:55:11+00:00,1514,False,113663,,
1074,2022-03-25 23:37:27+00:00,"La orden que aplica a gasolina, diésel y gas licuado fue extendida nuevamente debido a la situación por el conflicto bélico entre Rusia y Ucrania.
https://t.co/tyfQCQgTBX",la orden que aplica a gasolina  di sel y gas licuado fue extendida nuevamente debido a la situaci n por el conflicto b lico entre rusia y ucrania   ,es,3,1,2010-01-28 13:56:24+00:00,299968,True,145,,
1075,2022-03-25 23:37:27+00:00,@TraficoCPanama Haya fue toda la gasolina en ese tranque 😱,  haya fue toda la gasolina en ese tranque  ,es,0,0,2009-12-18 01:41:21+00:00,309,False,2266,Panama,
1076,2022-03-25 23:37:26+00:00,"RT @YuriiKazakov: Las críticas hacia Hungría han venido también de otros países, p.ej. de Chequia. La ministra de defensa checa, Jana Černo…", las cr ticas hacia hungr a han venido tambi n de otros pa ses  p ej  de chequia  la ministra de defensa checa  jana  erno ,es,0,12,2013-09-06 13:16:14+00:00,4078,False,134007,aranjuez,
1077,2022-03-25 23:37:24+00:00,"RT @CabreraDeMar: ¿Estáis diciendo que cuando estuvisteis en el Gobierno los impuestos de la gasolina se los llevaba Rajoy?
¿En serio, PP?🤯",  est is diciendo que cuando estuvisteis en el gobierno los impuestos de la gasolina se los llevaba rajoy   en serio  pp  ,es,0,24,2011-09-20 02:16:41+00:00,719,False,105065,España,
1078,2022-03-25 23:37:24+00:00,"@MiedoalosMedios @MikolaLlora @juvenal_tw @SantiagoLagoP @populares Los impuestos son porcentuales no absolutos. Los de la gasolina no son una excepción. 

Los impuestos pagan ese médico que cuando estamos malos nos cura. Ese profesor que nos enseñó a sumar. 

Podemos discutir si son excesivos o pocos, pero no si son necesarios",      tw     los impuestos son porcentuales no absolutos  los de la gasolina no son una excepci n    los impuestos pagan ese m dico que cuando estamos malos nos cura  ese profesor que nos ense   a sumar    podemos discutir si son excesivos o pocos  pero no si son necesarios,es,2,0,2010-08-13 17:16:34+00:00,216,False,190,Madrid,
1082,2022-03-25 23:37:22+00:00,"RT @jadesdelgado: Se viene Semana Santa pero ya en Mérida desde hace años se vive el viacrucis. 

Fila para abastecer combustible en la Av…", se viene semana santa pero ya en m rida desde hace a os se vive el viacrucis    fila para abastecer combustible en la av ,es,0,44,2013-03-20 22:37:27+00:00,265,False,27798,,
1083,2022-03-25 23:37:18+00:00,"RT @UKR_token: El primer ministro esloveno, Janez Jansa, afirmó el jueves que #Europa no pagará a #Rusia en rublos, después que Moscú exigi…", el primer ministro esloveno  janez jansa  afirm  el jueves que  europa no pagar  a  rusia en rublos  despu s que mosc  exigi ,es,0,130,2012-04-12 21:16:44+00:00,450,False,50,,
1086,2022-03-25 23:37:15+00:00,@fmonaldi Venezuela gustale o no siempre va a tener compradores de su petróleo en el mercado mundial les duele que exista la posibilidad de que se vuelva a expandir eres un palangrista más pagado por el G4 y todos sus sinvergüenzas,  venezuela gustale o no siempre va a tener compradores de su petr leo en el mercado mundial les duele que exista la posibilidad de que se vuelva a expandir eres un palangrista m s pagado por el g4 y todos sus sinverg enzas,es,0,0,2010-10-20 21:44:25+00:00,60,False,172,,
1087,2022-03-25 23:37:15+00:00,"@jb_pozo Eso es lo que quieren:huelgas disturbios, enfrentamientos .. eso provocará desabastecimiento escasez de agua y alimentos, de gasolina etc excusa para  aplicar estado de alarma y con ello seguir implantando su dictadura, encerrarnos otra vez,cartillas de racionamiento etc",  pozo eso es lo que quieren huelgas disturbios  enfrentamientos    eso provocar  desabastecimiento escasez de agua y alimentos  de gasolina etc excusa para  aplicar estado de alarma y con ello seguir implantando su dictadura  encerrarnos otra vez cartillas de racionamiento etc,es,0,0,2021-09-24 20:00:11+00:00,112,False,14748,,
1088,2022-03-25 23:37:12+00:00,"RT @fenadismer: La necesidad de que #pymes y #autonomos cobren en los plazos legales, es vital para su supervivencia. Con la #inflacion cre…", la necesidad de que  pymes y  autonomos cobren en los plazos legales  es vital para su supervivencia  con la  inflacion cre ,es,0,1,2013-04-20 15:41:49+00:00,5509,False,5548,España,
1091,2022-03-25 23:37:10+00:00,"RT @PolucionBogota: 🆘🆘🆘 @Ambientebogota Alerta roja por envenenamiento intencional del aire por #CriminalesdeCarvajal, con complicidad de l…",       alerta roja por envenenamiento intencional del aire por  criminalesdecarvajal  con complicidad de l ,es,0,7,2013-06-11 00:56:02+00:00,122,False,3268,,
1095,2022-03-25 23:37:09+00:00,Gasolina cara no mundo todo https://t.co/DtubJcVeWA,gasolina cara no mundo todo  ,es,1,0,2009-11-07 16:20:01+00:00,358,False,6455,"Belo Horizonte, Brasil",
1101,2022-03-25 23:37:05+00:00,"@NuestroDiario Jajaja, para el 1o. de abril cuando entre en vigencia el subsidio a la gasolina Regular y al Diesel, ya habrá rebasado la cantidad que van a subsidiar y los únicos que van a ganar como siempre, serán los expendedores y los gasolineros. Se tenía que decir y se dijo !!!",  jajaja  para el 1o  de abril cuando entre en vigencia el subsidio a la gasolina regular y al diesel  ya habr  rebasado la cantidad que van a subsidiar y los  nicos que van a ganar como siempre  ser n los expendedores y los gasolineros  se ten a que decir y se dijo    ,es,0,0,2012-05-27 14:58:00+00:00,51,False,355,Guatemala City,
