,Created_at,Text,Clean Text,Lang,Favourite_count,Retweet_count,Fecha creacion,Followers,Verificado,Cantidad Fav,País,Coordenadas
3468,2022-03-25 22:54:58+00:00,"#MVDNoticias 

Los estacioneros están preocupados por el aumento permanente del precio del combustible, reclaman una revisión de las ganancias y costo de venta con tarjetas. https://t.co/fGLOvU8bFB", mvdnoticias   los estacioneros est n preocupados por el aumento permanente del precio del combustible  reclaman una revisi n de las ganancias y costo de venta con tarjetas   ,es,0,0,2016-02-10 02:45:39+00:00,15579,False,2369,,
3469,2022-03-25 22:54:54+00:00,@juditvalderrama @CorpoelecTachi Vivir en el Táchira es una odisea por la gasolina por todo,    vivir en el t chira es una odisea por la gasolina por todo,es,1,0,2014-03-03 15:18:59+00:00,22,False,304,,
3472,2022-03-25 22:54:49+00:00,"RT @greenpeace_esp: 🔴ESTO TIENE QUE PARAR🔴
🔥Nuestra adicción a energías sucias como carbón, petróleo, gas o uranio es tan grave que seguimo…",  esto tiene que parar   nuestra adicci n a energ as sucias como carb n  petr leo  gas o uranio es tan grave que seguimo ,es,0,15,2015-01-29 04:07:07+00:00,842,False,107395,Valencia,
3475,2022-03-25 22:54:48+00:00,@cavalheiro_imp @Tosga Tipo gasolina? 😅,  imp   tipo gasolina   ,es,1,0,2021-01-24 18:00:15+00:00,633,False,59177,"Planeta Terra, por enquanto! ",
3476,2022-03-25 22:54:46+00:00,El hecho de que la gasolina suba hace que mi estudio sobre carros eléctricos tenga números más bonitos :3,el hecho de que la gasolina suba hace que mi estudio sobre carros el ctricos tenga n meros m s bonitos  3,es,8,0,2013-12-24 15:47:10+00:00,194,False,5973,"Los Santos, Tarrazú",
3479,2022-03-25 22:54:39+00:00,"RT @PatriotaDeM: @chabelitacongre Jajaja esa Chabebruto es un éxito, usando ese uniforme fijo que mañana baja el combustible 🤣 https://t.co…",   jajaja esa chabebruto es un  xito  usando ese uniforme fijo que ma ana baja el combustible    ,es,0,2,2022-02-15 00:15:35+00:00,57,False,6040,,
3483,2022-03-25 22:54:37+00:00,"@marielycruz_ te em ta asutando ya vi, yo soy vin diesel, ma rápido que furioso",   te em ta asutando ya vi  yo soy vin diesel  ma r pido que furioso,es,0,0,2021-10-13 18:54:05+00:00,560,False,9028,,
3484,2022-03-25 22:54:37+00:00,"@DbpW0070 @CharadaBea @osvoyadecir @uiketekaes Que argumento mas imbecil. Cuando hace meses la gasolina valia la mitad, el gobierno recaudaba lo mismo que ahora, y fijate tu, habia sanidad. Qué cosas eh?",        que argumento mas imbecil  cuando hace meses la gasolina valia la mitad  el gobierno recaudaba lo mismo que ahora  y fijate tu  habia sanidad  qu  cosas eh ,es,0,0,2019-12-22 00:31:34+00:00,158,False,494,,
3485,2022-03-25 22:54:36+00:00,"@ionebelarra @sanchezcastejon Dejaros de berborrea y bajar impuestos asi de facil,el barril en 2012 a 130 dolares costaba 1.26e litro.Actualmente el barril esta a 100 dolares y la gasolina a 1,95,gracias a vuestros impuestos.Dejad de decir que malas la s petroleras cuando los ladrones sois vosotros.",    dejaros de berborrea y bajar impuestos asi de facil el barril en 2012 a 130 dolares costaba 1 26e litro actualmente el barril esta a 100 dolares y la gasolina a 1 95 gracias a vuestros impuestos dejad de decir que malas la s petroleras cuando los ladrones sois vosotros ,es,1,1,2015-04-30 22:50:27+00:00,272,False,40300,"Alicante, España",
3487,2022-03-25 22:54:34+00:00,"Desde el lunes hay aumento del precio del combustible!
1.500 por litro en todos los tipos de Diésel. 
1.000 por lote en todos los tipos de nafta. 
Buen fin de semana!",desde el lunes hay aumento del precio del combustible  1 500 por litro en todos los tipos de di sel   1 000 por lote en todos los tipos de nafta   buen fin de semana ,es,240,136,2010-07-01 21:11:58+00:00,60942,False,165655,Asuncion - Paraguay,
3489,2022-03-25 22:54:33+00:00,"@juanisolano Pasa por aquí y nos vamos de paseo 🎶 en un coche nuevo 🎶, que París está a la vuelta de la esquina si doblamos el mapa. Con las ofertas de gasolina es posible que lleguemos sin gastar todos los ahorros.",  pasa por aqu  y nos vamos de paseo   en un coche nuevo    que par s est  a la vuelta de la esquina si doblamos el mapa  con las ofertas de gasolina es posible que lleguemos sin gastar todos los ahorros ,es,1,0,2015-09-27 11:06:11+00:00,158,False,39195,"Gijón, Principado de Asturias",
3491,2022-03-25 22:54:31+00:00,"RT @greenpeace_esp: Gas ruso en el puerto de Bilbao. 

Los combustibles fósiles de los que dependemos financian conflictos, y no podemos se…", gas ruso en el puerto de bilbao    los combustibles f siles de los que dependemos financian conflictos  y no podemos se ,es,0,1161,2014-07-16 22:28:31+00:00,252,False,29602,Fuengirola,
3494,2022-03-25 22:54:29+00:00,"Nuestro Gobierno asume el 100% del incremento del precio del Gas Licuado y el 70% de las Gasolinas y Diésel.
https://t.co/ohsAtT8NZy",nuestro gobierno asume el 100  del incremento del precio del gas licuado y el 70  de las gasolinas y di sel   ,es,4,2,2021-11-03 00:06:56+00:00,170,False,94,Nicaragua,
3495,2022-03-25 22:54:29+00:00,@abecapriles Y cual es el precio del galón de combustible hoy?,  y cual es el precio del gal n de combustible hoy ,es,0,0,2013-12-27 16:47:19+00:00,231,False,2746,"Caracas, Distrito Capital",
3496,2022-03-25 22:54:28+00:00,"@moralesdechile @vladomirosevic Es externo, el petrol en Australia esta variando entre los $2.00 por litro hasta $2.10, antes de la guerra estaba entre $1.67 a $1.79 y nosotros nos quejamos por el impuesto al combustible pero el gov. No lo ha bajado. 2 litros de leche esta $2.79",    es externo  el petrol en australia esta variando entre los  2 00 por litro hasta  2 10  antes de la guerra estaba entre  1 67 a  1 79 y nosotros nos quejamos por el impuesto al combustible pero el gov  no lo ha bajado  2 litros de leche esta  2 79,es,1,0,2015-08-25 22:39:38+00:00,153,False,29227,,
3503,2022-03-25 22:54:19+00:00,"@Joanlop21 Logros de Sánchezstein:
- Récord mundial de muertes Covid en la primera ola.
- Líderes mundiales en caída del PIB durante la pandemia.
- Tres Estafas de Alarma inconstitucionales.
- Récord en precios de luz, gasolina, gas...

Sigue aplaudiendo como una foca, borrego https://t.co/DVcmuAHekk",  logros de s nchezstein    r cord mundial de muertes covid en la primera ola    l deres mundiales en ca da del pib durante la pandemia    tres estafas de alarma inconstitucionales    r cord en precios de luz  gasolina  gas     sigue aplaudiendo como una foca  borrego  ,es,0,0,2020-03-06 10:14:53+00:00,262,False,5298,,
3505,2022-03-25 22:54:15+00:00,"RT @claugatic: @gabrielboric @GiorgioJackson @izkia Bajen el impuesto a combustible No subsidio, bajen tasas del BC empujan inflacion al su…",       bajen el impuesto a combustible no subsidio  bajen tasas del bc empujan inflacion al su ,es,0,2,2019-10-19 19:06:26+00:00,3305,False,226339,"Maipú, Chile",
3513,2022-03-25 22:54:05+00:00,"Y NO TE DA BRONCA Q TU PEDO CASTILLO CON TUS IMPUESTOS TRAGUE COMO PUERCO,SE VISTA COMO TÚ NUNCA LO HARAS,TENGA LO Q TÚ NUNCA TENDRAS! TE ROBE EN TU CARA Y PA ESO TE SUBA EL PRECIO DEL COMBUSTIBLE Y TODOS LOS PRODUCTOS DE 1RA NECESIDAD? ROYCHUPAELANO #VacanciaPedroCastilloYa https://t.co/5VUhty7icc https://t.co/RuPaF4lNNl",y no te da bronca q tu pedo castillo con tus impuestos trague como puerco se vista como t  nunca lo haras tenga lo q t  nunca tendras  te robe en tu cara y pa eso te suba el precio del combustible y todos los productos de 1ra necesidad  roychupaelano  vacanciapedrocastilloya    ,es,0,0,2022-01-13 08:53:18+00:00,10,False,1094,,
3521,2022-03-25 22:53:57+00:00,"RT @asoc_vpla: Estos rollitos de periódico los usamos mucho para nuestros peludos rescatados 🗞🐾 Puedes comprar uno en Kioscos, Tiendas/Masc…", estos rollitos de peri dico los usamos mucho para nuestros peludos rescatados    puedes comprar uno en kioscos  tiendas masc ,es,0,6,2020-01-31 17:42:00+00:00,198,False,34951,"Distrito Capital, Venezuela",
3522,2022-03-25 22:53:56+00:00,@alonso_gaviria @AlvaroUribeVel Vikingo vaya a Venezuela y pregunte a cuanto equivale la renta basica y le contestaran que a 2 dolares y eso que  venezuela tenia petroleo que lo que  produce ahora es para pagar a china por las armas  para someterlo a ud si protesta pendejo,  gaviria   vikingo vaya a venezuela y pregunte a cuanto equivale la renta basica y le contestaran que a 2 dolares y eso que  venezuela tenia petroleo que lo que  produce ahora es para pagar a china por las armas  para someterlo a ud si protesta pendejo,es,0,0,2015-04-05 22:27:28+00:00,60,False,16182,,
3524,2022-03-25 22:53:54+00:00,"RT @TuSombraesgris: @vitoquiles Los millones de españoles seguiremos pagando la gasolina a precio del oro, además pagaremos la subvención y…",   los millones de espa oles seguiremos pagando la gasolina a precio del oro  adem s pagaremos la subvenci n y ,es,0,2,2013-10-27 11:44:31+00:00,171,False,71522,,
3525,2022-03-25 22:53:53+00:00,RT @dlacalle: Entre 2008 y 2022 Estados Unidos ha pasado a ser independiente en producción de gas y producir más petróleo que Rusia o Arabi…, entre 2008 y 2022 estados unidos ha pasado a ser independiente en producci n de gas y producir m s petr leo que rusia o arabi ,es,0,89,2019-02-19 22:01:33+00:00,487,False,38192,,
3527,2022-03-25 22:53:51+00:00,"RT @el_pais: Las fuerzas ucranias llevan días no solo impidiendo el avance de los rusos a las afueras de Kiev, sino que su intención es rod…", las fuerzas ucranias llevan d as no solo impidiendo el avance de los rusos a las afueras de kiev  sino que su intenci n es rod ,es,0,43,2016-02-19 03:06:12+00:00,32,False,8633,"La Libertad, El Salvador",
3529,2022-03-25 22:53:51+00:00,"RT @CoralDeMar3: ¡Todo comenzó en Cabo Verde!  ya la persecución contra Saab era declarada por enviar gasolina, alimentos e insumos medicos…",  todo comenz  en cabo verde   ya la persecuci n contra saab era declarada por enviar gasolina  alimentos e insumos medicos ,es,0,20,2019-03-15 20:42:47+00:00,214,False,1192,,
3535,2022-03-25 22:53:46+00:00,@oscar_puente_ @josecyne ¿Recoletas también se deducía el IVA de la gasolina del V8?,  puente     recoletas tambi n se deduc a el iva de la gasolina del v8 ,es,0,0,2017-01-12 16:07:58+00:00,0,False,7,,
3543,2022-03-25 22:53:38+00:00,@juanjoseop56 @PepeRinconi @CarlosLoret @arroba_Lu @latinus_us Y se me chispó por falta de espacio el litro de gasolina a $10.00 y el crecimiento económico desde el primer año del 6% 🤣.,        lu   us y se me chisp  por falta de espacio el litro de gasolina a  10 00 y el crecimiento econ mico desde el primer a o del 6    ,es,0,0,2012-10-02 18:17:14+00:00,110,False,63180,"EUM, defendiendo al INE. ",
3545,2022-03-25 22:53:37+00:00,"RT @FidelioMer: @GaleasLibros Fin de la globalización? que raro, hay que definir globalización porque el mundo está cada vez más conectado.…",   fin de la globalizaci n  que raro  hay que definir globalizaci n porque el mundo est  cada vez m s conectado  ,es,0,1,2019-02-23 20:09:35+00:00,5077,False,91131,🌎,
3551,2022-03-25 22:53:32+00:00,@simoninfesta @annabosch @rtve Que toda europa quiera dejar el gas y el petróleo ruso debe de hacerles poca gracia.Igual se quitan a Putin de enmedio,      que toda europa quiera dejar el gas y el petr leo ruso debe de hacerles poca gracia igual se quitan a putin de enmedio,es,1,1,2011-05-21 00:40:11+00:00,462,False,46738,cartagena,
3558,2022-03-25 22:53:23+00:00,RT @teleSURtv: #BLOGteleSUR por #GermánGorraizLópez | ¿Provocará la escasez de petróleo una hambruna mundial? → https://t.co/kdZ4oV8zjR htt…,  blogtelesur por  germ ngorraizl pez    provocar  la escasez de petr leo una hambruna mundial      htt ,es,0,14,2021-10-14 09:41:21+00:00,94,False,2178,,
3560,2022-03-25 22:53:22+00:00,103 reais 12 litros de gasolina 😭,103 reais 12 litros de gasolina  ,es,0,0,2016-11-27 19:08:06+00:00,542,False,11641,"Duque de Caxias, Brasil",
3562,2022-03-25 22:53:20+00:00,RT @Rayko66666: @IibertaddigitaI @Hipatiacurie @diario_realidad @Anarojaq_ @GoyoLafarge @SonrisaLetal @cucamacarra @SanWicente @soyunvago @…,       realidad                ,es,0,11,2021-05-31 17:13:36+00:00,961,False,36057,,
3564,2022-03-25 22:53:19+00:00,"Igual que la mamá,una loca fascista,y viviendo de bio combustible,más caro del mundo!!",igual que la mam  una loca fascista y viviendo de bio combustible m s caro del mundo  ,es,0,0,2012-05-17 22:54:16+00:00,3,False,10,,
3568,2022-03-25 22:53:16+00:00,Los transportistas piden al Gobierno subir a 1.000 millones de euros las bonificaciones al gasóleo https://t.co/XG9yknfHjv,los transportistas piden al gobierno subir a 1 000 millones de euros las bonificaciones al gas leo  ,es,0,0,2009-04-28 15:31:22+00:00,93060,False,132204,"+34 91 445 96 97 Madrid, Spain",
3573,2022-03-25 22:53:09+00:00,"Gobierno de NiCARAGUA emite comunicado a través de INE  sobre las alzas internacionales de petróleo exponiendo que asumirá al 100% el aumento del Gas licuado y gasolinas diesel, ese es nuestro Gobierno Sandinista ❤️🖤 liderado por el Comandante Daniel Ortega. https://t.co/iq5v8kn9lZ",gobierno de nicaragua emite comunicado a trav s de ine  sobre las alzas internacionales de petr leo exponiendo que asumir  al 100  el aumento del gas licuado y gasolinas diesel  ese es nuestro gobierno sandinista     liderado por el comandante daniel ortega   ,es,26,12,2013-04-28 02:44:11+00:00,16160,False,87447,,
3575,2022-03-25 22:53:07+00:00,"#LoUltimo
Gobierno Sandinista asumirá el 100% del aumento del precio del GAS licuado y el 70% del aumento del DIESEL y GASOLINA 
#Nicaragua🇳🇮
#Combustibles 

@miltonyani @Atego16 @superfrog89 @collvermat @YaraGmez @Sergiofslnterc1 @F_CamposA17 @SinOrgaNoHayAcc @Justopastormai2 https://t.co/VuDWh8ev5M", loultimo gobierno sandinista asumir  el 100  del aumento del precio del gas licuado y el 70  del aumento del diesel y gasolina   nicaragua    combustibles                 camposa17      ,es,14,12,2019-02-14 01:32:59+00:00,5576,False,9985,Nicaragua,
3577,2022-03-25 22:53:04+00:00,Que poco dura el combustible 🚮,que poco dura el combustible  ,es,0,0,2011-08-13 00:05:07+00:00,365,False,11648,"Central, Paraguay",
3579,2022-03-25 22:53:00+00:00,RT @JfgfrangarJuan: @IvonneMilenaGo @hum02 De rodillas y con humildad viene USA ante su proveedor de petróleo.,     de rodillas y con humildad viene usa ante su proveedor de petr leo ,es,0,2,2010-05-09 03:55:58+00:00,986,False,5374,Colombia,
3580,2022-03-25 22:52:59+00:00,"RT @DiarioTalCual: #Opinión ¿El petróleo venezolano puede sustituir el suministro ruso?, por Xavier Rodríguez Franco @Latinoamerica21 https…",  opini n  el petr leo venezolano puede sustituir el suministro ruso   por xavier rodr guez franco   https ,es,0,2,2011-09-05 14:07:39+00:00,603,False,1006,Venezuela,
3581,2022-03-25 22:52:58+00:00,RT @peretasma: Jdjsshdjsjdvd la Mendizábal con el arroz más pasao que el de una gasolinera mirándola con asco porque tiene 30.000 tíos mene…, jdjsshdjsjdvd la mendiz bal con el arroz m s pasao que el de una gasolinera mir ndola con asco porque tiene 30 000 t os mene ,es,0,3,2018-02-04 12:27:22+00:00,49,False,1287,,
3583,2022-03-25 22:52:56+00:00,"RT @KSAembassyES: La milicia terrorista de Al-Houthi, apoyada por Iran, continúa amenazando el abasto de petróleo a los mercados globales.…", la milicia terrorista de al houthi  apoyada por iran  contin a amenazando el abasto de petr leo a los mercados globales  ,es,0,4,2015-11-29 18:34:27+00:00,134,False,2615,المملكة العربية السعودية,
3593,2022-03-25 22:52:46+00:00,"@SXTrece @adeudado @ionebelarra Los problemas no es solo el combustible sino que muchas leyes no se cumplen en este pais y los ganaderos y agricultores estan tambien hasta los... de tantos incumplimientos.
https://t.co/cekV5LHA46",      los problemas no es solo el combustible sino que muchas leyes no se cumplen en este pais y los ganaderos y agricultores estan tambien hasta los    de tantos incumplimientos   ,es,0,0,2022-02-01 08:24:32+00:00,21,False,365,,
3594,2022-03-25 22:52:43+00:00,"Yo también me follaría a un famoso para quedarme embarazada de él que la gasolina está carísima.😩
#ivonneresponde",yo tambi n me follar a a un famoso para quedarme embarazada de  l que la gasolina est  car sima    ivonneresponde,es,0,0,2021-10-10 01:43:18+00:00,4,False,70,"Islas Canarias, España",
3599,2022-03-25 22:52:37+00:00,Pero como no vende gasolina o canta reguetón no será viral @ReporteYa https://t.co/O7nWUkIAW5,pero como no vende gasolina o canta reguet n no ser  viral    ,es,0,0,2010-02-25 20:19:37+00:00,1061,False,13675,Maracaibo - Venezuela,
3600,2022-03-25 22:52:36+00:00,@parkmir21 Jajajaja... Yo digo lo que me hizo la pandemia no me lo puede hacer la gasolina,  jajajaja    yo digo lo que me hizo la pandemia no me lo puede hacer la gasolina,es,1,0,2013-01-08 02:56:07+00:00,1153,False,69500,,
3603,2022-03-25 22:52:29+00:00,"@cachafeiro_ Claro x eso estaban en la ciudad de Barcelona y han dicho vamos a echar gasolina en la más barata, dónde está??? Pues a 4,5 km y casualmente es l'h",   claro x eso estaban en la ciudad de barcelona y han dicho vamos a echar gasolina en la m s barata  d nde est     pues a 4 5 km y casualmente es l h,es,0,0,2021-08-05 14:03:55+00:00,113,False,3804,en casa o no,
3604,2022-03-25 22:52:29+00:00,@B_Estefan El barril de petróleo va a seguir subiendo,  estefan el barril de petr leo va a seguir subiendo,es,2,0,2015-01-26 04:06:04+00:00,1535,False,3296,"Lima, Peru",
3608,2022-03-25 22:52:28+00:00,"@Masdemnt @canislupusnocte Eres muy corto de miras, bloqueo económico de menos de un 18% de la población mundial, a ver si va a ser nuestra la chapuza, que europa paga la electricidad, gas y petróleo más cara de Europa, a ver cuántas empresas españolas y europeas aguantan contra estos gastos de producción",    eres muy corto de miras  bloqueo econ mico de menos de un 18  de la poblaci n mundial  a ver si va a ser nuestra la chapuza  que europa paga la electricidad  gas y petr leo m s cara de europa  a ver cu ntas empresas espa olas y europeas aguantan contra estos gastos de producci n,es,0,0,2022-03-09 21:14:26+00:00,2,False,188,,
3611,2022-03-25 22:52:27+00:00,"#LoMásLeído
Ribera confía en que otras petroleras sigan el movimiento de Repsol 
https://t.co/Q3pDoIePSo 
#huelgatransportistas #Combustibles #Gasóleo", lom sle do ribera conf a en que otras petroleras sigan el movimiento de repsol      huelgatransportistas  combustibles  gas leo,es,0,0,2010-06-24 15:55:00+00:00,9413,True,4088,"Madrid, España",
3612,2022-03-25 22:52:26+00:00,“Rusia está considerando aceptar bitcoin como forma de pago por su petróleo y gas” https://t.co/q29zgOYRop, rusia est  considerando aceptar bitcoin como forma de pago por su petr leo y gas   ,es,1,2,2011-02-16 03:24:57+00:00,4582,False,2055,Venezuela,
3619,2022-03-25 22:52:18+00:00,"QUE BIEN QUE LOS EMPAQUETO EL GORDO EN PAUSA A LOS CAMPORULOS.

TENIENDO EN CUENTA EL PRECIO DEL COMBUSTIBLE Y CON EL CHAMUYO DE LA EPICA, LES DIJO A LOS DEL MICRO; DEJAMELOS EN GENERAL PAZ O A LA ALTURA DE LA ESMA QUE LOS HAGO CAMINAR HASTA PLAZA DE MAYO CANTANDO NO SE AVIVAN https://t.co/EPPg6DOMu5",que bien que los empaqueto el gordo en pausa a los camporulos   teniendo en cuenta el precio del combustible y con el chamuyo de la epica  les dijo a los del micro  dejamelos en general paz o a la altura de la esma que los hago caminar hasta plaza de mayo cantando no se avivan  ,es,4,1,2020-07-03 12:02:28+00:00,9490,False,8206,Deep Conurban esquivando balas,
3621,2022-03-25 22:52:12+00:00,RT @MaxMojica: Ha subido más la gasolina que el Bitcoin, ha subido m s la gasolina que el bitcoin,es,0,97,2013-05-08 19:21:16+00:00,197,False,6051,,
3625,2022-03-25 22:52:10+00:00,"@JavierAdamuz Tienen la misma situación o peor, renta por habitante e IPC. Los sueldos oficialmente (No hablamos de economía sumergida o negro) son más bajos, por tanto los precios también.

Por no decir que Rusia es uno de los principales productores y exportadores de gas y petróleo.",  tienen la misma situaci n o peor  renta por habitante e ipc  los sueldos oficialmente  no hablamos de econom a sumergida o negro  son m s bajos  por tanto los precios tambi n   por no decir que rusia es uno de los principales productores y exportadores de gas y petr leo ,es,0,0,2022-02-10 07:06:12+00:00,9,False,1343,,
3627,2022-03-25 22:52:09+00:00,"@EmisorasUnidas @DrGiammattei @LesterRamirezEU El globalismo radical nos quiere “no tendrán nada, pero serán felices” así q mejor prepare un comité para coordinar producción masiva de productos agrícolas locales y de todo tipo. No sería malo una refinería de petróleo y volvernos autosuficientes, porque la cosa está peluda!!",      el globalismo radical nos quiere  no tendr n nada  pero ser n felices  as  q mejor prepare un comit  para coordinar producci n masiva de productos agr colas locales y de todo tipo  no ser a malo una refiner a de petr leo y volvernos autosuficientes  porque la cosa est  peluda  ,es,6,2,2013-05-09 16:04:17+00:00,235,False,8835,,
3631,2022-03-25 22:52:04+00:00,"❗️#ÚLTIMAHORA | Gobierno de #Nicaragua asumirá el 100% del incremento del precio del Gas Licuado y el 70% de las Gasolinas y Diésel.

Comunicado del INE y Ministerio de Energía y Minas, informando a nuestro Pueblo, que ante el alza de los precios internacionales del Petróleo. https://t.co/jctGemVweb",    ltimahora   gobierno de  nicaragua asumir  el 100  del incremento del precio del gas licuado y el 70  de las gasolinas y di sel   comunicado del ine y ministerio de energ a y minas  informando a nuestro pueblo  que ante el alza de los precios internacionales del petr leo   ,es,15,12,2009-01-22 16:49:43+00:00,448,False,1599,"León, Nicaragua",
3632,2022-03-25 22:52:04+00:00,"¡Ya vimos como si el gremio artístico se une y alza la voz se le escucha!

Les dejo temas a continuación…

-Niños y niñas con cáncer sin medicamentos.

-Vacunación niñas y niños.

-Instancias infantiles.

-Escuelas de tiempo completo.

-Costo del subsidio a la gasolina…", ya vimos como si el gremio art stico se une y alza la voz se le escucha   les dejo temas a continuaci n    ni os y ni as con c ncer sin medicamentos    vacunaci n ni as y ni os    instancias infantiles    escuelas de tiempo completo    costo del subsidio a la gasolina ,es,272,52,2009-09-14 01:19:05+00:00,242334,True,153704,El país de la simulación.,
3634,2022-03-25 22:51:58+00:00,"@telajetaveneco Con 1000$ en venezuela cubres la canasta básica que ronda los 550$, si pagas gasolina a 1$ el litro para poder ir a trabajar son otros 100$ mensuales, gastos varios otros 200-300$, rogar que no se te dañe algún artefacto en casa , te enfermes o se te dañe el carro",  con 1000  en venezuela cubres la canasta b sica que ronda los 550   si pagas gasolina a 1  el litro para poder ir a trabajar son otros 100  mensuales  gastos varios otros 200 300   rogar que no se te da e alg n artefacto en casa   te enfermes o se te da e el carro,es,0,0,2020-04-03 17:42:01+00:00,70,False,9523,,
3637,2022-03-25 22:51:50+00:00,"RT @UltraBlancaOfic: Reunión ordinaria hoy 6:30 p.m. gasolinera Puma Roosevelt 49. 
Convoquen!", reuni n ordinaria hoy 6 30 p m  gasolinera puma roosevelt 49   convoquen ,es,0,7,2020-05-08 19:19:24+00:00,543,False,83780,"Arlington, TX",
3640,2022-03-25 22:51:45+00:00,"Gobierno de Nicaragua asumirá el 100% del incremento del gas licuado y el 70% del incremento de gasolinas y diesel.

#Nicaragua #25Marzo https://t.co/Ars7FB0DLy",gobierno de nicaragua asumir  el 100  del incremento del gas licuado y el 70  del incremento de gasolinas y diesel    nicaragua  25marzo  ,es,16,16,2018-04-25 18:38:53+00:00,1289,False,1481,Nicaragua,
3641,2022-03-25 22:51:45+00:00,@PinoCalad Un galón de petróleo 🛢  para cada uno,  un gal n de petr leo    para cada uno,es,0,0,2010-05-11 18:37:22+00:00,1035,False,2709,Bogota,
3645,2022-03-25 22:51:40+00:00,"RT @BuenoRubio: Una pregunta: los que tienen que ir a trabajar en coche porque no hay transporte público a su lugar de trabajo, ¿también re…", una pregunta  los que tienen que ir a trabajar en coche porque no hay transporte p blico a su lugar de trabajo   tambi n re ,es,0,4,2019-05-26 21:39:44+00:00,69,False,11870,Mollerussa,
3652,2022-03-25 22:51:35+00:00,"Rusia informa de destrucción del mayor depósito de combustible del Ejército ucraniano en las afueras de Kiev, con misiles de crucero de alta precisión. https://t.co/OaTv3cDfgU",rusia informa de destrucci n del mayor dep sito de combustible del ej rcito ucraniano en las afueras de kiev  con misiles de crucero de alta precisi n   ,es,5,4,2011-03-20 01:40:24+00:00,1545,False,3533,América ,
3653,2022-03-25 22:51:35+00:00,"@sextaNoticias Mas bien la clave es cuanto aditivo le meten.
No dicen la formulacion, ni aseguran la proporcion porque ""tampoco estamos obligados legalmente a hacerlo"".
Pues ya está: rebajan el combustible original con sus ""aditivos"".
Mismo metodo que el que corta droga para sacar mas producto.",  mas bien la clave es cuanto aditivo le meten  no dicen la formulacion  ni aseguran la proporcion porque  tampoco estamos obligados legalmente a hacerlo   pues ya est   rebajan el combustible original con sus  aditivos   mismo metodo que el que corta droga para sacar mas producto ,es,1,0,2010-03-02 13:27:33+00:00,480,False,20402,Comunidad de Madrid,
3657,2022-03-25 22:51:30+00:00,"RT @PrimitivoPsuv: PICO Y PLACA DEL SÁBADO 26 DE MARZO!⛽

El Gobierno Bolivariano de Portuguesa recuerda a la colectividad que alineado a l…", pico y placa del s bado 26 de marzo    el gobierno bolivariano de portuguesa recuerda a la colectividad que alineado a l ,es,0,7,2011-04-14 20:31:55+00:00,313,False,5218,,
