,Created_at,Text,Clean Text,Screen_Name,Lang,Favourite_count,Retweet_count,Fecha creacion,Followers,Verificado,Cantidad Fav,País,Coordenadas,ID
3596,2022-03-17 18:20:43+00:00,"RT @lauralruiz: Para organizar una #huelga, los representantes de los trabajadores deben alegar bien sus reivindicaciones, reunirse con gob…", para organizar una  huelga  los representantes de los trabajadores deben alegar bien sus reivindicaciones  reunirse con gob ,belendda,es,0,1,2009-06-26 19:26:21+00:00,406,False,25790,,,1504523137211318272
3599,2022-03-17 18:20:27+00:00,"Patronales y sindicatos exigen al Gobierno ""contundencia"" ante la violencia en los paros del transporte @ElPeriodico_Esp https://t.co/RGY6EaDlCV",patronales y sindicatos exigen al gobierno  contundencia  ante la violencia en los paros del transporte   esp  ,jcalderonbelt,es,0,0,2012-12-06 13:45:00+00:00,1877,False,12415,Spain - Madrid,,1504523072338018312
3610,2022-03-17 18:19:37+00:00,"@gonnassau En la TVE diciendo que la huelga del transporte, son los empresarios quienes la convocan....PD. Empresario del transporte en Huelga... Autónomos con un camión ,que les cuesta dinero salir a trabajar, después de una inversión no se llevan ni mil euros para casa después de gastos.",  en la tve diciendo que la huelga del transporte  son los empresarios quienes la convocan    pd  empresario del transporte en huelga    aut nomos con un cami n  que les cuesta dinero salir a trabajar  despu s de una inversi n no se llevan ni mil euros para casa despu s de gastos ,Viriato50771405,es,0,0,2018-11-18 10:55:08+00:00,34,False,1238,Lusitania..Hispania,,1504522863260446726
3615,2022-03-17 18:19:15+00:00,"RT @IsolinoR: ""El Gobierno califica la huelga del transporte de ""boicot alentado por la extrema derecha"""" https://t.co/OUQ2a1kR48",  el gobierno califica la huelga del transporte de  boicot alentado por la extrema derecha    ,WildZG1,es,0,3,2020-10-02 18:35:05+00:00,2644,False,40312,,,1504522769136078865
3617,2022-03-17 18:19:14+00:00,"SEG Automotive ha anunciado que mañana, viernes, parará de ""forma puntual"" la actividad en el área de producción de la planta de Treto, en Bárcena de Cicero, con motivo de la huelga en el transporte. https://t.co/FvTaK48cGR",seg automotive ha anunciado que ma ana  viernes  parar  de  forma puntual  la actividad en el  rea de producci n de la planta de treto  en b rcena de cicero  con motivo de la huelga en el transporte   ,ALERTAeldiario,es,1,0,2016-10-04 14:39:41+00:00,5789,False,1468,"Santander, España",,1504522763998011395
3624,2022-03-17 18:18:42+00:00,"RT @LeonIberia: @RubenSanchezTW La huelga está promovida por los empresarios del transporte y la apoya la ultraderecha, así qué imagina...…",   la huelga est  promovida por los empresarios del transporte y la apoya la ultraderecha  as  qu  imagina    ,Ana_magicworld,es,0,1,2018-03-07 18:49:24+00:00,28,False,3861,"Llíria, España",,1504522631747444742
3630,2022-03-17 18:18:04+00:00,"Y por sorpresa llega LA MERMA hecha carne
Quiere el ejercito contra la huelga del  transporte 
https://t.co/8xgKE0SQVA",y por sorpresa llega la merma hecha carne quiere el ejercito contra la huelga del  transporte   ,Kantavru,es,0,0,2012-07-20 17:38:01+00:00,387,False,31058,,,1504522470514069504
3634,2022-03-17 18:17:55+00:00,La huelga del transporte https://t.co/OwsG75CE2s,la huelga del transporte  ,AngelikaKLoewe,es,0,0,2011-09-04 20:40:20+00:00,438,False,134,España,,1504522435630190593
3637,2022-03-17 18:17:45+00:00,CCOO contra la huelga del transporte por el alza del combustible https://t.co/6PvcFbARWK a través de @ElDiestro_,ccoo contra la huelga del transporte por el alza del combustible   a trav s de   ,SINDO56027912,es,0,2,2013-03-11 17:30:12+00:00,5133,False,127585,"Comunidad de Madrid, España",,1504522392089071616
3638,2022-03-17 18:17:41+00:00,La huelga del transporte https://t.co/3lSegarr50,la huelga del transporte  ,Arturitosss,es,0,0,2011-09-17 20:43:08+00:00,179,False,346,Ibiza,,1504522374418415623
3647,2022-03-17 18:16:20+00:00,"Todo esto justo tras 3 dias de huelga de la patronal del transporte, muchisima casualidad, no????

👇👇👇👇👇",todo esto justo tras 3 dias de huelga de la patronal del transporte  muchisima casualidad  no           ,obmtmd,es,1,1,2016-11-09 18:39:51+00:00,400,False,13140,"Barcelona, España",,1504522034365280259
3653,2022-03-17 18:16:04+00:00,"Señor @sanchezcastejon ya nadie le cree, la huelga del transporte es por que la gente no aguanta mas lo que su gobierno esta haciendo a los españoles, pero claro, la culpa es de FRANCO, la ultra derecha y los camioneros, los cuales están abandonados por @CCOO y @UGT_Comunica https://t.co/kq79XcMllL",se or   ya nadie le cree  la huelga del transporte es por que la gente no aguanta mas lo que su gobierno esta haciendo a los espa oles  pero claro  la culpa es de franco  la ultra derecha y los camioneros  los cuales est n abandonados por   y   comunica  ,EBlanco70435412,es,38,27,2020-05-12 18:36:39+00:00,840,False,25591,,,1504521966593757187
3659,2022-03-17 18:15:42+00:00,RT @Jedi_Sanfermin: El sector lácteo alerta de que ya se nota el desabastecimiento en los supermercados por la huelga en el transporte http…, el sector l cteo alerta de que ya se nota el desabastecimiento en los supermercados por la huelga en el transporte http ,vielitus,es,0,3,2015-04-21 19:44:27+00:00,4575,False,265588,,,1504521876936220673
3669,2022-03-17 18:15:09+00:00,Dos días de huelga de un sector minoritario del transporte y ya hay escasean algunos productos? https://t.co/HyqFZoiITf,dos d as de huelga de un sector minoritario del transporte y ya hay escasean algunos productos   ,Antonio49516657,es,5,2,2021-04-16 18:21:24+00:00,299,False,3682,,,1504521736339046401
3670,2022-03-17 18:15:04+00:00,"Huelga del transporte: «Los chóferes están asustados, esto se está yendo de las manos y puede haber muertos» https://t.co/PgXK0NIi60",huelga del transporte   los ch feres est n asustados  esto se est  yendo de las manos y puede haber muertos   ,abcdesevilla,es,3,0,2009-05-26 08:47:06+00:00,224794,True,4971,Sevilla,,1504521714331496464
3676,2022-03-17 18:14:31+00:00,"La culpa si no es d Putin, es d la extrema derecha, demostración palpable d la ineptitud e incapacidad d estos gualtrapas q buscan culpables por doquier.

El Gobierno califica la huelga del transporte de ""boicot alentado por la extrema derecha"" https://t.co/csIr3XQomp",la culpa si no es d putin  es d la extrema derecha  demostraci n palpable d la ineptitud e incapacidad d estos gualtrapas q buscan culpables por doquier   el gobierno califica la huelga del transporte de  boicot alentado por la extrema derecha   ,vicborau,es,2,1,2018-07-25 18:53:14+00:00,59,False,1453,,,1504521577022558208
3680,2022-03-17 18:14:16+00:00,"Me parece genial la huelga de transporte, pero quien quiera seguir trabajando que lo respeten y no lleguen al extremo de pincharles las ruedas a los camiones. Esos actos vandálicos les quita ya toda la razón aunque la lleven. Lo siento...",me parece genial la huelga de transporte  pero quien quiera seguir trabajando que lo respeten y no lleguen al extremo de pincharles las ruedas a los camiones  esos actos vand licos les quita ya toda la raz n aunque la lleven  lo siento   ,raquel5988,es,1,0,2011-01-19 21:24:52+00:00,124,False,8253,"Loja, España",,1504521515295023112
3681,2022-03-17 18:14:13+00:00,"@cuatroaldia La huelga de transporte la está moviendo la extrema derecha aprovechando la guerra en Ucrania.
Es la segunda parte de la guerra de Putin, desestabilizar los países europeos.
A eso le unes la teleberlusconi con Marni la ladrona dando lecciones.
Ay!!!
@estherpalomera",  la huelga de transporte la est  moviendo la extrema derecha aprovechando la guerra en ucrania  es la segunda parte de la guerra de putin  desestabilizar los pa ses europeos  a eso le unes la teleberlusconi con marni la ladrona dando lecciones  ay     ,malvalila,es,3,1,2012-12-03 14:33:33+00:00,704,False,36756,Madrid.,,1504521500392673281
3687,2022-03-17 18:13:52+00:00,"RT @CamioneroRafa: @Santi_ABASCAL Al final terminaremos con una desobediencia total a éste gobierno robacarteras, y ya tenemos la huelga de…",   abascal al final terminaremos con una desobediencia total a  ste gobierno robacarteras  y ya tenemos la huelga de ,Esther56600094,es,0,3,2021-07-05 19:58:03+00:00,22,False,2198,,,1504521414132523011
3707,2022-03-17 18:12:01+00:00,"La 3a guerra Mundial está cerca.

Alertan del ""gran impacto"" de huelga de transporte en distribución de cerveza https://t.co/flxeN8P1nr via @eldiarioes",la 3a guerra mundial est  cerca   alertan del  gran impacto  de huelga de transporte en distribuci n de cerveza   via  ,73juanlu,es,2,0,2012-10-11 17:44:36+00:00,518,False,4753,,,1504520947470114819
3708,2022-03-17 18:11:56+00:00,Coren suma tres días con todos sus mataderos cerrados por la huelga del transporte https://t.co/CiMrqwLHHG https://t.co/IjXsNOmExK,coren suma tres d as con todos sus mataderos cerrados por la huelga del transporte    ,vozourense,es,0,2,2011-06-07 16:40:04+00:00,12355,False,5,Galicia | España,,1504520926192353283
3713,2022-03-17 18:11:43+00:00,@club_conde 😅madre mía los especímenes que pululan por ahí. Los trabajadores/autónomos/pymes de transporte están llevando una huelga justa debido a las inasumibles condiciones que soportan,  conde  madre m a los espec menes que pululan por ah   los trabajadores aut nomos pymes de transporte est n llevando una huelga justa debido a las inasumibles condiciones que soportan,Neolive76648783,es,0,0,2021-09-08 16:03:23+00:00,4,False,796,,,1504520871649722377
3722,2022-03-17 18:11:23+00:00,"ESPAÑOLES: ministra de Movilidad y no se que más. No mienta groseramente. Lo único ultra que hay en España, es la ultra izquierda, con la que Ud compadrea. Y la huelga del transporte es la punta del iceberg de un pais astiado de pagar impuestos para tirar el dinero en tonterias.",espa oles  ministra de movilidad y no se que m s  no mienta groseramente  lo  nico ultra que hay en espa a  es la ultra izquierda  con la que ud compadrea  y la huelga del transporte es la punta del iceberg de un pais astiado de pagar impuestos para tirar el dinero en tonterias ,PMajeton,es,3,1,2016-11-25 15:05:34+00:00,1505,False,11717,Oviedo,,1504520788828995584
3739,2022-03-17 18:10:12+00:00,@cuatroaldia @PratSandberg Gran programa sobre la huelga del transporte hoy. Sinceridad sin postureo como el de otras cadenas y diarios paniaguadas de este régimen.,    gran programa sobre la huelga del transporte hoy  sinceridad sin postureo como el de otras cadenas y diarios paniaguadas de este r gimen ,eldronpadrino,es,0,0,2016-09-13 17:55:27+00:00,120,False,395,España,,1504520493189189638
3742,2022-03-17 18:09:56+00:00,"@PepeRubioM @LuisJavierSanj2 Añade edo ahora, justo ahora en plena guerra, la huelga del transporte convocada por una plataforma desconocida vinculada a VOX,y esos medios anunciando desabastecimiento",    a ade edo ahora  justo ahora en plena guerra  la huelga del transporte convocada por una plataforma desconocida vinculada a vox y esos medios anunciando desabastecimiento,luchicarmen,es,2,0,2011-07-28 11:39:02+00:00,1323,False,14523,,,1504520423756734474
3749,2022-03-17 18:09:30+00:00,"Paso por #Córdoba del convoy de camiones escoltados por la #GuardiaCivil para garantizarles la circulación ante los posibles piquetes organizados por la huelga en el transporte.

#ServirYProteger #EquiparacionYa https://t.co/WY7FOS9YEu",paso por  c rdoba del convoy de camiones escoltados por la  guardiacivil para garantizarles la circulaci n ante los posibles piquetes organizados por la huelga en el transporte    serviryproteger  equiparacionya  ,jucilnacional,es,121,71,2018-04-09 22:55:49+00:00,34056,True,73992,España,,1504520315430391808
3753,2022-03-17 18:09:06+00:00,"En España no aguantamos una huelga de transporte ni una semana.
Llevan 2 días y los energúmenos ya están atrasando con los suministros en general.
De creen que los productos llegan al supermercado por teletranaporte.",en espa a no aguantamos una huelga de transporte ni una semana  llevan 2 d as y los energ menos ya est n atrasando con los suministros en general  de creen que los productos llegan al supermercado por teletranaporte ,amarantium,es,2,1,2010-10-12 14:20:05+00:00,760,False,6478,Hawaii,,1504520213240373251
3755,2022-03-17 18:08:58+00:00,"‼️ Se les considera supuestos autores de delitos continuados de desórdenes públicos, daños y contra la Seguridad Vial
#HuelgaTransporte 
https://t.co/i1NTYcw72b",   se les considera supuestos autores de delitos continuados de des rdenes p blicos  da os y contra la seguridad vial  huelgatransporte   ,diariodeastorga,es,1,2,2014-01-23 11:08:19+00:00,1723,False,167,"Astorga, España",,1504520181527240711
3759,2022-03-17 18:08:30+00:00,RT @Efeagro: La cuarta jornada de huelga en el sector del transporte de mercancías ha obligado a proteger los envíos de alimentos para gara…, la cuarta jornada de huelga en el sector del transporte de mercanc as ha obligado a proteger los env os de alimentos para gara ,LauragemaCG,es,0,1,2012-08-04 18:34:12+00:00,1697,False,38448,,,1504520065869361158
3762,2022-03-17 18:08:11+00:00,Hace tres semanas que no cambias las sábanas de la cama por la huelga del transporte 😌,hace tres semanas que no cambias las s banas de la cama por la huelga del transporte  ,KokoBWare23,es,5,0,2022-01-20 19:11:12+00:00,458,False,10288,,,1504519984122417152
3765,2022-03-17 18:08:03+00:00,RT @copecastellon: 📻 #AUDIO Huelga de transporte; Riesgo de cierre de empresas azulejeras en Castellón; Se esperan lluvias; Fallas en Burri…,    audio huelga de transporte  riesgo de cierre de empresas azulejeras en castell n  se esperan lluvias  fallas en burri ,QuiqueRG84,es,0,1,2011-04-20 07:59:11+00:00,1987,False,795,Castellón de La Plana,,1504519951683575819
3766,2022-03-17 18:08:02+00:00,Qué piensa hacer el Gobierno de @sanchezcastejon para solucionar la huelga de transporte? Va a esperar a que haya disturbios sociales por la falta de productos en los súper mercados? Va a ponerse de perfil como siempre??,qu  piensa hacer el gobierno de   para solucionar la huelga de transporte  va a esperar a que haya disturbios sociales por la falta de productos en los s per mercados  va a ponerse de perfil como siempre  ,chappy793,es,0,0,2022-01-14 09:00:41+00:00,54,False,1662,,,1504519947703275525
3770,2022-03-17 18:07:42+00:00,RT @somosmar_lvg: Calvo cesará la actividad a partir del lunes debido a la huelga en el transporte https://t.co/H6x1Att3Yz, calvo cesar  la actividad a partir del lunes debido a la huelga en el transporte  ,TituladosDelMar,es,0,2,2021-11-04 08:15:51+00:00,296,False,7144,,,1504519863049793536
3772,2022-03-17 18:07:33+00:00,"@ionebelarra @PODEMOS INÚTILES DESDE HACE YA 1 AÑO. LA GUERRA RUSA ES LA PUNTILLA. 
Prensa: Huelga del transporte: autónomos y pymes se enfrentan a la patronal y paran de forma indefinida",    in tiles desde hace ya 1 a o  la guerra rusa es la puntilla   prensa  huelga del transporte  aut nomos y pymes se enfrentan a la patronal y paran de forma indefinida,Unomas44284474,es,0,0,2022-01-30 17:24:54+00:00,5,False,1,,,1504519823568613384
3773,2022-03-17 18:07:32+00:00,"Vaya vaya, ahora los piquetes en una huelga son radicales de derechas. No hace mucho el gobierno derogó el 315.3 ahora como el @PSOE no puede perseguir los piquetes por falta de tipo penal los persigue en base a tipo ideológico, negando la representación al 80% del transporte.",vaya vaya  ahora los piquetes en una huelga son radicales de derechas  no hace mucho el gobierno derog  el 315 3 ahora como el   no puede perseguir los piquetes por falta de tipo penal los persigue en base a tipo ideol gico  negando la representaci n al 80  del transporte ,hidacio,es,0,0,2009-11-19 08:57:21+00:00,551,False,11315,España,,1504519820611575808
3776,2022-03-17 18:07:29+00:00,RT @_Herce: Alguien se pregunta sobre el sinsentido de la huelga de transporte? Primero “eran cuatro gatos” ahora son “un boicot”. En mi op…, alguien se pregunta sobre el sinsentido de la huelga de transporte  primero  eran cuatro gatos  ahora son  un boicot   en mi op ,FJuradoPerez,es,0,3,2010-09-19 20:56:42+00:00,758,False,7204,,,1504519807315632133
3784,2022-03-17 18:06:58+00:00,"RT @valentingarciag: Patronales y sindicatos exigen al Gobierno ""contundencia"" ante la violencia en los paros del transporte @ElPeriodico_E…", patronales y sindicatos exigen al gobierno  contundencia  ante la violencia en los paros del transporte   e ,feliperedondom2,es,0,2,2012-02-09 19:04:10+00:00,2244,False,11685,Esparragosa de lares ,,1504519679561416712
3786,2022-03-17 18:06:56+00:00,"El PSOE y sus socios en marzo del año pasado aprobaron esto. Hoy, seguro que se arrepienten con la huelga de transporte y lo que se les viene encima.
Idiotas https://t.co/3Ean6eOUvK",el psoe y sus socios en marzo del a o pasado aprobaron esto  hoy  seguro que se arrepienten con la huelga de transporte y lo que se les viene encima  idiotas  ,MendiMendi1,es,11,6,2011-12-25 22:50:45+00:00,10316,False,64346,Madrid,,1504519668140331013
3796,2022-03-17 18:06:08+00:00,"El Gobierno vincula la huelga del sector del transporte a “un boicot alentado desde la ultraderecha” y despliega más de 15.000 efectivos para “controlar a los piquetes”.

Ni un efectivo para 4.000 subsaharianos que asaltaron Melilla #GobiernoDimision #hayqueEcharlos https://t.co/4Tv3yF1qPS",el gobierno vincula la huelga del sector del transporte a  un boicot alentado desde la ultraderecha  y despliega m s de 15 000 efectivos para  controlar a los piquetes    ni un efectivo para 4 000 subsaharianos que asaltaron melilla  gobiernodimision  hayqueecharlos  ,VOXEROAndaluz,es,55,44,2022-03-06 14:21:43+00:00,1687,False,897,,,1504519468508225543
3802,2022-03-17 18:05:24+00:00,"@ArreDemo_ @JimenezRiestra @juanjo_soriano @interiorgob @justiciagob Y porque mi empresa es comercial no de transporte. Vendemos y distribuimos materias primas de alimentación y nuestro convenio es de comercio de alimentación, no de transporte. Además al ser un paro patronal, no una huelga, si la empresa trabaja los empleados están obligados a ir",       soriano     y porque mi empresa es comercial no de transporte  vendemos y distribuimos materias primas de alimentaci n y nuestro convenio es de comercio de alimentaci n  no de transporte  adem s al ser un paro patronal  no una huelga  si la empresa trabaja los empleados est n obligados a ir,Cesar__Padrino,es,0,0,2014-02-05 14:25:48+00:00,376,False,1115,España,,1504519284021727238
3805,2022-03-17 18:05:13+00:00,Violencia en la huelga del transporte: lunas rotas a pedradas y mangueras con clavos para pinchar ruedas https://t.co/2qSt5RU6Xk,violencia en la huelga del transporte  lunas rotas a pedradas y mangueras con clavos para pinchar ruedas  ,navarra_com,es,0,0,2014-12-25 23:53:27+00:00,11170,False,9,Pamplona,,1504519235816595474
3815,2022-03-17 18:04:13+00:00,"RT @Tacograferos: 📢 Huelga indefinida convocada por la Plataforma para la Defensa del Sector del #Transporte de #Mercancías. 

Sigue el hil…",   huelga indefinida convocada por la plataforma para la defensa del sector del  transporte de  mercanc as    sigue el hil ,Tayeb16015975,es,0,10,2022-01-20 23:10:05+00:00,0,False,7,,,1504518986985316353
3822,2022-03-17 18:03:47+00:00,"Si te indignan más los piquetes informativos del gremio del transporte, que los especuladores que se enriquecen a costa de los trabajadores y pequeños empresarios; eres parte del problema y no de la solución. ¡Huelga General ya!",si te indignan m s los piquetes informativos del gremio del transporte  que los especuladores que se enriquecen a costa de los trabajadores y peque os empresarios  eres parte del problema y no de la soluci n   huelga general ya ,NoSPDisidentes,es,117,44,2019-12-18 17:13:34+00:00,7192,False,5335,España/Portugal/Mozambique,,1504518877555925003
3823,2022-03-17 18:03:43+00:00,"Huelga del transporte: «Los chóferes están asustados, esto se está yendo de las manos y puede haber muertos» https://t.co/jSJPUn3oPL a través de @abcdesevilla",huelga del transporte   los ch feres est n asustados  esto se est  yendo de las manos y puede haber muertos    a trav s de  ,verdepardo1,es,0,0,2016-08-14 17:42:51+00:00,284,False,1889,Entre Camas y Tomares.,,1504518861202366474
3838,2022-03-17 18:02:14+00:00,"Las consecuencias de la huelga del transporte, comienza a tirarse pescado y cese de abastecimiento de agua mineral https://t.co/d6dSrF0Jl9",las consecuencias de la huelga del transporte  comienza a tirarse pescado y cese de abastecimiento de agua mineral  ,galicia_tuits,es,0,0,2021-02-11 12:54:12+00:00,59,False,95,,,1504518484788666375
3850,2022-03-17 18:00:40+00:00,La desconexión del Gobierno con la realidad sube al nivel Legendaria https://t.co/Hyo8K8Ymjp,la desconexi n del gobierno con la realidad sube al nivel legendaria  ,HernnCortes,es,21,8,2017-06-04 17:33:09+00:00,24759,False,89085,Tenochtitlan,,1504518092281585668
3854,2022-03-17 18:00:11+00:00,"La lían al forzar la detención de un camión en Castilla-La Mancha por la huelga del transporte
 #CastillaLaMancha

https://t.co/SOzXIUoa0b",la l an al forzar la detenci n de un cami n en castilla la mancha por la huelga del transporte   castillalamancha   ,ElDigitalAB,es,4,4,2013-02-25 21:46:55+00:00,28990,True,1104,"Albacete, España",,1504517971452047361
3855,2022-03-17 18:00:00+00:00,El tercer día de huelga de transporte deja incidentes en zonas logísticas de transporte y problemas en la cadena de suministros en Cádiz https://t.co/Q314OKcZAr a través de @8cadiz,el tercer d a de huelga de transporte deja incidentes en zonas log sticas de transporte y problemas en la cadena de suministros en c diz   a trav s de  ,8cadiz,es,0,0,2014-02-05 18:34:56+00:00,3414,False,227,,,1504517926442856448
3859,2022-03-17 17:59:38+00:00,"Nunca pido absolutamente nada por internet.

Yo a 3 días de una huelga de transporte: click",nunca pido absolutamente nada por internet   yo a 3 d as de una huelga de transporte  click,minicaoss,es,1,1,2012-04-09 17:37:35+00:00,700,False,20078,,,1504517834205970444
3861,2022-03-17 17:59:29+00:00,Calvo cesará la actividad a partir del lunes debido a la huelga en el transporte https://t.co/H6x1Att3Yz,calvo cesar  la actividad a partir del lunes debido a la huelga en el transporte  ,somosmar_lvg,es,1,2,2020-01-16 11:44:29+00:00,1013,False,0,,,1504517796729962497
3865,2022-03-17 17:58:56+00:00,"RT @COPECordoba: Los mercados cordobeses se resienten con la falta de abastecimiento derivada del parón indefinido del transporte 👇🏻👇🏻👇🏻
ht…", los mercados cordobeses se resienten con la falta de abastecimiento derivada del par n indefinido del transporte        ht ,glopezcu,es,0,2,2011-10-14 07:12:39+00:00,413,False,700,Córdoba,,1504517654580797442
3867,2022-03-17 17:58:46+00:00,HUELGA de transporte https://t.co/Fr503va1U6 via @YouTube,huelga de transporte   via  ,EmilioGRanz,es,1,0,2021-08-20 17:14:03+00:00,23,False,757,,,1504517615749840896
3870,2022-03-17 17:58:39+00:00,"@diostuitero Viva la democracia divina y participativa
Una de chapulines no nos vendría mal que tenemos desabastecimiento con la huelga de transporte.",  viva la democracia divina y participativa una de chapulines no nos vendr a mal que tenemos desabastecimiento con la huelga de transporte ,Suecue5,es,1,0,2019-10-16 18:04:16+00:00,293,False,927,,,1504517585320218633
3876,2022-03-17 17:58:22+00:00,Así afecta la huelga de transporte al mercado de la Plaza de Lugo (A Coruña) https://t.co/3QjFqbvTiM,as  afecta la huelga de transporte al mercado de la plaza de lugo  a coru a   ,NoelaBao,es,0,0,2011-10-07 13:05:12+00:00,1067,False,4686,A Coruña,,1504517513778016256
3877,2022-03-17 17:58:18+00:00,"@sanchezcastejon @KlausIohannis @NicolaeCiuca Sigue de gira @sanchezcastejon, como si fueras Elvis, mientras tu país está paralizado por la huelga del transporte, desabastecido en los mercados, y hundido en la miseria energética. Los culpables no son Putin y Franco. Lo eres tú, que no tienes vergüenza.",      sigue de gira    como si fueras elvis  mientras tu pa s est  paralizado por la huelga del transporte  desabastecido en los mercados  y hundido en la miseria energ tica  los culpables no son putin y franco  lo eres t   que no tienes verg enza ,nachogonjerez,es,0,0,2012-02-24 22:21:17+00:00,113,False,1180,"Madrid, Comunidad de Madrid",,1504517495444672523
3888,2022-03-17 17:57:30+00:00,Rafa Hernando critica a Sánchez por despenalizar la acción de los piquetes ante la violencia en la huelga del transporte https://t.co/fhumxpAWyb,rafa hernando critica a s nchez por despenalizar la acci n de los piquetes ante la violencia en la huelga del transporte  ,ecd_,es,0,0,2009-04-28 15:31:22+00:00,93049,False,132209,"+34 91 445 96 97 Madrid, Spain",,1504517297523855366
3889,2022-03-17 17:57:28+00:00,"Cuando está en el gobierno la derecha, las huelgas las convoca la extrema izquierda. Cuando gobierna la izquierda, es la extrema derecha. https://t.co/dBl4V2QylJ",cuando est  en el gobierno la derecha  las huelgas las convoca la extrema izquierda  cuando gobierna la izquierda  es la extrema derecha   ,jmiguel,es,3,0,2007-03-29 07:28:53+00:00,788,False,3135,127.0.0.1 using 255.255.255.0,,1504517287923134471
3892,2022-03-17 17:57:12+00:00,RT @juanfernandodt: Máxima gravedad de la huelga del transporte. Feijóo urge a Sánchez a un dialogo inmediato con las plataformas que han c…, m xima gravedad de la huelga del transporte  feij o urge a s nchez a un dialogo inmediato con las plataformas que han c ,BelMarts1,es,0,1,2022-02-22 22:29:47+00:00,97,False,3640,,,1504517220734586884
