,Created_at,Text,Clean Text,Screen_Name,Lang,Favourite_count,Retweet_count,Fecha creacion,Followers,Verificado,Cantidad Fav,País,Coordenadas,ID
1045,2022-03-17 21:39:32+00:00,"RT @Javierpm67: El gobierno socialcomunista califica la huelga del transporte como fascista. 

¿Hasta cuándo vamos a permitir a estos sinve…", el gobierno socialcomunista califica la huelga del transporte como fascista     hasta cu ndo vamos a permitir a estos sinve ,Isa76_bcn,es,0,5,2014-07-30 10:21:28+00:00,692,False,30785,matrix ,,1504573171047014403
1046,2022-03-17 21:39:26+00:00,"RT @leobarezfer: ¿Donde están CCOO y UGT, ante la huelga del transporte y la crisis energética? No les concierne.
Son cosas de la ultradere…",  donde est n ccoo y ugt  ante la huelga del transporte y la crisis energ tica  no les concierne  son cosas de la ultradere ,IruzubietaIrene,es,0,1,2022-02-27 23:49:27+00:00,29,False,342,Madrid España ,,1504573147839873025
1050,2022-03-17 21:39:01+00:00,HUELGA DEL TRANSPORTE. “Vamos a emplear toda la contundencia” https://t.co/qUy2y52xFu,huelga del transporte   vamos a emplear toda la contundencia   ,Extremadura7D,es,1,1,2010-12-31 17:11:49+00:00,23047,False,21486,info@extremadura7dias.com,,1504573040696471557
1051,2022-03-17 21:38:49+00:00,RT @Boni_Anclaiz: Ruben le saca un whisky de Malta a Vega porque el vino siciliano seguramente no ha llegado por la huelga de transporte...…, ruben le saca un whisky de malta a vega porque el vino siciliano seguramente no ha llegado por la huelga de transporte    ,despistao1,es,0,2,2010-09-23 17:07:30+00:00,1540,False,185312,Cartagena ( Murcia),,1504572990796746755
1056,2022-03-17 21:38:36+00:00,"RT @HispaniaRevelde: El Gobierno califica la huelga de transporte de ""boicot alentado por la extrema derecha""
Primero culpaban a Franco, lu…", el gobierno califica la huelga de transporte de  boicot alentado por la extrema derecha  primero culpaban a franco  lu ,FmirandaJesus,es,0,15,2019-11-11 11:00:27+00:00,604,False,815,España,,1504572938057617410
1062,2022-03-17 21:38:06+00:00,Ruben le saca un whisky de Malta a Vega porque el vino siciliano seguramente no ha llegado por la huelga de transporte... #ServirYProteger,ruben le saca un whisky de malta a vega porque el vino siciliano seguramente no ha llegado por la huelga de transporte     serviryproteger,Boni_Anclaiz,es,5,2,2021-05-05 09:02:08+00:00,143,False,12489,,,1504572813042241537
1071,2022-03-17 21:37:28+00:00,"RT @Dracamaniacos: Condenar al sector lechero, pesca, acosar a los transportistas y dejar a la población sin existencias.

Vaya que la huel…", condenar al sector lechero  pesca  acosar a los transportistas y dejar a la poblaci n sin existencias   vaya que la huel ,estheryjulio,es,0,1,2012-01-06 20:42:20+00:00,1929,False,23373,"San Antonio de Benagéber, Espa",,1504572653901950976
1074,2022-03-17 21:37:19+00:00,RT @libertadzarautz: @mejoreszasca El mejor chiste del año es oír al gobierno decir que la huelga de transporte es un sabotaje de la ultrad…,   el mejor chiste del a o es o r al gobierno decir que la huelga de transporte es un sabotaje de la ultrad ,JVamosss,es,0,6,2019-03-08 23:02:52+00:00,307,False,41911,,,1504572613007392768
1085,2022-03-17 21:36:18+00:00,"RT @eitbNoticias: Mayoristas y supermercados no ven peligro de desabastecimiento, ya que solo escasean productos concretos https://t.co/1ga…", mayoristas y supermercados no ven peligro de desabastecimiento  ya que solo escasean productos concretos  ,eitbeus,es,0,2,2010-03-11 09:45:10+00:00,30275,True,598,,,1504572359704985600
1093,2022-03-17 21:35:30+00:00,"Condenar al sector lechero, pesca, acosar a los transportistas y dejar a la población sin existencias.

Vaya que la huelga de transporte era provocada por la ultraderecha, ahora ya encaja mejor. https://t.co/K3wlBkNo1U",condenar al sector lechero  pesca  acosar a los transportistas y dejar a la poblaci n sin existencias   vaya que la huelga de transporte era provocada por la ultraderecha  ahora ya encaja mejor   ,Dracamaniacos,es,1,1,2017-09-27 23:39:01+00:00,3028,False,23475,Xixón,,1504572155043930130
1094,2022-03-17 21:35:21+00:00,Camiones de Cofares y Bidafarma sufren ataques por la huelga de transporte https://t.co/YcnGLaUauz,camiones de cofares y bidafarma sufren ataques por la huelga de transporte  ,mz_182,es,0,3,2012-01-23 15:43:05+00:00,631,False,1049,"Bonares, España",,1504572118297686016
1105,2022-03-17 21:34:40+00:00,Quien va ganando en la huelga de transporte? Los camioneros nazis o los tuiteros con triangulito?.,quien va ganando en la huelga de transporte  los camioneros nazis o los tuiteros con triangulito  ,Michubichi1,es,0,0,2021-12-22 21:08:24+00:00,107,False,2485,"Madrid, Comunidad de Madrid",,1504571945806929929
1107,2022-03-17 21:34:34+00:00,"RT @RadioSevilla: Hoy hablamos #HoyporhoySevilla  de la huelga en el transporte, nos trasladamos a la frontera de #Ucrania con @grupo_samu…", hoy hablamos  hoyporhoysevilla  de la huelga en el transporte  nos trasladamos a la frontera de  ucrania con   samu ,Monsesoyfuego,es,0,51,2020-09-13 21:37:50+00:00,70,False,8385,,,1504571923191275526
1117,2022-03-17 21:33:34+00:00,"Los de la huelga de transportes andan jugando con fuego....primer aviso 

Mira esta noticia https://t.co/QPBR8LO7aO",los de la huelga de transportes andan jugando con fuego    primer aviso   mira esta noticia  ,piratadagaliza,es,1,0,2010-07-15 21:04:10+00:00,74,False,3911,"Lugo, Galicia",,1504571669633015818
1121,2022-03-17 21:33:14+00:00,"RT @babyflowcat: @JosPastr En los mercados centrales, ya empiezan a faltar tomates y pimientos. Pero la tv sigue callando ante la huelga de…",   en los mercados centrales  ya empiezan a faltar tomates y pimientos  pero la tv sigue callando ante la huelga de ,BelMarts1,es,0,7,2022-02-22 22:29:47+00:00,97,False,3640,,,1504571588515147778
1128,2022-03-17 21:32:36+00:00,"Patronales y sindicatos exigen al Gobierno ""contundencia"" ante la violencia en los paros del transporte @ElPeriodico_Esp https://t.co/6Mi1ysQjOq",patronales y sindicatos exigen al gobierno  contundencia  ante la violencia en los paros del transporte   esp  ,JuanRaeiros,es,0,0,2015-11-27 16:26:10+00:00,14397,False,79745,"O Grove,  Pontevedra - España",,1504571426619146247
1131,2022-03-17 21:32:18+00:00,RT @kinete21: Que dicen los sindicatos que la  huelga de transporte no tiene el paraguas legal de huelga. Una huelga que está movilizando a…, que dicen los sindicatos que la  huelga de transporte no tiene el paraguas legal de huelga  una huelga que est  movilizando a ,betiquer,es,0,2,2013-11-09 23:37:15+00:00,218,False,105165,,,1504571353197944837
1137,2022-03-17 21:31:58+00:00,"RT @AmadeoPetitbo: La ministra de transporte dice que la huelga es minoritaria, pero a continuación dice que se movilizan 15000 agentes. Al…", la ministra de transporte dice que la huelga es minoritaria  pero a continuaci n dice que se movilizan 15000 agentes  al ,BelMarts1,es,0,24,2022-02-22 22:29:47+00:00,97,False,3640,,,1504571266996527109
1148,2022-03-17 21:31:04+00:00,RT @garciadiego: @Marykar79970189 @Manolo67554861 @vickymp77 @raquelsjimenez @guardiacivil @policia @jucilnacional @jusapol @JupolNacional…,                   ,Manolo67554861,es,0,1,2020-01-18 13:28:59+00:00,3531,False,210451,,,1504571040248340480
1160,2022-03-17 21:30:27+00:00,@TLorka99 Que traten el gasoil del transporte como el del campo y ya veréis como se acaba la huelga.,  que traten el gasoil del transporte como el del campo y ya ver is como se acaba la huelga ,nocompresdemas,es,0,0,2021-04-08 14:08:40+00:00,17,False,4962,,,1504570885952397312
1164,2022-03-17 21:30:01+00:00,Problemas en el suministro de cerveza por la huelga de transporte https://t.co/JLEgpnfKN2,problemas en el suministro de cerveza por la huelga de transporte  ,lasprovincias,es,0,3,2008-11-25 12:22:35+00:00,198536,True,121,"Valencia, Spain",,1504570779161161729
1165,2022-03-17 21:30:00+00:00,Señalan que el coste actual del gas al trimestre es el doble de lo que en 2020 suponía todo el año https://t.co/MtAlOaxGUx,se alan que el coste actual del gas al trimestre es el doble de lo que en 2020 supon a todo el a o  ,elperiodic,es,0,0,2009-09-03 20:58:48+00:00,9228,False,535,"Comunidad Valenciana, España",,1504570773641433088
1166,2022-03-17 21:30:00+00:00,"La falta de pescado en los comercios, primera consecuencia del desabastecimiento por la huelga del transporte.

https://t.co/nWOLAefPGE",la falta de pescado en los comercios  primera consecuencia del desabastecimiento por la huelga del transporte    ,SERVitoria,es,0,0,2009-10-22 14:19:40+00:00,10712,False,556,Vitoria-Gasteiz,,1504570773637378050
1168,2022-03-17 21:29:54+00:00,Que dice @sanchezcastejon que la huelga de transporte es de la ultraderecha https://t.co/GzDpOCoVHq,que dice   que la huelga de transporte es de la ultraderecha  ,ATopeFeliz,es,67,25,2021-02-03 21:27:51+00:00,3061,False,20853,"Madrid, Comunidad de Madrid",,1504570748962320384
1171,2022-03-17 21:29:40+00:00,RT @elmundoes: Huelga del transporte: autónomos y pymes se enfrentan a la patronal  y paran de forma indefinida https://t.co/cJpcQqkhmH, huelga del transporte  aut nomos y pymes se enfrentan a la patronal  y paran de forma indefinida  ,Thefirstwoman__,es,0,811,2013-03-17 13:34:02+00:00,181,False,5191,En el paraíso ,,1504570689042493446
1174,2022-03-17 21:29:27+00:00,RT @RodrigoDdeV13: La misma huelga de transporte que no existe en los medios de comunicación., la misma huelga de transporte que no existe en los medios de comunicaci n ,Thefirstwoman__,es,0,25,2013-03-17 13:34:02+00:00,181,False,5191,En el paraíso ,,1504570632687824902
1179,2022-03-17 21:28:52+00:00,RT @Soniatwin72: . #preguntaseria Por qué no se habla en ningún sitio de la huelga de transporte? Gracias,    preguntaseria por qu  no se habla en ning n sitio de la huelga de transporte  gracias,davikit,es,0,14,2010-04-14 22:39:16+00:00,42,False,1186,,,1504570486503755776
1180,2022-03-17 21:28:51+00:00,"RT @okinakem: @JosPastr Acaban de decirlo en la secta, uno de los ""expertos"" de Ferreras, : ""la tensión en la huelga de transporte es culpa…",   acaban de decirlo en la secta  uno de los  expertos  de ferreras     la tensi n en la huelga de transporte es culpa ,SITARITA,es,0,6,2009-04-04 16:47:21+00:00,163,False,50753,,,1504570481554382851
1181,2022-03-17 21:28:48+00:00,"@iescolar @PabloIglesias 
""Buenos días a todos y sobre-todo a los trabajadores del transporte en huelga y a los piquetes. Sin vosotros no hay democracia""

#ultraderecha
#podemosCRIMINALES
#ComunismoEsMiseria https://t.co/kQNZ1fo5fV",      buenos d as a todos y sobre todo a los trabajadores del transporte en huelga y a los piquetes  sin vosotros no hay democracia    ultraderecha  podemoscriminales  comunismoesmiseria  ,del_norte_80,es,0,0,2021-04-26 16:58:48+00:00,108,False,21117,,,1504570472083636224
1182,2022-03-17 21:28:33+00:00,"RT @RAFAELD89244919: Y de todo los problemas ahora culpan a la extrema derecha de la huelga de los autónomos del transporte, el de los agri…", y de todo los problemas ahora culpan a la extrema derecha de la huelga de los aut nomos del transporte  el de los agri ,belesp73,es,0,1,2010-06-18 16:51:42+00:00,432,False,14685,ESPAÑA,,1504570408510664713
1183,2022-03-17 21:28:33+00:00,"El Gobierno califica la huelga del transporte de ""boicot alentado por la extrema derecha""

#MundoActual #España #huelgatransportistas #News #Noticias https://t.co/OaMjmpA5YP",el gobierno califica la huelga del transporte de  boicot alentado por la extrema derecha    mundoactual  espa a  huelgatransportistas  news  noticias  ,MundoActualESP,es,1,0,2021-09-21 09:02:22+00:00,459,False,905,,,1504570408074457093
1185,2022-03-17 21:28:27+00:00,RT @CarolinaEspanaR: Problemas con algunos productos por la huelga de transporte y el Gobierno quiere esperar 2 semanas para bajar impuesto…, problemas con algunos productos por la huelga de transporte y el gobierno quiere esperar 2 semanas para bajar impuesto ,LourdesCuesta,es,0,11,2011-02-10 19:43:28+00:00,473,False,8042,"Collado Villalba, España",,1504570381146853376
1187,2022-03-17 21:28:20+00:00,"RT @esRadio_CyL: Informativo 13.40 🎙️ 
🔹 Huelga en el transporte para decir basta ya a la subida de impuestos. 
🔹 La industria láctea paral…", informativo 13 40       huelga en el transporte para decir basta ya a la subida de impuestos     la industria l ctea paral ,fcarreracastro,es,0,1,2012-04-15 16:45:13+00:00,1679,False,8308,Valladolid,,1504570352206286851
1188,2022-03-17 21:28:19+00:00,"RT @smc22001E: Si Sánchez hiciera lo mismo que Alemania con la musa de fascismo española, la ultraderecha se lo pensaría dos veces antes de…", si s nchez hiciera lo mismo que alemania con la musa de fascismo espa ola  la ultraderecha se lo pensar a dos veces antes de ,mjosevegarodri1,es,0,1,2015-02-21 16:16:33+00:00,562,False,6583,"Sevilla, Andalucía",,1504570347403763722
1190,2022-03-17 21:28:00+00:00,"Las consecuencias de la huelga del transporte, comienza a tirarse pescado y cese de abastecimiento de agua mineral.

https://t.co/gmowRqtQsl

#LoMasVisto",las consecuencias de la huelga del transporte  comienza a tirarse pescado y cese de abastecimiento de agua mineral       lomasvisto,idealgallego,es,1,0,2011-11-23 09:07:28+00:00,16359,False,322,A Coruña,,1504570268571693057
1205,2022-03-17 21:26:39+00:00,"RT @MediterraneoDGT: ¿Problemas en España? ¿Se dispara el precio de la luz? ¿La gasolina? ¿Huelga de transporte?

💥 ¡Comodín de los progres…",  problemas en espa a   se dispara el precio de la luz   la gasolina   huelga de transporte      comod n de los progres ,enrike_lopez99,es,0,16,2014-01-16 21:11:55+00:00,36,False,9705,,,1504569927935664130
1211,2022-03-17 21:26:19+00:00,@Marykar79970189 @Manolo67554861 @vickymp77 @raquelsjimenez @guardiacivil @policia @jucilnacional @jusapol @JupolNacional @Sup_Policia La huelga es un derecho fundamental de los trabajadores por cuenta ajena. Este derecho NO es extensible a los llamados autopatronos o autónomos del transporte.,                    policia la huelga es un derecho fundamental de los trabajadores por cuenta ajena  este derecho no es extensible a los llamados autopatronos o aut nomos del transporte ,garciadiego,es,2,1,2011-03-03 16:12:23+00:00,2888,False,30236,cantabria,,1504569844905254918
1229,2022-03-17 21:25:12+00:00,RT @Nokb1tontomas: Ahora la huelga de transporte es cosa de ultraderechistas. Este gobierno ya empieza a sonar a gobierno de República bana…, ahora la huelga de transporte es cosa de ultraderechistas  este gobierno ya empieza a sonar a gobierno de rep blica bana ,belesp73,es,0,2,2010-06-18 16:51:42+00:00,432,False,14685,ESPAÑA,,1504569565094813701
1234,2022-03-17 21:24:46+00:00,"RT @XuanCandano: La huelga del transporte no la ha organizado la extrema derecha, sino transportistas al borde de la rentabilidad por el pr…", la huelga del transporte no la ha organizado la extrema derecha  sino transportistas al borde de la rentabilidad por el pr ,Josetapiag,es,0,6,2012-04-01 19:27:07+00:00,106,False,12553,"Aqui y alla, que mas da!,no?",,1504569457158639623
1237,2022-03-17 21:24:41+00:00,"RT @RLCar34: El cierre patronal de las fábricas de leche no tiene explicación. 
O si. 
Es la primera vez que por una huelga de transporte (…", el cierre patronal de las f bricas de leche no tiene explicaci n   o si   es la primera vez que por una huelga de transporte   ,LuisaCollantes1,es,0,23,2017-09-06 07:46:49+00:00,95,False,15371,Cantabria,,1504569433972477961
1241,2022-03-17 21:24:17+00:00,RT @lajornadaonline: #VideosLaJornada El sector de alimentación en #España está sufriendo las consecuencias de la huelga de transportes con…,  videoslajornada el sector de alimentaci n en  espa a est  sufriendo las consecuencias de la huelga de transportes con ,azcarlos2,es,0,2,2010-11-22 03:41:07+00:00,305,False,104434,Tres Valles,,1504569332746973201
1258,2022-03-17 21:22:55+00:00,RT @FernanSola: Esta tarde me ha dado por entrar a cuatro medios digitales para ver si me informaba sobre la huelga del transporte y me ha…, esta tarde me ha dado por entrar a cuatro medios digitales para ver si me informaba sobre la huelga del transporte y me ha ,belesp73,es,0,3,2010-06-18 16:51:42+00:00,432,False,14685,ESPAÑA,,1504568990693220362
1259,2022-03-17 21:22:55+00:00,"Esto se está poniendo serio...

https://t.co/QCUetCdpoA",esto se est  poniendo serio      ,Heilung88,es,0,0,2021-08-21 14:25:01+00:00,423,False,4867,,,1504568990605221888
1279,2022-03-17 21:21:47+00:00,"RT @ajusteag: @janogarcia_ No, Jano, qué va a ser de ultraderecha. El portavoz de la huelga es así moderadito, como tú:

https://t.co/2KTji…",    no  jano  qu  va a ser de ultraderecha  el portavoz de la huelga es as  moderadito  como t     ,Ziracu,es,0,5,2019-02-24 14:14:41+00:00,1704,False,62761,"Cádiz, España",,1504568704302043139
1285,2022-03-17 21:21:22+00:00,"Uno de los responsables de la huelga del transporte dice que sus problemas vienen desde hace 21 años. Pero, curiosamente, no pueden esperar una semana más a que el Gobierno comunique su plan de choque sobre los precios de los carburantes, luz, etc.
Es una huelga que HUELE MUY MAL",uno de los responsables de la huelga del transporte dice que sus problemas vienen desde hace 21 a os  pero  curiosamente  no pueden esperar una semana m s a que el gobierno comunique su plan de choque sobre los precios de los carburantes  luz  etc  es una huelga que huele muy mal,juan09r,es,14,6,2011-05-15 15:16:04+00:00,305,False,4626,,,1504568601180786689
1290,2022-03-17 21:20:52+00:00,@europapress Estamos asistiendo a un hecho historico en la reciente historia de España. Se ha convocado un huelga de transporte por carretera con bastante exito y SIN LOS SINDICATOS. Despues de esta huelga los sindicatos actuales tienen que DESAPARECER y crear sindicatos libres no subvencion.,  estamos asistiendo a un hecho historico en la reciente historia de espa a  se ha convocado un huelga de transporte por carretera con bastante exito y sin los sindicatos  despues de esta huelga los sindicatos actuales tienen que desaparecer y crear sindicatos libres no subvencion ,pjsegado,es,7,2,2012-04-13 21:56:25+00:00,116,False,6766,,,1504568472633847811
1293,2022-03-17 21:20:42+00:00,"RT @jucilnacional: Continuan los piquetes por la huelga del transporte.

#HuelgaTransporte https://t.co/taAbxikEwD", continuan los piquetes por la huelga del transporte    huelgatransporte  ,jucilpalencia,es,0,36,2018-04-09 17:29:09+00:00,1657,False,42541,,,1504568432527876110
1299,2022-03-17 21:20:12+00:00,RT @XicuValledor: Creo que la ministra de transporte se equivoca gravemente despachando la huelga del transporte como fruto de la violencia…, creo que la ministra de transporte se equivoca gravemente despachando la huelga del transporte como fruto de la violencia ,Faciendo_,es,0,1,2014-01-31 22:18:00+00:00,1005,False,88457,Asturies,,1504568308263178240
1300,2022-03-17 21:20:08+00:00,"RT @elprogramadear: Un ganadero cuenta cómo se resiente el sector por la huelga de transporte: ""No habrá leche, tenemos que matar a vacas d…", un ganadero cuenta c mo se resiente el sector por la huelga de transporte   no habr  leche  tenemos que matar a vacas d ,SorayaMiguez,es,0,8,2015-06-05 00:10:16+00:00,54,False,12327,,,1504568290764640261
1301,2022-03-17 21:20:06+00:00,"@DebatAlRojoVivo Ferreras dice que habrá desabastecimiento por los piquetes del paro del transporte.

Dirías la misma frase si gobernase el PP.

Y por decir la frasecita  15000000 millones de euros nebulean por el plató.

LA HUELGA LA CONTEMPLA LA CONSTITUCIÓN : DEFENDERLA...",  ferreras dice que habr  desabastecimiento por los piquetes del paro del transporte   dir as la misma frase si gobernase el pp   y por decir la frasecita  15000000 millones de euros nebulean por el plat    la huelga la contempla la constituci n   defenderla   ,PedroFe09604647,es,0,0,2016-05-20 23:34:53+00:00,20,False,103,,,1504568280861880328
1303,2022-03-17 21:20:00+00:00,"#VideosLaJornada El sector de alimentación en #España está sufriendo las consecuencias de la huelga de transportes convocada por la Plataforma de Defensa del Sector del Transporte de Mercancías por Carretera. Una de las industrias afectadas es la láctea.

https://t.co/JkIjDrWc76", videoslajornada el sector de alimentaci n en  espa a est  sufriendo las consecuencias de la huelga de transportes convocada por la plataforma de defensa del sector del transporte de mercanc as por carretera  una de las industrias afectadas es la l ctea    ,lajornadaonline,es,13,2,2009-04-28 03:40:43+00:00,2703892,True,168,México,,1504568255616208896
1304,2022-03-17 21:19:48+00:00,"RT @Alc_rey: No tienen límite, esto cada día se parece más  una dictadura.
Decir que la #huelgadetransportes  está alentada por la ultrader…", no tienen l mite  esto cada d a se parece m s  una dictadura  decir que la  huelgadetransportes  est  alentada por la ultrader ,juanisa00871300,es,0,2,2020-10-15 20:24:22+00:00,575,False,120301,,,1504568205620224012
1308,2022-03-17 21:19:34+00:00,"Bueno...yo creo que esto de la huelga del Transporte hay que empezar a tomárselo muy pero que muy en serio..

👇👇👇 https://t.co/05XXWYxbnX",bueno   yo creo que esto de la huelga del transporte hay que empezar a tom rselo muy pero que muy en serio         ,Don_Zippotonw,es,2,0,2021-08-17 19:14:40+00:00,897,False,8109,Fascist State (Spain),,1504568146107244544
1310,2022-03-17 21:19:28+00:00,"RT @Frankygoes1963: Ahora dicen que la ""Ultraderecha"" es la causante de la huelga del transporte. Pues yo estoy seguro de que lo son los ""U…", ahora dicen que la  ultraderecha  es la causante de la huelga del transporte  pues yo estoy seguro de que lo son los  u ,belesp73,es,0,1,2010-06-18 16:51:42+00:00,432,False,14685,ESPAÑA,,1504568124061982728
1314,2022-03-17 21:19:12+00:00,"La energía sube por culpa de Putin, la huelga de transporte de la ultraderecha...y así todo, a ver cuándo aprendemos que Pedro no tiene culpa de nada, salvo de ser guapo.",la energ a sube por culpa de putin  la huelga de transporte de la ultraderecha   y as  todo  a ver cu ndo aprendemos que pedro no tiene culpa de nada  salvo de ser guapo ,valandilpa,es,4,1,2011-06-29 12:38:04+00:00,203,False,2454,,,1504568055686434823
1325,2022-03-17 21:17:48+00:00,"Si Sánchez hiciera lo mismo que Alemania con la musa de fascismo española, la ultraderecha se lo pensaría dos veces antes de crear disturbios con los de la huelga del transporte.",si s nchez hiciera lo mismo que alemania con la musa de fascismo espa ola  la ultraderecha se lo pensar a dos veces antes de crear disturbios con los de la huelga del transporte ,smc22001E,es,0,1,2011-05-17 21:50:11+00:00,8,False,214,España,,1504567703587201028
1328,2022-03-17 21:17:43+00:00,"El Gobierno echa la culpa a la 'extrema derecha' de la huelga de transporte. Dice que existe un boicot.

Vamos, que Putin y la 'extrema derecha' tienen la culpa de todo lo que está pasando.

Irene Montero ya acusó hace unos años de machista al 'Cambio Climático'. https://t.co/54JQWnrIXQ",el gobierno echa la culpa a la  extrema derecha  de la huelga de transporte  dice que existe un boicot   vamos  que putin y la  extrema derecha  tienen la culpa de todo lo que est  pasando   irene montero ya acus  hace unos a os de machista al  cambio clim tico    ,NCamporro,es,27,13,2017-07-10 06:58:39+00:00,4646,False,7664,🇪🇸 Oviedo / Valencia 🇪🇸,,1504567680585584644
1343,2022-03-17 21:16:20+00:00,"RT @RamonmsMATA: LA HUELGA DE TRANSPORTE APOYADA POR UGT CCOO, (sic..) Y EL GOBIERNO LANZA A SUS PERROS A LADRAR EN LAS TVS
https://t.co/pb…", la huelga de transporte apoyada por ugt ccoo   sic    y el gobierno lanza a sus perros a ladrar en las tvs  ,belesp73,es,0,1,2010-06-18 16:51:42+00:00,432,False,14685,ESPAÑA,,1504567332944941059
1347,2022-03-17 21:15:47+00:00,"RT @Viryux: @mejoreszasca @La_SER El sector pesquero también se había puesto en huelga, pero queda mejor decir q es x una huelga ""ilegal"" d…",     ser el sector pesquero tambi n se hab a puesto en huelga  pero queda mejor decir q es x una huelga  ilegal  d ,cantaber,es,0,1,2010-06-10 15:59:54+00:00,31,False,3518,,,1504567194365186053
1355,2022-03-17 21:15:10+00:00,RT @asun691: @solidaridad_esp Hay huelga indefinida de transporte a partir del lunes. No sabéis nada porque las asociaciones de grandes ope…,   esp hay huelga indefinida de transporte a partir del lunes  no sab is nada porque las asociaciones de grandes ope ,MiguelngelCame1,es,0,1,2022-02-20 13:34:36+00:00,3,False,137,,,1504567042099269638
1360,2022-03-17 21:14:37+00:00,"HUELGA DE TRANSPORTE | El sector lácteo de Hego Euskal Herria trabaja para comercializar sus productos y llama a la tranquilidad
https://t.co/yMkkwVXCRW",huelga de transporte   el sector l cteo de hego euskal herria trabaja para comercializar sus productos y llama a la tranquilidad  ,eitbNoticias,es,0,5,2009-03-26 11:31:51+00:00,153984,True,121,,,1504566903192395781
1365,2022-03-17 21:14:08+00:00,Vergonzoso y peligroso que el Gobierno tache no ya de extremistas sino como ultras a los trabajadores del transporte que han decidido ir a la huelga. No se puede criminalizar a estos trabajadores como se esta haciendo. Es inaceptable. https://t.co/KkmUStNOB5,vergonzoso y peligroso que el gobierno tache no ya de extremistas sino como ultras a los trabajadores del transporte que han decidido ir a la huelga  no se puede criminalizar a estos trabajadores como se esta haciendo  es inaceptable   ,jaime_eu_,es,1,0,2017-12-21 10:54:22+00:00,710,False,8344,Madrid,,1504566780185952264
1372,2022-03-17 21:13:12+00:00,Ahora la culpa de la huelga del transporte es de la extrema derecha... pero son minoritarios.,ahora la culpa de la huelga del transporte es de la extrema derecha    pero son minoritarios ,jartible_el,es,0,0,2019-11-03 17:43:22+00:00,0,False,7,España,,1504566544541663233
